X Lossless Decoder version 20181019 (151.1)

XLD extraction logfile from 2019-03-24 02:23:35 +0100

Die drei Fragezeichen / 112 - Schlucht der Dämonen

Used drive : ASUS BW-16D1HT (revision 3.01)
Media type : Pressed CD

Ripper mode             : XLD Secure Ripper
Disable audio cache     : OK for the drive with a cache less than 1375KiB
Make use of C2 pointers : NO
Read offset correction  : 6
Max retry count         : 40
Gap status              : Analyzed, Appended

TOC of the extracted CD
     Track |   Start  |  Length  | Start sector | End sector 
    ---------------------------------------------------------
        1  | 00:00:00 | 02:44:39 |         0    |    12338   
        2  | 02:44:39 | 05:04:32 |     12339    |    35170   
        3  | 07:48:71 | 02:53:70 |     35171    |    48215   
        4  | 10:42:66 | 01:24:09 |     48216    |    54524   
        5  | 12:07:00 | 08:56:69 |     54525    |    94793   
        6  | 21:03:69 | 02:31:38 |     94794    |   106156   
        7  | 23:35:32 | 07:24:19 |    106157    |   139475   
        8  | 30:59:51 | 01:34:27 |    139476    |   146552   
        9  | 32:34:03 | 04:22:40 |    146553    |   166242   
       10  | 36:56:43 | 04:57:48 |    166243    |   188565   
       11  | 41:54:16 | 03:15:47 |    188566    |   203237   
       12  | 45:09:63 | 02:35:23 |    203238    |   214885   
       13  | 47:45:11 | 11:04:39 |    214886    |   264724   

AccurateRip Summary (DiscID: 00198e89-0103aaa5-b70dc90d)
    Track 01 : OK (v1+v2, confidence 75/75)
    Track 02 : OK (v1+v2, confidence 74/74)
    Track 03 : OK (v1+v2, confidence 73/73)
    Track 04 : OK (v1+v2, confidence 75/75)
    Track 05 : OK (v1+v2, confidence 74/74)
    Track 06 : OK (v1+v2, confidence 74/74)
    Track 07 : OK (v1+v2, confidence 73/73)
    Track 08 : OK (v1+v2, confidence 75/75)
    Track 09 : OK (v1+v2, confidence 75/75)
    Track 10 : OK (v1+v2, confidence 75/75)
    Track 11 : OK (v1+v2, confidence 74/74)
    Track 12 : OK (v1+v2, confidence 74/74)
    Track 13 : OK (v1+v2, confidence 69/69)
        ->All tracks accurately ripped.

All Tracks
    Filename : ~/Projects/Audiobooks/_temp/112 - Schlucht der Dämonen.m4a
    CRC32 hash               : 12BCC323
    CRC32 hash (skip zero)   : 57C289E9
    Statistics
        Read error                           : 0
        Jitter error (maybe fixed)           : 0
        Retry sector count                   : 0
        Damaged sector count                 : 0

Track 01
    Pre-gap length : 00:02:00

    CRC32 hash               : 3D5D7599
    CRC32 hash (skip zero)   : 4382F358
    AccurateRip v1 signature : 30F0D369
    AccurateRip v2 signature : 31675910
        ->Accurately ripped (v1+v2, confidence 26+49/75)
    Statistics
        Read error                           : 0
        Jitter error (maybe fixed)           : 0
        Retry sector count                   : 0
        Damaged sector count                 : 0

Track 02

    CRC32 hash               : F034BA30
    CRC32 hash (skip zero)   : 600A5191
    AccurateRip v1 signature : 8F4B95C0
    AccurateRip v2 signature : E92AAB7C
        ->Accurately ripped (v1+v2, confidence 25+49/74)
    Statistics
        Read error                           : 0
        Jitter error (maybe fixed)           : 0
        Retry sector count                   : 0
        Damaged sector count                 : 0

Track 03

    CRC32 hash               : 54000292
    CRC32 hash (skip zero)   : 5FC6B569
    AccurateRip v1 signature : 6C52A603
    AccurateRip v2 signature : 28B73E0A
        ->Accurately ripped (v1+v2, confidence 24+49/73)
    Statistics
        Read error                           : 0
        Jitter error (maybe fixed)           : 0
        Retry sector count                   : 0
        Damaged sector count                 : 0

Track 04

    CRC32 hash               : 42CB44E9
    CRC32 hash (skip zero)   : C5A1C57D
    AccurateRip v1 signature : 89B79EC0
    AccurateRip v2 signature : CDCF2EF0
        ->Accurately ripped (v1+v2, confidence 26+49/75)
    Statistics
        Read error                           : 0
        Jitter error (maybe fixed)           : 0
        Retry sector count                   : 0
        Damaged sector count                 : 0

Track 05

    CRC32 hash               : 2C309F7D
    CRC32 hash (skip zero)   : EA399E8B
    AccurateRip v1 signature : 226AB070
    AccurateRip v2 signature : 1876F55E
        ->Accurately ripped (v1+v2, confidence 25+49/74)
    Statistics
        Read error                           : 0
        Jitter error (maybe fixed)           : 0
        Retry sector count                   : 0
        Damaged sector count                 : 0

Track 06

    CRC32 hash               : 29DDA883
    CRC32 hash (skip zero)   : 12F47AAE
    AccurateRip v1 signature : 4ECFE48A
    AccurateRip v2 signature : 97AFA04D
        ->Accurately ripped (v1+v2, confidence 26+48/74)
    Statistics
        Read error                           : 0
        Jitter error (maybe fixed)           : 0
        Retry sector count                   : 0
        Damaged sector count                 : 0

Track 07

    CRC32 hash               : 2AAEE0FF
    CRC32 hash (skip zero)   : D1E2959C
    AccurateRip v1 signature : 0E32A4B3
    AccurateRip v2 signature : C6019BE7
        ->Accurately ripped (v1+v2, confidence 25+48/73)
    Statistics
        Read error                           : 0
        Jitter error (maybe fixed)           : 0
        Retry sector count                   : 0
        Damaged sector count                 : 0

Track 08

    CRC32 hash               : 188D2497
    CRC32 hash (skip zero)   : 4E38CF9F
    AccurateRip v1 signature : 4FF5E436
    AccurateRip v2 signature : 856982A7
        ->Accurately ripped (v1+v2, confidence 26+49/75)
    Statistics
        Read error                           : 0
        Jitter error (maybe fixed)           : 0
        Retry sector count                   : 0
        Damaged sector count                 : 0

Track 09

    CRC32 hash               : 5473B4D3
    CRC32 hash (skip zero)   : 18424699
    AccurateRip v1 signature : F7C9D3C5
    AccurateRip v2 signature : 8F042AA9
        ->Accurately ripped (v1+v2, confidence 26+49/75)
    Statistics
        Read error                           : 0
        Jitter error (maybe fixed)           : 0
        Retry sector count                   : 0
        Damaged sector count                 : 0

Track 10

    CRC32 hash               : 81893379
    CRC32 hash (skip zero)   : F2C105DF
    AccurateRip v1 signature : 5A69C897
    AccurateRip v2 signature : 35CE125A
        ->Accurately ripped (v1+v2, confidence 26+49/75)
    Statistics
        Read error                           : 0
        Jitter error (maybe fixed)           : 0
        Retry sector count                   : 0
        Damaged sector count                 : 0

Track 11

    CRC32 hash               : D97D86CD
    CRC32 hash (skip zero)   : 40DF0F97
    AccurateRip v1 signature : 52CF10E1
    AccurateRip v2 signature : E2206201
        ->Accurately ripped (v1+v2, confidence 26+48/74)
    Statistics
        Read error                           : 0
        Jitter error (maybe fixed)           : 0
        Retry sector count                   : 0
        Damaged sector count                 : 0

Track 12

    CRC32 hash               : A017B829
    CRC32 hash (skip zero)   : B53C5DF0
    AccurateRip v1 signature : 44316F66
    AccurateRip v2 signature : 895B01CE
        ->Accurately ripped (v1+v2, confidence 25+49/74)
    Statistics
        Read error                           : 0
        Jitter error (maybe fixed)           : 0
        Retry sector count                   : 0
        Damaged sector count                 : 0

Track 13

    CRC32 hash               : B3532BC7
    CRC32 hash (skip zero)   : 68000290
    AccurateRip v1 signature : AA8E6A6E
    AccurateRip v2 signature : CA6A5A82
        ->Accurately ripped (v1+v2, confidence 24+45/69)
    Statistics
        Read error                           : 0
        Jitter error (maybe fixed)           : 0
        Retry sector count                   : 0
        Damaged sector count                 : 0

No errors occurred

End of status report
