X Lossless Decoder version 20181019 (151.1)

XLD extraction logfile from 2019-03-23 15:15:52 +0100

Die drei ??? / 117 - Der finstere Rivale

Used drive : ASUS BW-16D1HT (revision 3.01)
Media type : Pressed CD

Ripper mode             : XLD Secure Ripper
Disable audio cache     : OK for the drive with a cache less than 1375KiB
Make use of C2 pointers : NO
Read offset correction  : 6
Max retry count         : 40
Gap status              : Analyzed, Appended

TOC of the extracted CD
     Track |   Start  |  Length  | Start sector | End sector 
    ---------------------------------------------------------
        1  | 00:00:00 | 10:32:54 |         0    |    47453   
        2  | 10:32:54 | 03:24:14 |     47454    |    62767   
        3  | 13:56:68 | 05:34:25 |     62768    |    87842   
        4  | 19:31:18 | 09:45:26 |     87843    |   131743   
        5  | 29:16:44 | 10:00:16 |    131744    |   176759   
        6  | 39:16:60 | 02:31:24 |    176760    |   188108   
        7  | 41:48:09 | 01:33:24 |    188109    |   195107   
        8  | 43:21:33 | 07:43:74 |    195108    |   229906   
        9  | 51:05:32 | 02:10:69 |    229907    |   239725   
       10  | 53:16:26 | 02:53:61 |    239726    |   252761   
       11  | 56:10:12 | 04:29:65 |    252762    |   273001   

AccurateRip Summary (DiscID: 001cc3ff-00f06451-9c0e380b)
    Track 01 : OK (v1+v2, confidence 46/46)
    Track 02 : OK (v1+v2, confidence 50/50)
    Track 03 : OK (v1+v2, confidence 50/50)
    Track 04 : OK (v1+v2, confidence 49/49)
    Track 05 : OK (v1+v2, confidence 51/51)
    Track 06 : OK (v1+v2, confidence 51/51)
    Track 07 : OK (v1+v2, confidence 51/51)
    Track 08 : OK (v1+v2, confidence 49/49)
    Track 09 : OK (v1+v2, confidence 51/51)
    Track 10 : OK (v1+v2, confidence 51/51)
    Track 11 : OK (v1+v2, confidence 49/49)
        ->All tracks accurately ripped.

All Tracks
    Filename : ~/Projects/Audiobooks/_temp/117 - Der finstere Rivale.m4a
    CRC32 hash               : D92A3A15
    CRC32 hash (skip zero)   : F67FF3FC
    Statistics
        Read error                           : 0
        Jitter error (maybe fixed)           : 0
        Retry sector count                   : 0
        Damaged sector count                 : 0

Track 01
    Pre-gap length : 00:02:00

    CRC32 hash               : 5A3ADDF6
    CRC32 hash (skip zero)   : 959436CC
    AccurateRip v1 signature : 6307A119
    AccurateRip v2 signature : 26BE2F75
        ->Accurately ripped (v1+v2, confidence 23+23/46)
    Statistics
        Read error                           : 0
        Jitter error (maybe fixed)           : 0
        Retry sector count                   : 0
        Damaged sector count                 : 0

Track 02

    CRC32 hash               : 6098C875
    CRC32 hash (skip zero)   : 33AAC641
    AccurateRip v1 signature : 6159C082
    AccurateRip v2 signature : EECBFBE1
        ->Accurately ripped (v1+v2, confidence 25+25/50)
    Statistics
        Read error                           : 0
        Jitter error (maybe fixed)           : 0
        Retry sector count                   : 0
        Damaged sector count                 : 0

Track 03

    CRC32 hash               : 46DD9DAC
    CRC32 hash (skip zero)   : 05568FB6
    AccurateRip v1 signature : 198BB3C4
    AccurateRip v2 signature : 7C9E3F00
        ->Accurately ripped (v1+v2, confidence 25+25/50)
    Statistics
        Read error                           : 0
        Jitter error (maybe fixed)           : 0
        Retry sector count                   : 0
        Damaged sector count                 : 0

Track 04

    CRC32 hash               : 9CD28FB7
    CRC32 hash (skip zero)   : 5A9141C1
    AccurateRip v1 signature : FF612F45
    AccurateRip v2 signature : C880ECEC
        ->Accurately ripped (v1+v2, confidence 24+25/49)
    Statistics
        Read error                           : 0
        Jitter error (maybe fixed)           : 0
        Retry sector count                   : 0
        Damaged sector count                 : 0

Track 05

    CRC32 hash               : 2C625681
    CRC32 hash (skip zero)   : 18423F5F
    AccurateRip v1 signature : D60CFB08
    AccurateRip v2 signature : E36579EA
        ->Accurately ripped (v1+v2, confidence 25+26/51)
    Statistics
        Read error                           : 0
        Jitter error (maybe fixed)           : 0
        Retry sector count                   : 0
        Damaged sector count                 : 0

Track 06

    CRC32 hash               : 26E70B03
    CRC32 hash (skip zero)   : FA5E9F59
    AccurateRip v1 signature : 48335DFF
    AccurateRip v2 signature : 9FD0D64B
        ->Accurately ripped (v1+v2, confidence 25+26/51)
    Statistics
        Read error                           : 0
        Jitter error (maybe fixed)           : 0
        Retry sector count                   : 0
        Damaged sector count                 : 0

Track 07

    CRC32 hash               : 0626610E
    CRC32 hash (skip zero)   : 97AA518E
    AccurateRip v1 signature : 0FA2E634
    AccurateRip v2 signature : BB408010
        ->Accurately ripped (v1+v2, confidence 25+26/51)
    Statistics
        Read error                           : 0
        Jitter error (maybe fixed)           : 0
        Retry sector count                   : 0
        Damaged sector count                 : 0

Track 08

    CRC32 hash               : F0047D05
    CRC32 hash (skip zero)   : AC06D02F
    AccurateRip v1 signature : A9D3F726
    AccurateRip v2 signature : AFA52D77
        ->Accurately ripped (v1+v2, confidence 24+25/49)
    Statistics
        Read error                           : 0
        Jitter error (maybe fixed)           : 0
        Retry sector count                   : 0
        Damaged sector count                 : 0

Track 09

    CRC32 hash               : E50E51FD
    CRC32 hash (skip zero)   : 047DB0CE
    AccurateRip v1 signature : C90F6479
    AccurateRip v2 signature : B65AEC3C
        ->Accurately ripped (v1+v2, confidence 25+26/51)
    Statistics
        Read error                           : 0
        Jitter error (maybe fixed)           : 0
        Retry sector count                   : 0
        Damaged sector count                 : 0

Track 10

    CRC32 hash               : A7C9033A
    CRC32 hash (skip zero)   : 08B2FFC7
    AccurateRip v1 signature : AF056F47
    AccurateRip v2 signature : F93F46CE
        ->Accurately ripped (v1+v2, confidence 25+26/51)
    Statistics
        Read error                           : 0
        Jitter error (maybe fixed)           : 0
        Retry sector count                   : 0
        Damaged sector count                 : 0

Track 11

    CRC32 hash               : 5D067B77
    CRC32 hash (skip zero)   : 04E2E3E3
    AccurateRip v1 signature : A1A30249
    AccurateRip v2 signature : 46B9BD33
        ->Accurately ripped (v1+v2, confidence 23+26/49)
    Statistics
        Read error                           : 0
        Jitter error (maybe fixed)           : 0
        Retry sector count                   : 0
        Damaged sector count                 : 0

No errors occurred

End of status report
