hörspielID	titel	kurzbeschreibung	beschreibung	metabeschreibung	veröffentlichungsdatum	unvollständig	cover	urlCoverApple	urlCoverKosmos	urlDreifragezeichen	idAppleMusic	idSpotify	idBookbeat	idAmazonMusic	idAmazon	idYouTubeMusic
285	Kreaturen der Nacht		Hexe, Gruselclown, Werwolf und ein todbringender Sensenmann – so verkleidet sitzt eine bekannte Hip-Hop-Band bei einem Nachwuchs-Musikfestival in Rocky Beach in der Jury. Kann es Zufall sein, dass gleichzeitig solch dunkle Gestalten ihr kriminelles Unwesen im schönen Küstenort treiben? Umzingelt von Kreaturen der Nacht stolpern die drei ??? in ihren nächsten Fall.		2021-03-12	false	1	http://a1.mzstatic.com/us/r30/Music114/v4/c8/c9/90/c8c99025-0e8b-1ffd-12f3-f664fb75e124/source		https://dreifragezeichen.de/produktwelt/details/kreaturen-der-nacht-1	1543186727	0q4FbI22wSMrzgWh5vgHi9	534801	B08PKZ38BM	B08PJJHXMW	MPREb_fLyw4YTKVbT
286	und die schweigende Grotte		Die verfallene Ruine des einstigen Sanatoriums lädt Justus, Peter und Bob zum Abenteuerausflug ein. Das bröckelige Gemäuer und die verschüttete Grotte darunter hat seit Jahren niemand mehr betreten. Die drei ??? gelangen in das verlassene Gebäude und finden eine verschlossene Kiste mit unerwartetem Inhalt. Sind sie etwa doch nicht allein?		2021-06-11	false	1	http://a1.mzstatic.com/us/r30/Music114/v4/aa/4f/af/aa4faf88-6890-65f9-e72e-4d76e753a22e/source		https://dreifragezeichen.de/produktwelt/details/die-schweigende-grotte	1555455044	3ieWqOL150wJOcft7iZHKZ	530260	B08XJRFG5G	B08VTWDX88	MPREb_grVKTPg4o4W
287	und der Jadekönig		Haben die drei ??? etwas mit dem Diebstahl des "Jadekönigs" zu tun? Eine der wertvollsten Briefmarken der Welt ist verschwunden. Auf der Suche geraten die Detektive mitten hinein in ein lang gehütetes Familiengeheimnis. Können Justus, Peter und Bob den Jadekönig retten – oder werden sie sich an diesem Fall die Finger verbrennen?		2021-07-16	false	1	http://a1.mzstatic.com/us/r30/Music115/v4/b9/49/4f/b9494ff8-0fff-45c3-609b-1aef8010d5d1/source		https://dreifragezeichen.de/produktwelt/details/und-der-jadekonig-1	1569609366	7pZotNNAYOkeHNvJRKzYRk	542462	B095Z1MNWM	B0923ZXVBV	MPREb_HukcGnTxtRX
288	und der weiße Leopard		Der "weiße Leopard" wird streng bewacht! Kein Einbrecher dieser Welt kann die wertvolle japanische Prunkschale stehlen. Ein unüberwindbares Sicherheitssystem schützt den Schatz. Doch plötzlich ist die edle Schale aus dem 17. Jahrhundert verschwunden. Ein brisanter Fall für die drei ???, denn auf der Schale liegt ein Fluch der Samurai …		2021-09-17	false	1	http://a1.mzstatic.com/us/r30/Music125/v4/92/05/66/92056605-b0d2-8a87-f9e9-50b15cb8d847/source		https://dreifragezeichen.de/produktwelt/details/der-weisse-leopard	1575573696	2zHMeFNQQxKOmUgmppOjIM	571004	B098PDRJP6	B095GJ5P26	MPREb_qAIR8oYBPRT
289	Der Fluch der Medusa		Ein Brief mit einer unverständlichen Abfolge von Buchstaben und Zahlen – Jojo weiß mit dieser kryptischen Botschaft nichts anzufangen. Dabei möchte er doch unbedingt herausfinden, wo sein Vater ist. Der bekannte Enthüllungsjournalist ist auf einer Recherchereise verschwunden. Die drei ??? geraten in eine verzwickte Rätseljagd. War der Journalist einem Politskandal auf der Spur? Und werden die drei Detektive ihn finden, bevor seine Gegner es tun?		2021-11-26	false	1	http://a1.mzstatic.com/us/r30/Music125/v4/aa/93/82/aa938236-7558-e880-fe67-d2992bb3ae21/source		https://dreifragezeichen.de/produktwelt/details/der-fluch-der-medusa-2	1585776843	4BZfSV9maCil4l4yftT74F	589622	B09G6NG43Q	B095GNPF4F	MPREb_AIlPRxntO6S
290	und der Geisterbunker		Die drei ??? werden zu einem verlassenen Bunker an der Steilküste von Rocky Beach geschickt. Dort soll es spuken – und tatsächlich hören sie geisterhafte Stimmen. Beim Erkunden des Bunkers werden sie plötzlich eingesperrt. Können Justus, Peter und Bob sich aus dem Geisterbunker befreien? Ein nervenaufreibendes Abenteuer beginnt.		2022-02-04	false	1	http://a1.mzstatic.com/us/r30/Music126/v4/0f/7e/db/0f7edb85-4817-c615-bf6d-a767ed3b0536/source		https://dreifragezeichen.de/produktwelt/details/und-der-geisterbunker-1	1593847687	1cJ3fNx6K47p4eDFqhnvsA	619004	B09L5142C5	B09FS2TQ56	MPREb_qASQBtNpSkn
291	und die verlorene Zeit		Entführung auf dem Schrottplatz – Arnold Grasso beauftragt die drei ??? gerade mit einem Fall, als er vor ihren Augen entführt wird. Und das ausgerechnet von seiner eigenen Familie. Sie beschuldigt ihn, ein wertvolles Gemälde gestohlen zu haben, das seit langer Zeit in ihrem Besitz ist. Können die drei Detektive ihren Auftraggeber finden und seine Unschuld beweisen? Justus, Peter und Bob dürfen keine Zeit verlieren …		2022-03-25	false	1	http://a1.mzstatic.com/us/r30/Music116/v4/5c/da/a0/5cdaa0d3-b590-a858-c44d-760b4603cb5f/source		https://dreifragezeichen.de/produktwelt/details/die-verlorene-zeit	1606130509	76pYNMMVZTiuNy3IoXcavU	642464	B09QSXWW5H	B09KN9YWBW	MPREb_17RtMp1snzb
292	Die Schwingen des Unheils		XFLR-7 – ein geheimes Forschungsprojekt – ist in Gefahr! Unbekannte Gangster scheinen den Diebstahl der geheimen Unterlagen zu planen, doch der einzige Zeuge, den Justus, Peter und Bob befragen können, ist ein Halsbandsittich namens Huxley. Damit die Konstruktionspläne von XFLR-7 nicht in die falschen Hände geraten, müssen die drei ??? ihr Können unter Beweis stellen. Werden die Detektive das Geheimprojekt retten?		2022-05-27	false	1	http://a1.mzstatic.com/us/r30/Music126/v4/eb/74/2f/eb742faa-8677-eded-4d52-fa45dbf62e8c/source		https://dreifragezeichen.de/produktwelt/details/die-schwingen-des-unheils	1612467355	2BkEUZY7Da7bqlUjmMA2Cq	662396	B09TXT7KPS	B09QFG5258	MPREb_rIGIM1J0KZn
293	und der Kristallschädel	Ein harmloser Trödeleinkauf endet für die drei ??? in einer Verfolgungsjagd. Die Suche nach einem wertvollen Kristallschädel beginnt!	Der kürzlich verstorbene Hunter Scott soll einen solchen Schädel besessen haben. Von den Maya gefertigt hat er angeblich heilende Kräfte. Doch wo in seiner Villa könnte er versteckt sein? Das fragen sich nicht nur Justus, Peter und Bob – denn einige zwielichtige Gestalten haben es auf den Kristallschädel abgesehen. Sind die drei Detektive schneller?		2022-07-15	false	1	http://a1.mzstatic.com/r40/Music112/v4/6f/30/56/6f3056fb-3bec-1355-04b3-0b9f234dd9ca/886449413096.jpg		https://dreifragezeichen.de/produktwelt/details/der-kristallschadel	1683338536	1WlRnNunbHpnRTTVkxMRnd	761983	B0C2ZP3WZJ	B09TMZ3SDQ	MPREb_1Av0lBYpi57
294	Im Netz der Lügen	Ein Einbrecher, der nichts stiehlt, sondern Gegenstände hinterlässt? In Rocky Beach gehen seltsame Dinge vor, wenn das kein Fall für die drei ??? ist!	Was zunächst harmlos erscheint, verfolgt ein Muster, und genau dieses versuchen Justus, Peter und Bob zu entschlüsseln. Doch jemand will mit aller Kraft verhindern, dass die Detektive Licht ins Dunkel bringen. Werden die drei Freunde den Fall lösen, bevor es zu einer Katastrophe kommt, oder verstricken sie sich im Netz der Lügen?		2022-09-16	false	1	http://a1.mzstatic.com/r40/Music112/v4/c0/13/4d/c0134d60-2ae9-48cf-6002-5ce6766a1b46/886449413232.jpg		https://dreifragezeichen.de/produktwelt/details/im-netz-der-lugen	1683338209	2WwOKZLpFWrvw3O9CISod1	786796	B0C2ZPCFWJ	B09ZFJDS9M	MPREb_Vw6qBEZGeQV
295	Eine schreckliche Bescherung	Es weihnachtet sehr in Rocky Beach:\nAuf der Suche nach den passenden Geschenken geraten die drei ??? in einen neuen Fall.	Beim Einkaufsbummel im Kaufhaus Garcy's werden Justus, Peter und Bob Zeugen eines Überfalls. Kein geringerer als der Weihnachtsmann des Garcy's wird angegriffen. Jemand hat es auf den Sack voller Geschenke abgesehen … und dieser jemand ist ausgerechnet als Weihnachtself verkleidet.\nDie drei ??? heften sich an die Fersen des Diebes und finden heraus, auf welches Weihnachtsgeschenk es der Elf abgesehen hat …	Ein weihnachtlicher Fall in 24 Kapiteln.	2022-10-14	false	1	http://a1.mzstatic.com/r40/Music122/v4/d6/bf/a6/d6bfa640-de36-a2cb-3790-74a9e1ce511b/886449413263.jpg			1695696461	5u2wd0lYukcINw8dUFCREq	842086	B0CB418WC7	B0B37KWT14	MPREb_BQ1k0fJ3Lwb
296	und die Teufelsklippe	Peter Shaw – ein Mörder? Ganz bestimmt nicht! Da sind sich Justus und Bob sicher. Können die beiden die Unschuld des Zweiten Detektivs beweisen?	Peter sieht ihn fallen, doch die Teufelsklippe gibt ihn nicht wieder her. Verschluckt von den tosenden Wellen bleibt der Mann verschwunden … Was ist passiert? Ausgerechnet der Zweite Detektiv wird beschuldigt, Paul Forsters ins Meer gestoßen zu haben. Im Verhör wird Peter bis ins kleinste Detail befragt. Justus und Bob versuchen derweil mehr über den seltsamen Fall herauszufinden. Können die beiden ihrem Freund helfen?		2022-11-18	false	1	http://a1.mzstatic.com/r40/Music112/v4/d0/fa/95/d0fa95d3-9318-de46-9413-504016bf071f/886449413300.jpg		https://dreifragezeichen.de/produktwelt/details/die-teufelsklippe	1683339377	6ewdyVIW2LurJhYGU0UBAa	860080	B0C2ZP7GVB	B0B6792J65	MPREb_O8PBlrDNMlN
297	Im Wald der Gefahren	Von Rocky Beach in die Rocky Mountains – die drei ??? freuen sich auf ein Wander-Wochenende. Was harmlos beginnt, wird zum Kampf ums nackte Überleben!	Noch bevor die Wandergruppe aufbricht, wittern die drei Detektive einen neuen Fall: Ein toter Briefkasten und eine Stolperfalle – will jemand die Tour verhindern? Schon auf der ersten Etappe wird es brenzlig. Ein Bach wird zum reißenden Fluss, und Pilze sollte man mit Vorsicht genießen. Als Peter verschwindet, wird klar: Die Wildnis hat etwas zu verbergen. Die drei ??? finden sich im Wald der Gefahren wieder …		2023-01-20	false	1	http://a1.mzstatic.com/r40/Music112/v4/a3/5d/6c/a35d6cfc-8219-1e66-8923-a8c227a1ac35/196589194510.jpg		https://dreifragezeichen.de/produktwelt/details/im-wald-der-gefahren-1	1683337919	01i4iyB40EU7Qgd6EgKoZt	910724	B0C2ZQ121D	B0BF2ZX1S1	MPREb_sPZuvLfaE4d
298	Manuskript des Satans	Ein Manuskript des leibhaftigen Satans und teuflische Lärmattacken – dieser Fall hat es in sich! Begeben die drei ??? sich in höllische Gefahr?	Wer steckt hinter dem entsetzlichen Lärmangriff auf das Haus von Professor Bancroft? Während der Wissenschaftler versucht, eine geheimnisvolle alte Handschrift zu übersetzen, machen sich Justus, Peter und Bob auf die Suche nach der Lärmquelle. Haben die Attacken etwas mit dem Manuskript des Satans zu tun, an dem der Professor gerade arbeitet? Die drei Detektive werden es herausfinden.		2023-03-03	false	1	http://a1.mzstatic.com/r40/Music122/v4/ee/d9/25/eed925e9-91ae-071f-51ac-8f95f4a20cf6/196589194671.jpg		https://dreifragezeichen.de/produktwelt/details/manuskript-des-satans-1	1695104461	1KpVSqapKAUAtAepWWxPWs	1014454	B0C9TTW5JH	B0BKCB2TQH	MPREb_J2ygWS3lObQ
299	und die Gesetzlosen	Peter wird in der Rocky Beach Highschool unfreiwillig Zeuge eines dubiosen Telefonats. Hat seine Lehrerin Amanda Blunt ein dunkles Geheimnis?	Als die unscheinbare Frau dann auch noch verdächtige Utensilien in ihr Auto packt und losfährt, nimmt Peter die Verfolgung auf. Natürlich nicht ohne seine beiden Freunde zu informieren. Die drei ??? begeben sich auf einen gefährlichen Roadtrip durch die verlassene Prärie. Hoffentlich wird ihnen diese Fahrt nicht zum Verhängnis …		2023-05-12	false	1	http://a1.mzstatic.com/r40/Music126/v4/a7/67/37/a7673797-8db6-01f7-da10-d19466f06130/196589194695.jpg		https://dreifragezeichen.de/produktwelt/details/die-gesetzlosen-1	1752443158	3o2Gwvg8lqLNRnlV1v1s5K	1086938	B0C46L44ZK	B0BRJRSNGX	MPREb_8Loo1oIUKQG
300	und der Knochenmann	Eine Frau verschwindet nach einem Erdbeben plötzlich spurlos. Was ist mit ihr geschehen? Die drei ??? begeben sich auf eine gefährliche Suche.	Die junge Schneiderin Maya erscheint nicht zur Arbeit am Camelot Theatre. Justus, Peter und Bob haben den Verdacht, dass das Rätsel, das die Theaterleitung veranstaltet, etwas damit zu tun hat. Denn ein hohes Preisgeld ist zu gewinnen. Ist des Rätsels Lösung auch die Spur zu Maya? Die drei Detektive ermitteln, während erneut die Erde bebt …		2023-07-28	false	1	http://a1.mzstatic.com/r40/Music126/v4/2f/90/b7/2f90b777-86d1-c1c3-9b85-b8e5da917f8c/196589971913.jpg		https://dreifragezeichen.de/produktwelt/details/der-knochenmann-1	1752449378	451jKBwuSNrNgLlqEAZfra	1106229	B0C471NF65	B0BX4XBMJH	MPREb_ypnkznQU9SZ
301	Böser die Glocken nie klingen	Weihnachten auf dem Schrottplatz – doch die drei ??? gönnen sich keine Pause. Auch in der besinnlichen Adventszeit übernehmen Justus, Peter und Bob jeden Fall.	Die drei Detektive schmücken den Weihnachtsbaum auf dem Schrottplatz, als sie plötzlich einen kryptischen Hilferuf in einem Weihnachtsglöckchen entdecken. Doch wer ist der Absender?\nDie Spur führt die drei ??? in ein Wohnheim für Jugendliche. Die Zeit drängt – wird es ihnen bis zum 24. Dezember gelingen, den Fall zu lösen?	Ein weihnachtlicher Fall in 24 Kapiteln.	2023-11-03	false	1	http://a1.mzstatic.com/r40/Music126/v4/3b/22/be/3b22befa-c875-e76b-b8a1-ff5d5122d062/196871057332.jpg		https://dreifragezeichen.de/produktwelt/details/boser-die-glocken-nie-klingen-adventskalender	1752450018	0oZaQfEwMWY2TfviD4fEdV	1185101	B0CKWFRKSX	B0CGK7HN8V	MPREb_6RTTgXstKxM
302	Die Yacht des Verrats	Justus Jonas ist einmalig – oder etwa nicht? Unerwarteter Besuch und ein Diebstahl führen die drei ??? auf die Yacht des Verrats.	Justus, Peter und Bob trauen ihren Augen kaum, als ihnen Ian Carew wieder gegenübersteht. Ein alter Fall verbindet die Detektive mit dem Sohn des ehemaligen Premierministers von Nanda. Kein Wunder, dass Ian erneut ihre Hilfe sucht. Er ist im Auftrag seines Landes in Rocky Beach, doch jemand verfolgt ihn und in sein Hotelzimmer wurde eingebrochen. Können die drei ??? ihrem Freund helfen?		2023-11-24	false	1	http://a1.mzstatic.com/r40/Music116/v4/1a/1d/2d/1a1d2d8a-eb6e-8d6b-3eaa-2fb8d0817c65/196871057400.jpg		https://dreifragezeichen.de/produktwelt/details/die-yacht-des-verrats-1	1752449423	7JhdaReI98XYFrzb3jJPFa	1185118	B0CC369BBB	B0C6CCCP8Z	MPREb_D10s8l1XXB2
303	und der Puppenmacher	Schaurige Maispuppen, Schüsse und verurteilte Verbrecher – keine guten Vorzeichen für eine Hochzeit. Die drei ??? geben ihr Bestes, um das Fest zu retten.	Deep Spring, ein verschlafener Ort in der Wüste von Arizona: Die drei ??? reisen an, um die Hochzeit eines alten Bekannten zu besuchen. Doch während die Vorbereitungen in vollem Gange sind, pflastern unheimliche Puppen den Weg der Detektive. Als sie schließlich ein Hochzeitspaar aus Mais, aufgehängt im Gebälk, entdecken, bekommt nicht nur die Braut kalte Füße. Können Justus, Peter und Bob die seltsamen Geschehnisse aufklären?		2024-01-26	false	1	http://a1.mzstatic.com/r40/Music126/v4/ba/79/de/ba79de32-25df-c9d7-4f87-71aef668506c/196871249751.jpg		https://dreifragezeichen.de/produktwelt/details/der-puppenmacher	1752450507	0FuC7q4bJG41g1naKBx4ot	1229917	B0CNHBLW4Y	B0CJCWK69J	MPREb_4kqZ3QwOQ6W
304	Die Spur der Toten	Bob Andrews stockt der Atem – unerwartet erhält er Post von einem Anwalt. Die Vergangenheit holt ihn ein und lässt ihn an seinem Verstand zweifeln.	Das Vermächtnis, das eine alte Bekannte dem dritten Detektiv hinterlässt, ist ebenso unheimlich wie bizarr: Nach ihrem Ableben soll er die Spur ihres Mörders aufnehmen und ihn unter allen Umständen dingfest machen. Können die drei ??? ihren Tod aufklären und den Täter finden? Justus, Peter und Bob folgen den Spuren, die bis in das Reich der Toten führen.		2024-03-22	false	1	http://a1.mzstatic.com/r40/Music116/v4/30/d4/77/30d47722-aed3-7ce0-7a21-f0d96e7bf82e/196871249775.jpg		https://dreifragezeichen.de/produktwelt/details/die-spur-der-toten	1752449751	3Sv5tE8PcAlGY6Ys2ISQXF	1251667	B0CSDM75XC	B0CN8HNBHR	MPREb_bDYlhlG3dO2
305	Melodie der Rache	Die drei ??? ermitteln für einen berühmten Rockstar und lauschen der Melodie der Rache. Können die Detektive Licht ins Dunkel bringen?	Als Peter Journey die drei ??? um Hilfe bittet, sind die Detektive hellauf begeistert, denn PJ ist eine echte Rocklegende. In der Ferienanlage des Musikers herrscht Chaos: Eine wertvolle Bassgitarre wurde gestohlen und ein Gast brutal niedergeschlagen. Justus, Peter und Bob buchen sich kurzerhand selbst ein Zimmer im Hotel und stoßen auf ein dunkles Geheimnis der Vergangenheit.		2024-05-10	false	1	http://a1.mzstatic.com/r40/Music122/v4/aa/a3/a1/aaa3a16c-3d3c-a164-c8e7-feaa43a0c0ba/196871288071.jpg		https://dreifragezeichen.de/produktwelt/details/melodie-der-rache	1752449669	2CMXywsh8wVXXCmr2bLTZ6	1277361	B0CWLH2J1G	B0CR9HKJFF	MPREb_6nCVRIxhPRE
306	Der Ruf der Krähen	Lautes Gekrächze und Hilfeschreie schallen durch den Palisades Park. Peter eilt zu Hilfe, als ein Mann von einem wild gewordenen Schwarm Krähen attackiert wird.	Mit ihren spitzen Schnäbeln hacken die Vögel wütend auf den Mann ein und lassen nur schwerlich von ihm ab. Was hat die Krähen so in Aufregung versetzt?\nJustus, Peter und Bob folgen dem Ruf der Krähen und stoßen auf ein geheimes Projekt, das die Zukunft der Menschheit auf den Kopf stellt.		2024-07-12	false	1	http://a1.mzstatic.com/r40/Music221/v4/80/e6/4e/80e64e33-9120-2cd3-d596-0712e08d80bb/196872195507.jpg		https://dreifragezeichen.de/produktwelt/details/der-ruf-der-krahen	1757389491	6sNAlohza1ZTWVMGhFTGJW	1321147	B0D361L8SC	B0CXRSZ1GT	MPREb_MVYljhSoKYA
307	Drehbuch der Täuschung	Gefangen auf Sumatra! Jayden ist verschwunden und soll gegen seinen Willen auf die indonesische Insel verschleppt worden sein.	Der Mitbewohner des verschwundenen Studenten macht sich große Sorgen um seinen Freund und bittet Justus, Peter und Bob um Hilfe. Er hat einen seltsamen Anruf von Jayden erhalten – direkt von Sumatra. Aber wie ist der junge Mann dort hingekommen und vor allem warum? Die drei Detektive übernehmen den Fall. Doch bald schon nehmen die Ermittlungen eine unerwartete Wendung …		2024-09-06	false	1	http://a1.mzstatic.com/r40/Music221/v4/5e/73/0a/5e730a04-ffae-00b6-8d13-4f8ab1e29f38/196872211771.jpg		https://dreifragezeichen.de/produktwelt/details/drehbuch-der-tauschung	1753904987	6SMOmIWODrO1gND2YPpjHf	1388001	B0D811L69G	B0D85S18ZR	MPREb_i9FNZSVOEG3
308	Der Tag der Toten				2024-11-08	true	1	http://a1.mzstatic.com/r40/Music221/v4/f6/3c/1b/f63c1b22-f6dc-6cef-65e1-509fbab4650a/196872212150.jpg			1764904056			B0DF7PZZRW	B0D8K4PKQG	
309	Panik im Paradies		Bereits in der ersten Folge machen die drei berühmten Detektive ihrem Namen alle Ehre. Eigentlich haben Justus, Peter und Bob ja gerade Ferien. Doch dann treffen sie den kuriosen Kapitän Larson, der einen kleinen Privatzoo besitzt. Als plötzlich alle seine Tiere krank werden und keine Besucher mehr kommen, wird die Neugier der Fragezeichen geweckt. Schon bald ahnen sie, dass da jemand ein düsteres Geheimnis hütet. Es riecht gewaltig nach Abenteuer!!!		2009-03-13	false	0	http://a1.mzstatic.com/r40/Music69/v4/d1/fb/d7/d1fbd72b-52f8-efa1-b223-cff99fe73f8c/886445747553.jpg		https://www.dreifragezeichen-kids.de/produktwelt/produkt-details/panik-im-paradies-3	1092525638	5mQg8r5ivI0IX5bTV57KyN		B01CUS25SE	B001Q2RWNO	MPREb_M30IAeDA4oy
310	Radio Rocky Beach		"Hier ist Radio Rocky Beach, der coolste Sender zwischen Miami und Alaska!" DJ Wolfman ist mit seinem Piratensender immer auf der richtigen Welle – da sind sich auch die drei Detektive einig. Doch währenddessen wird nicht nur Tante Mathildas Wagen aufgebrochen, auch anderswo in Rocky Beach gibt es regelmäßig zu DJ Wolfmans Sendezeit Einbrüche. Justus ist sicher: Da muss es einen Zusammenhang geben. Aber wo sollen die drei Fragezeichen mit ihren Ermittlungen anfangen? Ah, eine Idee: Sie wollen den Übeltätern dazwischenfunken …		2009-04-13	false	0	http://a1.mzstatic.com/r40/Music49/v4/de/cd/69/decd69f2-95ee-d6d1-93ca-c1dc55fba982/886445747560.jpg		https://www.dreifragezeichen-kids.de/produktwelt/produkt-details/radio-rocky-beach-1	1092534740	50d2KMK7GtbCTfLqxDfHIS		B01CV1A0HS	B001Q2RWO8	MPREb_yO3Or2FiD5t
311	Invasion der Fliegen		Hunderte von Fliegen tummeln sich in Tante Mathildas Haus. Ein Albtraum! Wo kommen die alle her? Ist etwa das ganze Gerümpel auf Onkel Titus' Schrottplatz daran schuld? Und was hat die "Bock Wurstwaren KG" und ihr zwielichtiger Juniorchef Bertholt von Bock damit zu tun? Justus, Peter und Bob wissen nur, sie müssen etwas tun oder es wird böse enden. Gemeinsam verfolgen sie die Spur der nervtötenden Brummer bis in einen düsteren Kanalschacht …		2009-05-13	false	0	http://a1.mzstatic.com/r40/Music49/v4/93/16/91/93169171-5eb2-ceda-38b0-c1c042c12e79/886445747577.jpg		https://www.dreifragezeichen-kids.de/produktwelt/produkt-details/invasion-der-fliegen-1	1092525866	0jhxRM2HsImXg5W28JfUv8		B01CUS1TGI	B001Q2RWOS	MPREb_DDqYUg3vcpZ
312	Chaos vor der Kamera		Rasende Verfolgungsjagden, Autos, die in Flammen aufgehen, todesmutige Stunts: Justus, Peter und Bob finden es einfach cool, dass der neue Actionfilm bei ihnen auf dem Schrottplatz gedreht wird. Doch die Dreharbeiten stehen unter einem schlechten Stern. Bereits am ersten Tag müssen die Arbeiten wegen einer Panne eingestellt werden: die Feuerlöscher sind nicht ordnungsgemäß überprüft worden und leider – leer. Ein Versäumnis? Die drei Jungs glauben nicht daran und nehmen die Crew unter die Lupe: Einer von ihnen spielt ein falsches Spiel mit gefährlichen Folgen. Aber wer? Blitzartig stecken die drei Detektive wieder mitten in einem hochspannenden Fall.		2009-06-13	false	0	http://a1.mzstatic.com/r40/Music69/v4/b6/56/1f/b6561fd0-51bf-a8a9-1349-b3a81f0c2c75/886445747591.jpg		https://www.dreifragezeichen-kids.de/produktwelt/produkt-details/chaos-vor-der-kamera-1	1092522053	30w9IzSbHHevllaU299TMh		B01CUS1V20	B002L1FEXO	MPREb_LTH4DRafIbw
313	Flucht in die Zukunft		Was ist mit John Smith geschehen? Der schrullige Tüftler hat behauptet, eine Zeitmaschine entwickelt zu haben, nun ist er spurlos verschwunden. Onkel Titus bekommt den Auftrag, seine Wohnung zu entrümpeln und die drei Jungs begleiten ihn. Dort finden sie einen merkwürdigen Apparat etwa die Zeitmaschine? Wurde Smith in eine andere Dimension versetzt? Es gibt für die drei Jungdetektive nur einen Weg, ihm zu helfen: Sie müssen die Zeitmaschine zum Laufen bringen.		2009-07-13	false	0	http://a1.mzstatic.com/r40/Music69/v4/91/31/dc/9131dc0b-4d89-6225-5ddb-11559e558d84/886445747607.jpg		https://www.dreifragezeichen-kids.de/produktwelt/produkt-details/flucht-in-die-zukunft-1	1092521899	1wNy1x9hCcnmU1vhT7S2Tc		B01CUS2LGK	B002L1FEY8	MPREb_wI7vHrqM4By
314	Gefahr im Gruselgarten		Es ist Jahrmarkt in Rocky Beach! Die drei Fragezeichen haben Freikarten bekommen, unter anderem auch für den Gruselgarten. Dort begegnen ihnen seltsame Gestalten: ein narbengesichtiger Feuerspucker oder die geheimnisvolle Hellseherin Madame Vandorra. Aber irgendetwas stimmt hier nicht – das riechen die Spürnasen sofort! Als sich auch noch Onkel Titus und Tante Mathilda im Gruselgarten vergnügen, ist plötzlich Titus' Brieftasche weg – oder doch nicht? Schnell sind die drei Kids mitten in einem neuen Fall …		2009-08-13	false	0	http://a1.mzstatic.com/r40/Music69/v4/c5/07/3e/c5073e22-d1ba-ea71-11c9-c399c900cadf/886445747614.jpg		https://www.dreifragezeichen-kids.de/produktwelt/produkt-details/gefahr-im-gruselgarten-1	1092521960	4TSPWdUo2J4w6VuwQgUK2e		B01CUS15GW	B002L1FEYS	MPREb_kQz1uNuHKMD
315	Gruft der Piraten		Durch Zufall entdecken Justus, Peter und Bob rätselhafte Spuren eines versunkenen Schiffes. Ein gefährliches Abenteuer auf dem Grund des Meeres beginnt. Was hat es mit dem Teufelsriff auf sich? Und was bedeuten die Zeichen auf der geheimen Schatzkarte? Doch Die drei ??? Kids sind nicht die einzigen, die sich für das Gold der Piraten interessieren …		2009-09-13	false	0	http://a1.mzstatic.com/r40/Music69/v4/a9/a1/f0/a9a1f0a3-9017-56fb-ef1d-5b610033eb9b/886445747638.jpg		https://www.dreifragezeichen-kids.de/produktwelt/produkt-details/gruft-der-piraten-1	1092534848	2rleLzoiSWt5IVyZpkkVHA		B01CUS4IEI	B001Q2RWPC	MPREb_C62NnSSbT3J
316	Nacht unter Wölfen		Justus, Bob und Peter können es nicht glauben: Sie selbst sollen mit Falschgeld bezahlt haben. Aber woher stammen die Blüten? Die Spuren führen quer durch Rocky Beach und im Zirkus Rondini erhalten sie einen entscheidenden Hinweis. Doch sieben hungrige Wölfe bewachen ein düsteres Geheimnis.		2009-10-13	false	0	http://a1.mzstatic.com/r40/Music49/v4/71/98/32/71983264-9920-a910-0fd0-99e5a920608a/886445747645.jpg		https://www.dreifragezeichen-kids.de/produktwelt/produkt-details/nacht-unter-wolfen	1092521938	3RRqQIyDs7AkO3TPbmuRpt		B01CUS3JS4	B001Q2RWPW	MPREb_8orkZiwm9CG
317	SOS über den Wolken		Die drei ??? Kids ermitteln weiter! Alles fängt so toll an: Die drei Detektive werden für einen Aufräumjob mit einer Fahrt im Heißluftballon belohnt. Aber ein Sabotageakt macht aus dem Vergnügen schnell ein gefährliches Abenteuer. Wieder mit beiden Beinen fest auf dem Boden möchten die drei ??? die Hintergründe des Anschlags in Erfahrung bringen. Bis der Fall jedoch endgültig gelöst ist, gilt es eine zweite nicht ganz ungefährliche Ballonfahrt zu meistern.		2009-11-13	false	0	http://a1.mzstatic.com/r40/Music69/v4/cb/50/aa/cb50aa45-8749-f162-58df-e432c5c261eb/886445747676.jpg		https://www.dreifragezeichen-kids.de/produktwelt/produkt-details/sos-uber-den-wolken-1	1092524593	7A5GQZrirxYgjWCTGpbnbs		B01CUS1MAG	B0025T4YRE	MPREb_iqUA0OGplOT
318	Spuk in Rocky Beach		Unheimliche Dinge geschehen in Rocky Beach. Gruselige Geistererscheinungen, rätselhafte Kornkreise und gespenstische Schattenwesen. Kein Wunder, dass sich auch das Fernsehen dafür interessiert. Doch die drei ??? Kids wollen nicht so richtig an UFOs und Außerirdische glauben. Ein Fall für starke Nerven.		2009-12-13	false	0	http://a1.mzstatic.com/r40/Music124/v4/2e/c2/1b/2ec21be4-5038-4f7d-17b9-429580aad031/886445747690.jpg		https://www.dreifragezeichen-kids.de/produktwelt/produkt-details/spuk-in-rocky-beach-1	1092525596	6PRRmyf0vuFwPeuVLdDq4q		B01CUS0UW2	B002L1FEZC	MPREb_C9JKjq4tlj6
