hörspielID	titel	kurzbeschreibung	beschreibung	metabeschreibung	veröffentlichungsdatum	unvollständig	cover	urlCoverApple	urlCoverKosmos	urlDreifragezeichen	idAppleMusic	idSpotify	idBookbeat	idAmazonMusic	idAmazon	idYouTubeMusic
170	Grusel auf Campbell Castle		Adam Campbell hat ein schweres Erbe angetreten: Er muss das imposante Schloss seines verstorbenen Vaters in Schuss halten. Bei einer spiritistischen Sitzung meldet sich dessen Geist und spricht von einem sonderbaren Vermächtnis. Natürlich nehmen die drei ??? die Ermittlungen auf. Mit einem Gespenst, davon sind sie überzeugt, haben sie es nicht zu tun! Bis Peter von einer gruseligen schwarzen Hand ins Meer gezogen wird. Erst in letzter Sekunde kann er gerettet werden. Der Zweite Detektiv ahnt Unheilvolles: Wurde er von einem Wassergeist attackiert?		2011-06-24	false	1	http://a1.mzstatic.com/us/r30/Music62/v4/e6/81/2a/e6812a57-2ae7-f2b1-efb4-cc5ef042ccfc/source	http://web.archive.org/web/20211227022651if_/https://s3.eu-central-1.amazonaws.com/kosmos.de/media/image/e5/6f/88/0886978014726.jpg	https://dreifragezeichen.de/produktwelt/details/grusel-auf-campbell-castle	1149001066	35aU9bfmxPGdjiRA4JMuFd	534752	B01HQ4WT6U	B004VU04YC	MPREb_MmySQplFkwC
171	und die feurige Flut		Ein schwerer Fluch lastet auf Allie Jamison, einer alten Bekannten der drei ???. Jedenfalls ist sie davon überzeugt. Schon in der nächsten Vollmondnacht soll etwas Schlimmes geschehen! Es gibt nur einen Ausweg: Justus, Peter und Bob müssen ein alchemistisches Rätsel lösen – in nur 24 Stunden. Ihre fieberhaften Ermittlungen führen die drei Detektive in eine Welt von Zauberern und Wahrsagern. Als Justus jedoch in einen Hinterhalt gelockt wird, ist klar: Dieser Fall ist lebensgefährlich!		2011-08-19	false	1	http://a1.mzstatic.com/us/r30/Music71/v4/89/c6/08/89c60854-6977-ef69-4dfb-aa7fc365a9b5/source	http://web.archive.org/web/20211231145706if_/https://s3.eu-central-1.amazonaws.com/kosmos.de/media/image/61/f9/53/0886978014825.jpg	https://dreifragezeichen.de/produktwelt/details/und-die-feurige-flut	1149001129	2uOsf31oenHRd4DVxCSjn9	534757	B01HQ5364I	B0050F9Y3O	MPREb_VM8HnZLWbsW
172	House of Horrors: Haus der Angst		Wolltest Du immer schon den drei ??? bei ihren Ermittlungen helfen? Jetzt hast Du die Chance dazu! In der Geisterbahn im Freizeitpark geschehen merkwürdige Dinge. Schreckliche Schreie ertönen, die mit Sicherheit nicht zum Programm dazugehören. Justus, Peter und Bob, die drei jungen Detektive aus Rocky Beach und ihr Auftraggeber Tony müssen schnellstmöglich herausfinden, was dahinter steckt.\nAber Vorsicht: Eine falsche Entscheidung, und sie sind für immer verloren!\n\nEs liegt an Dir: Du kannst den drei ??? und Tony den Weg durch das Haus der Angst schaffen.\nOder auch nicht …	Verschollen, gefunden, endlich auch auf Deutsch veröffentlicht: Eine Geschichte aus dem Jahr 1986 von dem amerikanischen Die drei ???-Autorenpaar Megan und H. William Stine.	2011-08-19	false	1	http://a1.mzstatic.com/r40/Music114/v4/87/73/89/877389c8-2c6a-c40c-7bf1-b3498a8678fb/884977708189.jpg		https://dreifragezeichen.de/produktwelt/details/house-of-horrors	452658930	249qkyRcqMAoKJhXwrTYtE	534863	B005EZMHHU	B0050F9Y48	MPREb_fh8K2BcA1r9
173	Der namenlose Gegner		In dem sonst so idyllischen Ort "Seven Pines" droht ein Nachbarschaftskrieg auszubrechen. Die aufgebrachten Anwohner bitten die drei ??? um Hilfe. Doch Bob wird bei einer nächtlichen Beschattungsaktion verletzt und verliert das Bewusstsein. Als er wieder zu sich kommt, weiß er nicht mehr, wer er ist! Das nutzt ein alter Feind der drei ??? gnadenlos aus. Während der dritte Detektiv nun auf unerwartete Abwege gerät, bekommen Justus und Peter es mit einem gefährlichen Gegner zu tun. Schnell wird aus einem scheinbar harmlosen Routinefall eine harte Probe für das berühmte Trio aus Rocky Beach – womöglich die härteste, die es bisher für sie gegeben hat …		2011-09-30	false	1	http://a1.mzstatic.com/us/r30/Music71/v4/89/fe/eb/89feeb6a-d74e-bf5d-c599-3cea28ef701b/source	http://web.archive.org/web/20220111212304if_/https://s3.eu-central-1.amazonaws.com/kosmos.de/media/image/de/5a/de/0886978014924.jpg	https://dreifragezeichen.de/produktwelt/details/der-namenlose-gegner	1149003866	7K7dfMc3VwHOKtENI1BWTD	534783	B01HQ52P5O	B005DIVEFE	MPREb_rhyJ9OEReHa
174	Geisterbucht		Die drei ??? übernehmen und lösen (hoffentlich!) ihren 150sten Fall! In drei atemberaubenden Folgen sind sie dem Rätsel der Geisterbucht auf der Spur! Welches Geheimnis verbirgt sich hinter dem Testament, dass der exzentrische Harry Shreber kurz vor seinem Tod verfasst hat? Führen die verschlüsselten Verse tatsächlich zu Rashuras Schatz (Teil A)? Den drei Detektiven wird nichts anderes übrig bleiben: Sie müssen in Flammendes Wasser (Teil B) hinab tauchen; denn nur in der Tiefe des Meeres kann geklärt werden, warum Der brennende Kristall (Teil C) so viel Unglück über eine große Anzahl Menschen bringen konnte …		2011-11-11	false	1	http://a1.mzstatic.com/us/r30/Music71/v4/a1/dd/63/a1dd63c2-6ffa-437f-99f9-d0741d46ae98/source	http://web.archive.org/web/20211231145707if_/https://s3.eu-central-1.amazonaws.com/kosmos.de/media/image/f1/05/71/0886978015020.jpg	https://dreifragezeichen.de/produktwelt/details/geisterbucht-1	1149007411	6cPgVsZ6TPyVIP9BHP5ty5	534776	B01HQGWYJK	B005GJFGR2	MPREb_dZY4ECBQ2ym
175	Rashuras Schatz		Die drei berühmten Detektive aus Rocky Beach müssen ein Rätsel lösen, das ihnen der schrullige Harry Shreber in seinem Testament hinterlassen hat. Schnell finden sie heraus, dass der erste Hinweis in einem schrottreifen Flugzeug in Shrebers Garten versteckt sein könnte. Die Suche nach Rashuras Schatz beginnt – aber Justus, Peter und Bob sind bei weitem nicht die Einzigen, die das Rätsel lösen wollen …			false	0									
176	Flammendes Wasser		Die Spur zu Rashuras Schatz führt die drei ??? hoch in die Berge, tief unter die Erde und hinaus auf die offene See. Aber mit jedem Hinweis wird alles nur noch geheimnisvoller – und gefährlicher! Ein Wettlauf mit der Zeit beginnt …			false	0									
177	Der brennende Kristall		Noch immer haben Justus, Peter und Bob das Rätsel aus dem Testament nicht lösen können. Welche Rolle spielen Moby Dick und der brennende Kristall? Die drei ??? begeben sich zur Geisterbucht, um das Geheimnis zu lüften. Doch sie sind nicht allein! Jeder pokert hoch in diesem Spiel, das nur einer gewinnen kann …			false	0									
178	High Strung: Unter Hochspannung		Justus will bei einer Radioshow 5000 Dollar gewinnen. Die Regeln sehen vor, dass dazu täglich ein Rätsel gelöst und ein Gegenstand eingesammelt werden muss. Wer alles gefunden hat und es zum Sponsor der Sendung bringt, bekommt das Geld. Ein weiterer Preis ist eine alte Gitarre, die aber scheinbar niemand haben will. Plötzlich wird auf dem Schrottplatz eingebrochen und den drei Detektiven ist schnell klar, dass es jemand auf Justus' gesammelte Gegenstände abgesehen hat. Aber wer sollte das sein? Gemeinsam machen sich die drei ??? auf die Suche nach dem Dieb und geraten in ein gefährliches Abenteuer …	Verschollen, gefunden, endlich veröffentlicht: Eine Geschichte aus dem Jahr 1990 von der amerikanischen Die drei ???-Autorin G. H. Stone.	2011-11-11	false	1	http://a1.mzstatic.com/r40/Music49/v4/30/a3/5b/30a35bd3-ae05-4a15-cd1b-674753aee0e2/886445749465.jpg		https://dreifragezeichen.de/produktwelt/details/high-strung	1092538532	2Bxdn8Gn8vEy4UiTOc8cBK	534889	B01CV1DVBK	B005GJFGM2	MPREb_aRhOTg9A4fu
179	Schwarze Sonne		Bei einem Malkurs lernt Bob den sympathischen und begabten Denzel Hopkins kennen. Der Mann wird plötzlich beschuldigt, ein wertvolles Gemälde gestohlen zu haben. Denzel beteuert, das Bild noch nie gesehen zu haben und unschuldig zu sein.\nWie konnte er dann bereits in der Vergangenheit immer wieder ein zentrales Motiv aus diesem Bild malen – die schwarze Sonne?\nDie drei ??? müssen ihren gesamten detektivischen Spürsinn aufbieten, um diesen Fall zu lösen.		2012-01-20	false	1	http://a1.mzstatic.com/us/r30/Music71/v4/7d/96/5d/7d965d85-08b0-7661-0a15-826d455e6923/source	http://web.archive.org/web/20211231145710if_/https://s3.eu-central-1.amazonaws.com/kosmos.de/media/image/be/cd/5a/0886979232129.jpg	https://dreifragezeichen.de/produktwelt/details/schwarze-sonne	1149005753	3u0OSCwiOblOhm4dKjwLN5	534797	B01HQ51YQU	B0063N9V4E	MPREb_OUMhf1Wb8if
180	Skateboardfieber		Ein riesiges Skatertreffen findet in Rocky Beach statt. In der Stadt ist die Hölle los, und das nicht nur wegen des Skating-Events: Eine Reihe zwielichtiger Gestalten treibt sich in der Gegend herum, es fallen Schüsse, und niemand weiß genau, wer auf welcher Seite steht.\nEin alter Fall der drei ??? spielt auf einmal wieder eine wichtige Rolle. Und ohne die Hilfe ihrer alten und neuen Freunde könnte dies der letzte Fall für einen der drei Detektive werden …		2012-03-02	false	1	http://a1.mzstatic.com/us/r30/Music91/v4/17/66/cd/1766cd28-f935-f51e-c3a0-3d85edcc2555/source	http://web.archive.org/web/20220123153402if_/https://s3.eu-central-1.amazonaws.com/kosmos.de/media/image/65/42/16/0886979232228.jpg	https://dreifragezeichen.de/produktwelt/details/skateboardfieber	1149007296	5iNeANVy4supl8HowB9V2h	534833	B01HQ4ZPI4	B006N2Q7EM	MPREb_FIsjTZgUNVi
181	und das Fußballphantom		Das Fußballstadion brodelt. Die "Los Angeles Hawks" spielen gegen die "Philadelphia Tornados" um den amerikanischen Highschool-Meisterschaftstitel. Peter gerät durch eine Fehlvermittlung zufällig in ein fremdes Handygespräch. Was er mithört, lässt ihm das Blut in den Adern gefrieren. Unversehens müssen die drei ??? einem gefährlichen Erpresser das Handwerk legen. Werden sie die seltsamen Rätsel des Fußballphantoms lösen können? Sie müssen. Das Leben eines Menschen draußen auf dem Spielfeld hängt davon ab.		2012-04-13	false	1	http://a1.mzstatic.com/us/r30/Music62/v4/47/de/60/47de6085-acdd-0cf4-2459-4aef848fdbc5/source	http://web.archive.org/web/20220115045250if_/https://s3.eu-central-1.amazonaws.com/kosmos.de/media/image/06/2e/16/0886979232327.jpg	https://dreifragezeichen.de/produktwelt/details/und-das-fussballphantom	1149006848	7nxSEeJiQwI34VwnWT83C9	534755	B01HQ4Y45Y	B006ZJJ7T0	MPREb_YxJwgUP4OyV
182	Botschaft aus der Unterwelt		Dank seiner unfehlbaren Kombinationsgabe hat Justus Jonas wieder einmal einen Fall der drei ??? im Handumdrehen gelöst. Doch kaum ist die Akte geschlossen, bekommen die drei Detektive Post von einem mysteriösen Klienten. Er benennt sich selbst nach Sherlock Holmes' großem Erzfeind "Professor Moriarty" und beauftragt Justus, Peter und Bob, für ihn eine geheimnisvolle Botschaft zu entschlüsseln. Schon bald müssen die drei ??? erfahren, dass sie Figuren in einem gefährlichen Spiel sind: Onkel Titus wird verhaftet, Inspektor Cotta ist unerreichbar – und Moriarty scheint stets einen Schritt voraus zu sein. Aber Justus wäre nicht Justus, wenn er die Herausforderung nicht annehmen würde!		2012-05-18	false	1	http://a1.mzstatic.com/us/r30/Music71/v4/49/f1/6f/49f16f75-7f72-cb50-eecd-ad4436498728/source	http://web.archive.org/web/20220106180919if_/https://s3.eu-central-1.amazonaws.com/kosmos.de/media/image/d2/9a/16/0886979232426.jpg	https://dreifragezeichen.de/produktwelt/details/botschaft-aus-der-unterwelt	1149010695	3uggg8gNlh1kpBxLeOfFTV	534744	B01HQH0V3A	B0071J4AEU	MPREb_1EY3YpiLSIw
183	und der Meister des Todes		Das alte Haus an der Küste hat einst einem Marionettenspieler gehört. Der perfekte Drehort für ihren Horrorfilm, finden die drei ??? und ihre Kollegen aus dem Filmkurs. Schließlich hängen die unheimlichen Puppen immer noch an den Wänden. Als es in ihrer Nähe zu mysteriösen Ereignissen kommt, glauben Justus, Peter und Bob zunächst nicht an Magie. Doch dann gerät ausgerechnet einer der Detektive in den Bann einer düsteren Macht. Haben die Marionetten ihre Finger im Spiel? Oder zieht jemand anderes im Hintergrund die Fäden?		2012-07-13	false	1	http://a1.mzstatic.com/us/r30/Music62/v4/0b/11/b0/0b11b09e-b129-c754-54c3-f402f09b2f02/source	http://web.archive.org/web/20220111212303if_/https://s3.eu-central-1.amazonaws.com/kosmos.de/media/image/46/e0/98/0886979232525.jpg	https://dreifragezeichen.de/produktwelt/details/und-der-meister-des-todes	1149012184	623V90QowsF4WSqV3cHGKf	534841	B01HQH0NQU	B0071J4APY	MPREb_aMFGlYhe1fi
184	Im Netz des Drachen		"Dragoncourt", das Anwesen des exzentrischen Spiele-Programmierers Stephen Baron, steht zum Verkauf.\nDer Mann ist schwer erkrankt und hat sich nach Europa zurückgezogen. Doch der mit dem Verkauf der Immobilie beauftragte Makler ist verzweifelt, denn seltsame Dinge geschehen auf "Dragoncourt". Ganz klar: Hier müssen die drei erfolgreichen Detektive aus Rocky Beach ermitteln! Die Recherchen führen Justus, Bob und Peter in die fantastische Welt des Online-Games "Im Land der Drachen". Und schnell wird aus einem scheinbar harmlosen Spiel eine tödliche Gefahr: Alles deutet darauf hin, dass die virtuellen Figuren den Weg in die Wirklichkeit gefunden haben und hier ihr Unwesen treiben …		2012-08-24	false	1	http://a1.mzstatic.com/us/r30/Music71/v4/d3/04/70/d304706a-e440-a98e-b198-fb94c5be8527/source	http://web.archive.org/web/20220114180113if_/https://s3.eu-central-1.amazonaws.com/kosmos.de/media/image/be/a6/7c/0886979232624.jpg	https://dreifragezeichen.de/produktwelt/details/im-netz-des-drachen	1149012208	78wUIvkGT2CdWW0ngeEy8V	534857	B01HQGY2J0	B0071J4AYK	MPREb_ECEvZojXScN
185	Im Zeichen der Schlangen		Auf dem Schrottplatz laufen die Vorbereitungen für eine große Auktion auf Hochtouren. Plötzlich erscheint ein bedrohlicher Riese und beauftragt die drei Detektive mit einem geheimnisvollen Fall. Die Spur führt immer tiefer in längst vergangene Zeiten.\nNoch ahnen Justus, Peter und Bob nicht, dass sie schon bald in einen Strudel gefährlicher Ereignisse geraten werden. Doch mysteriöse Rätsel, nächtliche Beschatter, geisterhafter Rauch und ein bewaffnetes Phantom machen den drei ??? schnell klar, dass ihr ganzes Können gefordert ist, um nicht auf der Strecke zu bleiben. Nichts ist so, wie es auf den ersten Blick scheint …		2012-09-28	false	1	http://a1.mzstatic.com/us/r30/Music71/v4/28/c9/e5/28c9e542-efd4-0224-0714-07583b1136a1/source	http://web.archive.org/web/20220104131534if_/https://s3.eu-central-1.amazonaws.com/kosmos.de/media/image/e8/1f/c7/0886979232723.jpg	https://dreifragezeichen.de/produktwelt/details/im-zeichen-der-schlangen	1149014146	0pdXEEgKjfh4H0aZg4IOTS	534829	B01HQGYAQ0	B0071J4B76	MPREb_Udnqg1Stfxl
186	und die Geisterlampe		Das gab es noch nie:\n12 Mini-Fälle der drei ???.\nDie drei Autoren Kari Erlhoff, Hendrik Buchna und Marco Sonnleitner erzählen 12 kurze Geschichten, die die drei jungen Detektive aus Rocky Beach teilweise auch mal von ein paar ganz anderen Seiten zeigen.		2012-09-28	false	1			https://dreifragezeichen.de/produktwelt/details/und-die-geisterlampe	1092546618	1nL3AddBvZ845zMyXRowgs	534932	B01CV1B34M	B008L8OG8K	MPREb_OapVHfFET5a
187	und die Geisterlampe		Mr. Vancura ist Schauspieler und sammelt alles, was mit dem Orient zu tun hat. Sein ganzer Stolz ist eine Wunderlampe, in der ein richtiger Dschinn lebt. Aber der Dschinn ist verschwunden …		2011-12-02	false	0									
188	Dunkle Vergangenheit		Das neuste Hobby von Justus Jonas ist die Ahnenforschung.\nUnd dabei macht er eines Tages eine unglaubliche Entdeckung …		2011-12-04	false	0									
189	Entführt		Peter erhält eine E-Mail: Kelly ist entführt worden! Den drei ??? bleibt weniger als eine Stunde Zeit, sie zu finden und zu befreien …		2011-12-06	false	0									
190	Verschwörung auf der Eagle Ranch		Auf dem Autorasthof "Eagle Ranch" geschehen merkwürdige Dinge und die drei ??? erhalten den Auftrag, herauszufinden, was es damit auf sich hat …		2011-12-08	false	0									
191	SOS		Als die drei ??? vom Strand kommen und auf dem Weg nach Hause sind, sehen sie ein SOS-Signal, das aus einem Haus gesendet wird. Eigentlich steht das Haus doch leer …		2011-12-10	false	0									
192	Der graue Dämon		Auf dem Weg nach Hause wird Peter plötzlich von einem unheimlichen, grauen Dämon verfolgt. Ihm bleibt nur noch ein Ausweg: die Flucht …		2011-12-12	false	0									
193	Das Lehrstück		Peters ehemalige Klavierlehrerin, Mrs. Floyd, engagiert die drei ???, um herauszufinden, wo ihre verstorbene Mutter ihr Erbe versteckt haben könnte …		2011-12-14	false	0									
194	Das Rätsel der schwarzen Nadel		Die drei ??? erhalten den Auftrag, bei der Übergabe einer schwarzen Nadel dabei zu sein. Aber geht es dabei wirklich nur um das Schmuckstück?		2011-12-16	false	0									
195	Der verschwundene Superstar		Blacky, der Papagei der drei ???, benimmt sich seit ein paar Tagen höchst sonderbar.\nWas ist der Grund für die merkwürdigen Sprüche, die der Vogel plötzlich zitiert …		2011-12-18	false	0									
196	Manches verlernt man nie		Die drei ??? sollen von der Stadt Rocky Beach für ihr Lebenswerk geehrt werden. Und prompt sitzen sie gleich wieder mitten in einem neuen Fall …		2011-12-20	false	0									
197	Psychomoon		Kellys Tante wird erpresst und die drei ??? sollen bei der Übergabe des Geldes behilflich sein. Aber in dem Motel, in dem Peter und Kelly absteigen, passieren merkwürdige Dinge …		2011-12-22	false	0									
198	Jagd auf den Weihnachtsmann		Rocky Beach versinkt im Schnee. Und zu allem Überfluss treibt gerade jetzt, wo die Polizei mehr oder weniger handlungsunfähig ist, ein krimineller Weihnachtsmann in der Stadt sein Unwesen …		2011-12-24	false	0									
199	und der Feuergeist		Die privat geführte "Oper Califia" in Rocky Beach steht vor dem finanziellen Aus. So ist es nicht verwunderlich, dass die drei ??? zunächst an eine werbewirksame Veranstaltung glauben, als sich eine Mitarbeiterin der Oper Hilfe suchend an sie wendet: Im Gewölbekeller des Gebäudes gehen mysteriöse Dinge vor sich – und ein seltsames Wesen wurde gesichtet! Justus, Peter und Bob übernehmen den Fall und ahnen nicht, auf was sie sich da einlassen. Plötzlich bricht während einer Aufführung ein Großfeuer aus! War es Brandstiftung? Welche Rolle spielen dabei der undurchsichtige Moody Firthway und sein rotes Notizbuch? Nur Justus erkennt als Einziger, was sich tatsächlich hinter den Kulissen abspielt.		2012-11-30	false	1	http://a1.mzstatic.com/us/r30/Music71/v4/d5/8b/37/d58b3740-5414-043e-7a89-15fc43fbc024/source	http://web.archive.org/web/20220123153350if_/https://s3.eu-central-1.amazonaws.com/kosmos.de/media/image/77/57/f3/0886979232822.jpg	https://dreifragezeichen.de/produktwelt/details/und-der-feuergeist	1149014175	3uFt95otJjaxH8o40tPtIS	534813	B01HQ50OH0	B0071J4BGW	MPREb_jVvldecT0CJ
200	Nacht der Tiger		Wer ist der unbekannte Auftraggeber im neuen Fall der drei erfolgreichen Detektive aus Rocky Beach? Wie von Geisterhand erscheinen verschlüsselte Botschaften auf dem Computerbildschirm in der Zentrale. Justus' Ehrgeiz ist geweckt und die drei ??? beginnen zu ermitteln. Sie lösen die komplizierten Rätsel des Unbekannten und folgen seiner Spur. Dabei werden die drei Jungen immer tiefer in dubiose Machenschaften verstrickt. Als sich herausstellt, dass ein guter Freund von ihnen als Täter infrage kommt, stehen Justus, Peter und Bob vor einer schwierigen Entscheidung: Sollen sie ihren Freund ausliefern oder der Polizei die Wahrheit verschweigen? Justus fasst einen Plan – und die drei ??? entdecken das Unvorstellbare in der "Nacht der Tiger" …		2013-01-11	false	1	http://a1.mzstatic.com/us/r30/Music71/v4/76/95/67/76956777-0773-74b5-1ae9-880858e2c8c4/source	http://web.archive.org/web/20211231145705if_/https://s3.eu-central-1.amazonaws.com/kosmos.de/media/image/19/75/a0/0886979232921.jpg	https://dreifragezeichen.de/produktwelt/details/nacht-der-tiger	1149016169	4rCAnDrNJ96srnBEoA0ISj	534750	B01HQ4YFMG	B009TC7FZS	MPREb_ZmllYLCw1ry
201	Geheimnisvolle Botschaften		Der Raub eines alten handgefertigten Buchs stellt die drei ??? vor ein Rätsel. Denn im Haus von Professor Mathewson hätte es weitaus wertvollere Beute gegeben. Kaum beginnen Justus, Peter und Bob zu ermitteln, stecken sie schon bis zum Hals in Schwierigkeiten:\nEin geheimnisvoller Gegner ist ihnen stets einen Schritt voraus und schreckt vor nichts zurück …		2013-03-01	false	1	http://a1.mzstatic.com/us/r30/Music62/v4/02/d2/42/02d2428d-46c6-88ae-9840-bb6bac345d83/source	http://web.archive.org/web/20220114180112if_/https://s3.eu-central-1.amazonaws.com/kosmos.de/media/image/22/c2/6b/0886979233027.jpg	https://dreifragezeichen.de/produktwelt/details/geheimnisvolle-botschaften	1149017354	2F6VxgWbGCUpTU9ux6Dtbi	534741	B01HQGX8O0	B009TC7GHU	MPREb_zzA1Wsl8XZc
202	Die blutenden Bilder		Dreizehn geheimnisvolle Bilder sorgen auf dem Schrottplatz von Justus' Onkel Titus für allerhand Aufregung. Als sich eine ganze Reihe von zwielichtigen Gestalten für die Gemälde interessiert, wittern die drei ??? einen Fall. Zu dumm, dass einige der Bilder bereits spurlos verschwunden sind. Justus, Peter und Bob müssen sich bei ihrer Suche beeilen, denn Rocky Beach wird von einem hinterhältigen Erpresser heimgesucht, der es ausgerechnet auf Kunstwerke abgesehen hat und eine mysteriöse Spur hinterlässt.		2013-05-10	false	1	http://a1.mzstatic.com/us/r30/Music71/v4/53/4b/01/534b0104-c102-b636-e09f-0f693c658a03/source	http://web.archive.org/web/20211227022640if_/https://s3.eu-central-1.amazonaws.com/kosmos.de/media/image/b8/5c/91/0887254003120.jpg	https://dreifragezeichen.de/produktwelt/details/die-blutenden-bilder	1149329426	1GEzdjI5N25iuGjvypRscs	534756	B01HQH0N3I	B00BK8Z20O	MPREb_wen5af1ilQt
203	und der schreiende Nebel		Als die drei ??? Post von einem alten Bekannten erhalten, ahnen sie noch nicht, was für ein gefährliches Abenteuer sie erwartet. Der rätselhafte Hilferuf führt sie mitten in die Einöde von South Dakota. Dort werden sie Zeugen unfassbarer Ereignisse, die eine abgelegene Prärie-Ortschaft heimsuchen. Welches dunkle Geheimnis steckt hinter dem unheimlichen Nebel, der die Einwohner in Angst und Schrecken versetzt? Und was hat es mit den grässlichen Schreien auf sich, die immer wieder aus den weißen Schwaden dringen? Die drei Detektive nehmen die Ermittlungen auf – und geraten selbst in die Fänge des Nebels …		2013-07-12	false	1	http://a1.mzstatic.com/us/r30/Music71/v4/a3/37/c9/a337c9f9-455b-d36a-5431-c336dd4a4552/source	http://web.archive.org/web/20220111212302if_/https://s3.eu-central-1.amazonaws.com/kosmos.de/media/image/70/82/91/0887254003229.jpg	https://dreifragezeichen.de/produktwelt/details/und-der-schreiende-nebel	1149330399	7beppYTqtHAEPKoXyodssF	534800	B01HQGWSJG	B00CJPRI5E	MPREb_Ia1xixURwDy
204	und der verschollene Pilot		Eigentlich sollen die drei ??? für Onkel Titus nur ein Auto überführen. Doch der dichte Nebel in den Bergen zwingt sie, sich dort eine Unterkunft zu suchen. Ein seltsamer Pick-up-Fahrer führt sie zum "King of the Mountain", einem heruntergekommenen Hotel ohne einen einzigen Gast. Bald geschehen seltsame Dinge, die nur eins bedeuten können: Das Hotel birgt ein Geheimnis! Hat das Wrack eines vor Jahren in den Bergen abgestürzten Flugzeugs etwas damit zu tun?		2013-08-30	false	1	http://a1.mzstatic.com/us/r30/Music71/v4/64/c5/5b/64c55bab-6657-1761-b0e0-775082869537/source	http://web.archive.org/web/20220115152701if_/https://s3.eu-central-1.amazonaws.com/kosmos.de/media/image/bd/16/24/0887254003328.jpg	https://dreifragezeichen.de/produktwelt/details/und-der-verschollene-pilot	1149332439	4fv0pPN7ZjbUiejSTxTPZh	534809	B01HQGX97G	B00D4FB71O	MPREb_j8OddX7XGia
205	Fußball-Teufel		Eigentlich wollen die drei ??? am Felsen "Hooked Nose" nur nach einem verschwundenen Hund suchen, doch schon bald taucht ein düsterer Mann mit Pferdefuß auf. Ist der "Hooked Nose" wirklich ein verfluchter Ort, an dem der Teufel umgeht? Und was hat der junge Fußballer Lenni Carson mit dem Geheimnis des Felsens zu tun? Müssen es Justus, Peter und Bob bei ihren Ermittlungen dieses Mal wirklich mit dem Teufel persönlich aufnehmen?		2013-10-04	false	1	http://a1.mzstatic.com/us/r30/Music71/v4/33/9d/82/339d82ac-5442-604b-98b5-8c9d7ebc130e/source	http://web.archive.org/web/20220114180110if_/https://s3.eu-central-1.amazonaws.com/kosmos.de/media/image/0c/4a/4b/0887254003427.jpg	https://dreifragezeichen.de/produktwelt/details/fussball-teufel	1149333141	3An657Q0wkVp4nIDg2zpcB	534846	B01HQGZ802	B00D4FCCS6	MPREb_uP5FLd53eO1
206	und der 5. Advent		Die anstehenden Festtage haben sich Justus, Peter und Bob wahrlich anders vorgestellt: Durch einen Zufall wird Justus Zeuge, wie Tante Mathildas Freundin Lydia Candle am 1. Dezember in ihrem Adventskalender einen erschreckenden Fund macht!\nUnd schon bald stellt sich heraus, dass ein furchtbares Verbrechen verübt werden soll! Viel Zeit bleibt den drei Detektiven nicht, diesen verzwickten Fall zu lösen, in dem an jedem Tag neue Stolpersteine auftauchen, die schließlich nicht nur das Leben von Bob Andrews bedrohen! Die Zeit drängt und bis zum 24. Dezember gilt es, manch harte Nuss zu knacken …		2013-10-04	false	1	http://a1.mzstatic.com/r40/Music71/v4/96/1c/ed/961ced16-8515-10f4-6a56-02a2bc5bc285/886446100562.jpg		https://dreifragezeichen.de/produktwelt/details/der-5-advent	1174866876	2qFuUJMx8w4VEO0Zdf8jFJ	534933	B01N07GZIJ	B00E1SJDXW	MPREb_xqQYIFXpbwT
