hörspielID	titel	kurzbeschreibung	beschreibung	metabeschreibung	veröffentlichungsdatum	unvollständig	cover	urlCoverApple	urlCoverKosmos	urlDreifragezeichen	urlAppleMusic	urlSpotify	urlBookbeat
47	und der giftige Gockel		"Millionen werden sterben!" flüstert das Unfallopfer. – Wer ist der Täter? Die drei Detektive schalten sich ein, und ein Wettlauf mit der Zeit beginnt! Schon bald merken die drei Freunde, dass sie auf der richtigen Spur sind, denn ihr unbekannter Gegner schlägt zurück …		1989-11-24	false	1	http://a1.mzstatic.com/us/r30/Music60/v4/b2/6a/0a/b26a0a70-39c9-b7f1-8598-728b054c373c/source	http://web.archive.org/web/20220111212328if_/https://s3.eu-central-1.amazonaws.com/kosmos.de/media/image/bf/96/5f/0743213884721.jpg	https://dreifragezeichen.de/produktwelt/details/und-der-giftige-gockel	https://music.apple.com/de/album/folge-47-und-der-giftige-gockel/1092503309	https://open.spotify.com/intl-de/album/3iWNsrEs9D0FFlKFfscdvL	https://www.bookbeat.com/de/book/534661
48	und die gefährlichen Fässer		Die drei Detektive und Bobs Vater stürzen mit dem Flugzeug ab – mitten in ein Tal voller Geheimnisse und Gefahren. Merkwürdige, von Dämonen besessene Indianer tun rätselhafte Dinge, und dann stellt jemand den drei ??? eine tödliche Falle …		1989-11-25	false	1	http://a1.mzstatic.com/us/r30/Music20/v4/6d/bc/09/6dbc093b-5548-962c-dab3-f37767f8546b/source	http://web.archive.org/web/20220124230918if_/https://s3.eu-central-1.amazonaws.com/kosmos.de/media/image/4f/f1/e9/0743213884820.jpg	https://dreifragezeichen.de/produktwelt/details/und-die-gefahrlichen-fasser	https://music.apple.com/de/album/folge-48-und-die-gef%C3%A4hrlichen-f%C3%A4sser/1092518600	https://open.spotify.com/intl-de/album/5IRxm1lo35PttzU8YLslZy	https://www.bookbeat.com/de/book/534603
49	und die Comic-Diebe		Auf der InterComiCon werden Comics von unersetzlichem Wert gestohlen, und die drei ??? stehen unmittelbar daneben. Sie versuchen, den Fall aufzuklären, doch es erscheint zunächst unmöglich den Dieb zu finden. Dann aber ergibt sich eine Spur! Sofort reagiert der Dieb, und Peter entgeht nur ganz knapp einem tödlichen Anschlag …		1990-11-26	false	1	http://a1.mzstatic.com/us/r30/Music60/v4/42/06/a6/4206a643-9994-b4a3-8bb1-05911a76dbed/source	http://web.archive.org/web/20220114180157if_/https://s3.eu-central-1.amazonaws.com/kosmos.de/media/image/44/f2/0f/0743213884929.jpg	https://dreifragezeichen.de/produktwelt/details/und-die-comic-diebe	https://music.apple.com/de/album/folge-49-und-die-comic-diebe/1092503380	https://open.spotify.com/intl-de/album/7t2SteAH5OnLLC1ghTAmka	https://www.bookbeat.com/de/book/534682
50	und der verschwundene Filmstar		Ein Filmstar verschwindet – Diller Rourke, Hauptdarsteller im Horrorstreifen "Atemberaubend II", erscheint nicht zu den Dreharbeiten auf dem Friedhof. Die Zentrale der drei ??? wird überfallen und verwüstet. Trotzdem heften sie sich an die Fersen von Erfolgsproduzent Marty Morningbaum, seinem Regisseur und dem mysteriösen Kristallkugel-Guru mit dem dritten Auge. Eine knallharte Betrugsgeschichte, live aus dem glitzernden Show-Geschäft.		1991-03-19	false	1	http://a1.mzstatic.com/us/r30/Music18/v4/3b/13/ce/3b13cee9-0f9c-66c0-c0b8-fff0d058bb66/source	http://web.archive.org/web/20220114180141if_/https://s3.eu-central-1.amazonaws.com/kosmos.de/media/image/71/8a/c7/0743213885025.jpg	https://dreifragezeichen.de/produktwelt/details/und-der-verschwundene-filmstar	https://music.apple.com/de/album/folge-50-und-der-verschwundene-filmstar/1092502471	https://open.spotify.com/intl-de/album/6DKfjDIB1BSYRGAi2YJYm3	https://www.bookbeat.com/de/book/534561
51	und der riskante Ritt		Caramba! Wie heiß brennt die Sonne in den Bergen der Sierra Madre! Wäre da nicht der Silberschatz aus den Zeiten der Revolution, kein Mensch würde hier auf störrischen Wildeseln zwischen Kakteen und Buschwerk herumreiten. Ein brummelnder Vulkan, der jeden Moment ausbrechen kann, macht die Sache auch nicht gemütlicher. Selten haben die drei ??? ein so gefährliches Abenteuer erlebt.		1991-03-20	false	1	http://a1.mzstatic.com/us/r30/Music18/v4/1b/de/8a/1bde8a9a-6d18-6e8e-daca-86801874c325/source	http://web.archive.org/web/20220114180155if_/https://s3.eu-central-1.amazonaws.com/kosmos.de/media/image/37/1d/ab/0743213885124.jpg	https://dreifragezeichen.de/produktwelt/details/und-der-riskante-ritt	https://music.apple.com/de/album/folge-51-und-der-riskante-ritt/1110312706	https://open.spotify.com/intl-de/album/71kiy6INV3LzsCddpTZoHf	https://www.bookbeat.com/de/book/534655
52	und die Musikpiraten		Schlägerei auf dem Vergnügungsfest, Überfall auf Bob und eine nächtliche Verfolgungsjagd – es sieht ganz so aus, als sei der junge dritte Detektiv zwischen zwei rivalisierende Gaunerbanden geraten. Die heiße Spur führt zur Plattenfirma "Galactic Sound". Hier sind auf mysteriöse Weise Masterbänder verschwunden.\nAber wie schmuggeln die Musikpiraten die Aufnahmen aus dem Haus?		1991-07-12	false	1	http://a1.mzstatic.com/us/r30/Music30/v4/e9/0b/76/e90b769b-e62e-6704-ab3f-09de79e6ada2/source	http://web.archive.org/web/20220111023023if_/https://s3.eu-central-1.amazonaws.com/kosmos.de/media/image/1e/c4/9e/0743213885223.jpg	https://dreifragezeichen.de/produktwelt/details/und-die-musikpiraten	https://music.apple.com/de/album/folge-52-und-die-musikpiraten/1110311863	https://open.spotify.com/intl-de/album/3pXJh2A9gYzNt22rEIE5q7	https://www.bookbeat.com/de/book/534604
53	und die Automafia		Mit Autos kennt sich Justus' Vetter Ty Cassey einfach phantastisch aus. Ein bisschen zu gut, findet Kommissar Maxim vom Sonderdezernat Autodiebstähle und nimmt den verdächtigen jungen Mann vorläufig fest. Zugegeben, der geniale Mechaniker in den abgerissenen Klamotten, der die meiste Zeit durch die Gegend trampt, wirkt schon etwas ausgeflippt – aber ein Autodieb?\nDie drei ??? setzen alles dran, Tys Unschuld zu beweisen. Dabei bekommen sie es mit ausgekochten Profis zu tun, die vor nichts zurückschrecken.		1991-07-13	false	1	http://a1.mzstatic.com/us/r30/Music60/v4/a0/77/57/a077578d-eb5e-2c15-9fe7-a4c2aff6bbc1/source	http://web.archive.org/web/20220106180939if_/https://s3.eu-central-1.amazonaws.com/kosmos.de/media/image/46/c3/c4/0743213885322.jpg	https://dreifragezeichen.de/produktwelt/details/und-die-automafia	https://music.apple.com/de/album/folge-53-und-die-automafia/1110316053	https://open.spotify.com/intl-de/album/0F9ebKwTd5RNZZOu49lWuF	https://www.bookbeat.com/de/book/534560
54	Gefahr im Verzug		Anonyme Drohungen, umstürzende Kulissen, herumliegende Rasierklingen, eine Explosion:\nEs ist offensichtlich, dass irgendjemand George Brandon nach dem Leben trachtet. Der Star des Musicals "Gefahr im Verzug" entgeht den mysteriösen Unfällen nur um Haaresbreite. Aber die Show läuft weiter und entwickelt sich sogar zum Kassenschlager. Um unauffällig ermitteln zu können, schleusen sich Justus, Peter und Kelly als Statisten getarnt in den Theaterbetrieb ein.		1992-02-17	false	1	http://a1.mzstatic.com/us/r30/Music20/v4/aa/32/4e/aa324e0b-7353-6a32-9fba-1ae05bd79312/source	http://web.archive.org/web/20220124230940if_/https://s3.eu-central-1.amazonaws.com/kosmos.de/media/image/82/19/6a/0743213885421.jpg	https://dreifragezeichen.de/produktwelt/details/gefahr-im-verzug	https://music.apple.com/de/album/folge-54-gefahr-im-verzug/1110318678	https://open.spotify.com/intl-de/album/1Fg15cBLFliy6Kr60QqRan	https://www.bookbeat.com/de/book/534577
55	Gekaufte Spieler		Kaum zu fassen! Trainer Duggan bietet Peter das begehrte Stipendium am Shoremont College an. Die einzige Bedingung: Er soll in der dortigen Basketball-Mannschaft mitspielen. Das ist die Chance für den begeisterten Sportler. Wenig später findet er einen dicken Briefumschlag mit Hundert-Dollar-Scheinen in seinem Auto. Wie sich herausstellt, ist Peter nicht der einzige, der Bestechungsgelder erhält. Was steckt dahinter? Um den Skandal der gekauften Spieler aufzudecken, wird Justus sogar zum Papagei.		1992-02-18	false	1	http://a1.mzstatic.com/us/r30/Music60/v4/52/03/bf/5203bf9b-f1a0-b8d5-94ab-4ba2df90c4b0/source	http://web.archive.org/web/20220111023028if_/https://s3.eu-central-1.amazonaws.com/kosmos.de/media/image/33/69/b0/0743213885520.jpg	https://dreifragezeichen.de/produktwelt/details/gekaufte-spieler	https://music.apple.com/de/album/folge-55-gekaufte-spieler/1110318637	https://open.spotify.com/intl-de/album/4oH2GUWlSSsSgVkxyPVHX1	https://www.bookbeat.com/de/book/534672
56	Angriff der Computer-Viren		Kein Mensch kann von Computer-Viren angesteckt werden, aber ein viruskranker Computer kann tausende von Menschenleben gefährden! Das erkennen unsere drei Detektive, als ihr eigener Computer "abstürzt". Sie handeln sofort. Ihre Nachforschungen führen sie in die abenteuerliche Welt einer Werbefilmproduktion und … auf die Spur eines genialen Spinners, der leider auch ein gefährlicher Erpresser ist. Ein Fall für die drei ???, und ganz speziell für Justus, den Computer-Freak!		1992-09-14	false	1	http://a1.mzstatic.com/us/r30/Music30/v4/ca/c6/22/cac62219-77cf-07e6-8f0f-cb51d6c47038/source	http://web.archive.org/web/20220115045323if_/https://s3.eu-central-1.amazonaws.com/kosmos.de/media/image/d2/70/fc/0743213885629.jpg	https://dreifragezeichen.de/produktwelt/details/angriff-der-computer-viren	https://music.apple.com/de/album/folge-56-angriff-der-computer-viren/1110323229	https://open.spotify.com/intl-de/album/3fotka2Hbq0N7V9KKWIDdw	https://www.bookbeat.com/de/book/537487
57	Tatort Zirkus		Panik im Zirkus: Die junge Artistin Mary di Domenico stürzt während der Abendvorstellung vom Drahtseil. Für Justus, Peter und Bob steht fest: Das war kein Unfall! Immerhin gilt Mary als Erbin der wertvollen Sammlung des berühmten Clowns Jacky Knivel. Die drei ??? sind bereit, den Fall zu übernehmen, und schon stehen sie vor einem Rätsel: Ist ihre Auftraggeberin wirklich so unschuldig, wie sie behauptet?		1994-07-18	false	1	http://a1.mzstatic.com/us/r30/Music60/v4/22/f4/2e/22f42ec9-5f50-b15c-1e2c-c8614e062e9f/source	http://web.archive.org/web/20220123153435if_/https://s3.eu-central-1.amazonaws.com/kosmos.de/media/image/f3/af/93/0743213885728.jpg	https://dreifragezeichen.de/produktwelt/details/tatort-zirkus	https://music.apple.com/de/album/folge-57-tatort-zirkus/1110322732	https://open.spotify.com/intl-de/album/5W6dRiaeSVE7zUBYHbepak	https://www.bookbeat.com/de/book/534574
58	und der verrückte Maler		Tante Mathilda ist wütend! Wie kann Onkel Titus es nur wagen, dieses grauenhafte Gemälde einfach in ihr Wohnzimmer zu hängen! Noch in derselben Nacht versucht jemand den Ölschinken zu klauen. Grund genug für Justus, Peter und Bob sich einzuschalten. Drohanrufe, nächtliche Überfälle und eine verdächtige Safefirma führen die drei Junior-Detektive über das Meer zu einem einsam gelegenen Haus an der Küste. Dort erwartet sie eine gefährliche Überraschung.		1994-07-18	false	1	http://a1.mzstatic.com/us/r30/Music30/v4/1e/e8/56/1ee856ec-b33b-7b5e-ce59-f55ee0741436/source	http://web.archive.org/web/20220115045321if_/https://s3.eu-central-1.amazonaws.com/kosmos.de/media/image/03/52/8a/0743211851220.jpg	https://dreifragezeichen.de/produktwelt/details/und-der-verruckte-maler	https://music.apple.com/de/album/folge-58-und-der-verr%C3%BCckte-maler/1110322633	https://open.spotify.com/intl-de/album/6DWykdlgf60Mq02hPAGYVD	https://www.bookbeat.com/de/book/534621
59	Giftiges Wasser		Die Nachricht trifft Justus, Peter und Bob wie eine Bombe: Ein Unbekannter droht, das gesamte Trinkwasser des verschlafenen Touristenstädtchens Sedona zu vergiften, sollte das geplante Rockfestival nicht abgesagt werden. Die Polizei ist ratlos. Die drei ??? übernehmen den Fall und geraten bald in brenzlige Situationen. Da meldet sich der Erpresser erneut – das Ultimatum läuft ab!		1994-08-10	false	1	http://a1.mzstatic.com/us/r30/Music60/v4/6f/f4/79/6ff47958-586c-ebea-9cb7-a2a21468a1d0/source	http://web.archive.org/web/20220111212358if_/https://s3.eu-central-1.amazonaws.com/kosmos.de/media/image/13/bc/39/0743211851329.jpg	https://dreifragezeichen.de/produktwelt/details/giftiges-wasser	https://music.apple.com/de/album/folge-59-giftiges-wasser/1110323285	https://open.spotify.com/intl-de/album/2qcA1EqAoUsqxXqIivY6Zc	https://www.bookbeat.com/de/book/534650
60	Dopingmixer		Sport lässt Justus normalerweise kalt. Besonders, wenn er an einem neuen Fall arbeitet. Aber was er da auf dem Sportplatz der Highschool von Rocky Beach erlebt, macht ihn stutzig. Einer der Jungs, die mit Peter für das Sportfest trainieren, läuft sensationell schnell! Und kaum versuchen die drei ??? der Sache auf den Grund zu gehen, taucht der Sprinter unter. Opfer gewinnsüchtiger Manager oder selbst ein gewiefter Doping-Betrüger? Wer hat da seine Finger im Spiel?		1994-08-11	false	1	http://a1.mzstatic.com/us/r30/Music20/v4/a6/29/2b/a6292b27-fee9-d341-910e-7f7347e3a4dd/source	http://web.archive.org/web/20220115135401if_/https://s3.eu-central-1.amazonaws.com/kosmos.de/media/image/82/1f/5f/0743211851428.jpg	https://dreifragezeichen.de/produktwelt/details/dopingmixer	https://music.apple.com/de/album/folge-60-dopingmixer/1110323342	https://open.spotify.com/intl-de/album/7cBoiWgh1bTMZmCwJE0eMu	https://www.bookbeat.com/de/book/534542
61	und die Rache des Tigers		Ein Sprengsatz explodiert während der Einweihungsfeier eines Vergnügungsparks im ehemaligen Zoo von Rocky Beach. Steckt tatsächlich die Bürgerinitiative dahinter, die auf demselben Gelände eine Jugendfarm errichten möchte? Die drei Detektive Justus, Peter und Bob können nicht recht daran glauben und suchen die wahren Hintermänner des feigen Anschlags. Doch erst ein geheimnisvoller Brief setzt die drei ??? auf die richtige Spur und führt sie zum "Thron des Tigers". Dort erwartet sie eine gefährliche Überraschung.		1995-02-27	false	1	http://a1.mzstatic.com/us/r30/Music20/v4/51/89/01/51890174-ada7-dd26-2a09-1fae93b9900d/source	http://web.archive.org/web/20220111023025if_/https://s3.eu-central-1.amazonaws.com/kosmos.de/media/image/fc/e7/d4/0743212358223.jpg	https://dreifragezeichen.de/produktwelt/details/und-die-rache-des-tigers	https://music.apple.com/de/album/folge-61-und-die-rache-des-tigers/1110773048	https://open.spotify.com/intl-de/album/26M4ktHp3isOX6XJazAxPn	https://www.bookbeat.com/de/book/534576
62	Spuk im Hotel		Seltsame Dinge geschehen im Hotel der exzentrischen Amanda Black. Ein Unbekannter treibt seine Spielchen mit der ehemaligen Schauspielerin. Über Nacht verschwinden Erinnerungsstücke, die an denkbar merkwürdigen Stellen wieder auftauchen. Doch als schließlich ein Nebengebäude in Flammen aufgeht, sind sich Justus, Peter und Bob einig: Das ist bitterer Ernst! Die drei ??? entschließen sich, dem Täter eine Falle zu stellen.		1995-02-28	false	1	http://a1.mzstatic.com/us/r30/Music60/v4/8a/0c/d8/8a0cd85a-830a-47ff-58b3-afb4d07d5906/source	http://web.archive.org/web/20220115152725if_/https://s3.eu-central-1.amazonaws.com/kosmos.de/media/image/01/7d/4e/0743212358322.jpg	https://dreifragezeichen.de/produktwelt/details/spuk-im-hotel	https://music.apple.com/de/album/folge-62-spuk-im-hotel/1110774403	https://open.spotify.com/intl-de/album/0biXUv1uGUaVsPcw8nAZCY	https://www.bookbeat.com/de/book/534723
63	Fußball-Gangster		Welches Interesse könnte ein Lebensmittelkonzern daran haben, eine ganze Fußballmannschaft unter seine Kontrolle zu bringen? Jimboy, Justus Cousin, hat sich mächtig verändert, seit er Stürmer in dieser Elf ist. Und zwar nicht zu seinem Vorteil. Die drei ??? merken bald den Zusammenhang zwischen Jimboys Schweigsamkeit und seinen Erlebnissen im streng bewachten Trainingslager. Aber kaum haben sie Erfolg bei ihren Erkundigungen, schaltet sich Inspektor Cotta ein. Justus, Peter und Bob sollen die Finger von dem brandheißen Fall lassen. Das sehen die drei ??? entschieden anders …		1995-08-28	false	1	http://a1.mzstatic.com/us/r30/Music60/v4/f3/26/93/f3269335-43f5-7026-235f-671d7a5cb163/source	http://web.archive.org/web/20220106180936if_/https://s3.eu-central-1.amazonaws.com/kosmos.de/media/image/a5/8c/89/0743212482225.jpg	https://dreifragezeichen.de/produktwelt/details/fussball-gangster	https://music.apple.com/de/album/folge-63-fu%C3%9Fball-gangster/1110774845	https://open.spotify.com/intl-de/album/5GPTZKrD7eaCp9p6VOBuIN	https://www.bookbeat.com/de/book/534601
64	Geisterstadt		Über Nacht wird aus harmlosen Skiferien in den Bergen eine gefährliche Suche im Kriminalfall Oames. Der Gastgeber der drei ???, der berühmte Spieleverleger Michael Julius Oames, ist entführt worden. Die Kidnapper fordern eine Million Dollar. Eine Menge Geld, finden Justus, Peter und Bob und beschließen, der Polizei von Lake Tahoe unter die Arme zu greifen. Kann Oames Vergangenheit Licht in die Sache bringen? Da stoßen sie auf eine heiße Spur. Sie führt direkt in eine Geisterstadt.		1995-08-28	false	1	http://a1.mzstatic.com/us/r30/Music30/v4/18/56/35/185635ed-e17c-b9a6-7276-5d63b67c8b62/source	http://web.archive.org/web/20220123153420if_/https://s3.eu-central-1.amazonaws.com/kosmos.de/media/image/91/33/36/0743212482324.jpg	https://dreifragezeichen.de/produktwelt/details/geisterstadt	https://music.apple.com/de/album/folge-64-geisterstadt/1110774478	https://open.spotify.com/intl-de/album/0tmMvsGyWRzVckCYgkvve3	https://www.bookbeat.com/de/book/534613
65	Diamantenschmuggel		Ihren ersten Trip nach Europa haben sich Justus, Peter und Bob anders vorgestellt: Statt der erwarteten Vergnügungstour durch London werden sie in einen Diamantenschmuggel verwickelt und sogar – natürlich unfreiwillig und zunächst völlig ahnungslos – als Kuriere der heißen Ware benutzt. Schnell wird ihnen klar, dass die Reisegesellschaft, mit der sie einen Ausflug nach Rotterdam unternehmen, nicht nur aus erlebnishungrigen Touristen besteht. Welche Rolle spielt zum Beispiel der tolpatschige Mr. Thomas? Steckt er hinter den anonymen Briefen? Doch von solchen Einschüchterungsversuchen lassen sich die drei ??? bestimmt nicht abschrecken!		1995-12-04	false	1	http://a1.mzstatic.com/us/r30/Music18/v4/1a/1d/aa/1a1daabb-d03d-b221-8a11-21b72acb7f45/source	http://web.archive.org/web/20220115135412if_/https://s3.eu-central-1.amazonaws.com/kosmos.de/media/image/05/8b/b6/0743213131528.jpg	https://dreifragezeichen.de/produktwelt/details/diamantenschmuggel	https://music.apple.com/de/album/folge-65-diamantenschmuggel/1110776310	https://open.spotify.com/intl-de/album/62z7yW4RKhhuAp0RklmNvc	https://www.bookbeat.com/de/book/534659
66	und die Schattenmänner		Aus einem harmlosen Ausflug nach Rom wird für die drei ??? ein ganz heißer Fall. Direkt vor ihren Augen ereignen sich dreiste Überfälle an sorglosen Spaziergängern. Die Geschwindigkeit und Routine der Diebstähle macht klar: Hier sind Profis am Werk.\nKeine Frage, dass Justus, Peter und Bob die Verfolgung aufnehmen. Als sie jedoch den wahren Drahtziehern auf die Spur kommen, wird die Situation für sie mehr als brenzlig …		1995-12-04	false	1	http://a1.mzstatic.com/us/r30/Music20/v4/3b/8d/c9/3b8dc904-52da-f3cd-d361-933b4dce7753/source	http://web.archive.org/web/20220115135355if_/https://s3.eu-central-1.amazonaws.com/kosmos.de/media/image/0e/01/10/0743213131627.jpg	https://dreifragezeichen.de/produktwelt/details/und-die-schattenmanner	https://music.apple.com/de/album/folge-66-und-die-schattenm%C3%A4nner/1110777991	https://open.spotify.com/intl-de/album/6qj4LD0zotutkIgEg9OvDj	https://www.bookbeat.com/de/book/534615
67	und das Geheimnis der Särge		Haarsträubende Dinge erzählt man sich von den berühmten Höhlenlabyrinthen auf der schwäbischen Alb, aber natürlich ist davon nur die Hälfte wahr. Doch Justus, Peter und Bob, die drei Junior-Detektive aus Rocky Beach, beginnen an Spukgeschichten zu glauben, als sie in der Geisterhöhle urplötzlich eine grausige Entdeckung machen …		1996-04-01	false	1	http://a1.mzstatic.com/us/r30/Music18/v4/2a/de/b4/2adeb4d6-8000-9e52-bb64-ae4f0dcad8ec/source	http://web.archive.org/web/20220114180145if_/https://s3.eu-central-1.amazonaws.com/kosmos.de/media/image/94/fb/e4/0743213558325.jpg	https://dreifragezeichen.de/produktwelt/details/und-das-geheimnis-der-sarge	https://music.apple.com/de/album/folge-67-und-das-geheimnis-der-s%C3%A4rge/1110778079	https://open.spotify.com/intl-de/album/7Hjk98j1FSrHV5IHWmeeFh	https://www.bookbeat.com/de/book/534568
68	und der Schatz im Bergsee		Eine brenzlige Situation für Justus, Peter und Bob: Ihr Rundflug über die Schweizer Alpen endet jäh mit einer Bruchlandung. Der Pilot ist bewusstlos, das Funkgerät zerstört. Plötzlich landet ein Helikopter neben ihnen. Bewaffnete Männer fesseln und knebeln Bob, und die drei ??? müssen hilflos zusehen, wie die Gangster das Flugzeugwrack durchsuchen. Wenig später verschwinden sie wieder. Die drei Junior-Detektive können sich in Sicherheit bringen. Doch dann kommen die Gangster zurück …		1996-04-02	false	1	http://a1.mzstatic.com/us/r30/Music60/v4/39/d8/5b/39d85baf-b146-6fb2-4c15-e80afaf87525/source	http://web.archive.org/web/20220111212343if_/https://s3.eu-central-1.amazonaws.com/kosmos.de/media/image/80/fc/8e/0743213558424.jpg	https://dreifragezeichen.de/produktwelt/details/und-der-schatz-im-bergsee	https://music.apple.com/de/album/folge-68-und-der-schatz-im-bergsee/1110779156	https://open.spotify.com/intl-de/album/21pUsEhxssm6fvumGFmi35	https://www.bookbeat.com/de/book/534927
69	Späte Rache		"Wir haben Peter! Er muss für alles bezahlen!"\nEin anonymer Brief schreckt Justus und Bob auf. Eigene Nachforschungen nach dem Schicksal ihres Zweiten Detektivs bleiben ergebnislos, deshalb wenden sie sich hilfesuchend an die Polizei von Rocky Beach. Ihr Freund Inspektor Cotta schlägt vor, eine Polizeipsychologin hinzuzuziehen. Sie soll aus dem Bekennerschreiben Hinweise auf den Charakter des Täters herauslesen. Und tatsächlich kommt die Expertin zu einem überraschenden Schluss: Hinter der Entführung steckt ein lange zurückliegender Fall der drei Detektive. Justus und Bob durchforsten ihr umfangreiches Archiv.\nDenn die Zeit läuft …		1996-08-05	false	1	http://a1.mzstatic.com/us/r30/Music60/v4/5e/46/2a/5e462af7-1f61-e3a4-3a6f-655b33a55482/source	http://web.archive.org/web/20220114180143if_/https://s3.eu-central-1.amazonaws.com/kosmos.de/media/image/a0/7b/77/0743213558523.jpg	https://dreifragezeichen.de/produktwelt/details/spate-rache	https://music.apple.com/de/album/folge-69-sp%C3%A4te-rache/1110780549	https://open.spotify.com/intl-de/album/2erJcBofKBO6GFMqDPppsU	https://www.bookbeat.com/de/book/534704
70	Schüsse aus dem Dunkel		Mit einer flotten Bühnenshow präsentiert die erfolgreiche Modedesignerin Sally Samson ihre neue Kollektion. Bei der Westernmode passiert es: Ein Model bricht, von einem Schuss getroffen, zusammen. Ein kaltblütiger Anschlag? Wem war die junge Frau im Weg? Oder war es ein Ablenkungsmanöver? Gibt es eine Verbindung zwischen dem Schuss und den geraubten Entwürfen aus Sally Samsons Tresor? Für Justus, Peter und Bob, die drei erfolgreichen Detektive aus Rocky Beach, gibt es nur eine Möglichkeit, dem Täter auf die Spur zu kommen: Sie müssen sich als Model bewerben.		1996-08-05	false	1	http://a1.mzstatic.com/us/r30/Music60/v4/79/ca/7a/79ca7a9a-d60c-0ad2-2ce3-3958e43f83cc/source	http://web.archive.org/web/20220111212340if_/https://s3.eu-central-1.amazonaws.com/kosmos.de/media/image/d5/21/d3/0743213849423.jpg	https://dreifragezeichen.de/produktwelt/details/schusse-aus-dem-dunkel	https://music.apple.com/de/album/folge-70-sch%C3%BCsse-aus-dem-dunkel/1110781480	https://open.spotify.com/intl-de/album/4mlQEwk6I0XuksZCYTtatz	https://www.bookbeat.com/de/book/534625
71	Die verschwundene Seglerin		Was geschah mit Irma Bannister? Von einem Segelausflug mit Freunden kehrte die beliebte Antiquitätenhändlerin nicht mehr zurück. Doch die Trauer der Hinterbliebenen hält sich in Grenzen. Die drei Detektive aus Rocky Beach wittern einen brisanten Fall und nehmen die Fährte auf. Doch ihre Recherchen enden in einer Sackgasse, die Betroffenen schweigen. Was ist tatsächlich passiert?		1996-10-07	false	1	http://a1.mzstatic.com/us/r30/Music20/v4/9d/97/2e/9d972eb9-f718-b639-4865-98057d99bb23/source	http://web.archive.org/web/20220706182607if_/https://s3.eu-central-1.amazonaws.com/kosmos.de/media/image/3c/1f/38/0743213849621.jpg	https://dreifragezeichen.de/produktwelt/details/die-verschwundene-seglerin	https://music.apple.com/de/album/folge-71-die-verschwundene-seglerin/1112949182	https://open.spotify.com/intl-de/album/6EEN6onzbHIOxnwUkGfKhv	https://www.bookbeat.com/de/book/534588
72	Dreckiger Deal		King's Café ist für die Schülerinnen und Schüler der High School von Rocky Beach ein beliebter Treffpunkt: Der freundliche Besitzer Malcolm King hat immer ein offenes Ohr für sie und hilft, wo er kann. Deshalb ist es ein großer Schock für sie, als King plötzlich verhaftet wird. Die Polizei hat in seinem Laden Rauschgift gefunden. Justus, Peter und Bob, die drei jungen Detektive, wollen King helfen. Aber sie wissen nicht, worauf sie sich da eingelassen haben.		1996-10-07	false	1	http://a1.mzstatic.com/us/r30/Music60/v4/4a/0d/a0/4a0da044-0a16-4d61-5692-2891bc19dfb0/source	http://web.archive.org/web/20220123153418if_/https://s3.eu-central-1.amazonaws.com/kosmos.de/media/image/b5/eb/3c/0743213849720.jpg	https://dreifragezeichen.de/produktwelt/details/dreckiger-deal	https://music.apple.com/de/album/folge-72-dreckiger-deal/1112951262	https://open.spotify.com/intl-de/album/2GQjkF0ceIse6jVZkUuAQc	https://www.bookbeat.com/de/book/534725
