hörspielID	titel	kurzbeschreibung	beschreibung	metabeschreibung	veröffentlichungsdatum	unvollständig	cover	urlCoverApple	urlCoverKosmos	urlDreifragezeichen	urlAppleMusic	urlSpotify	urlBookbeat
222	und der Eisenmann		Auf einer einsamen Insel stoßen die drei ??? auf den Künstler Drago Martinez. Der hat großen Erfolg mit seinem einzigartigen Werk "Eisenmann". Doch die Freude darüber ist kurz: Drago wird verfolgt und fürchtet um sein Leben! Steckt ein verrückter Kunstliebhaber dahinter? Offenbar sind die drei Freunde der Lösung zu nahe, denn jemand lockt sie in einen Hinterhalt …		2014-11-28	false	1	http://a1.mzstatic.com/us/r30/Music122/v4/cc/65/a6/cc65a6f0-817b-1df8-21b3-82e33ccaa0d1/source	http://web.archive.org/web/20220114180109if_/https://s3.eu-central-1.amazonaws.com/kosmos.de/media/image/fa/cb/c4/0888430093027.jpg	https://dreifragezeichen.de/produktwelt/details/und-der-eisenmann	https://music.apple.com/de/album/folge-172-und-der-eisenmann/1149910943	https://open.spotify.com/intl-de/album/6Anfub4AoVHg9bhJ7js0L0	https://www.bookbeat.com/de/book/534827
223	Dämon der Rache		Bei einer Ballonfahrt entdeckt Peter in der Nähe einer abgelegenen Villa ein Monster. Eindeutig ein neuer Fall für die drei ???! Ihre Ermittlungen führen die Detektive zur seltsamen Mrs. Pembroke und ihrem Neffen Luke. Die beiden werden von einer grässlichen Gestalt bedroht. Luke bittet Justus, Peter und Bob um Hilfe. Doch schnell wird klar: Der Dämon der Rache ist nicht aufzuhalten …		2015-01-16	false	1	http://a1.mzstatic.com/us/r30/Music122/v4/2b/a1/4d/2ba14d6b-6af1-15a0-d11f-c86a18e840e4/source	http://web.archive.org/web/20220123153346if_/https://s3.eu-central-1.amazonaws.com/kosmos.de/media/image/82/39/c1/0888430093126.jpg	https://dreifragezeichen.de/produktwelt/details/damon-der-rache	https://music.apple.com/de/album/folge-173-d%C3%A4mon-der-rache/1149354238	https://open.spotify.com/intl-de/album/2ALDCHCHdawewN1sduWVQQ	https://www.bookbeat.com/de/book/534822
224	und das Tuch der Toten		Ein zunächst harmloser Ausflug entwickelt sich zu einem geheimnisvollen Fall für die drei ???:\nIn einem sagenumwobenen Waldgebiet in den Santa Monica Mountains streift eine düstere Gestalt umher. Ein Wesen aus der Urzeit? Justus, Peter und Bob stoßen auf rätselhafte Spuren. Was sie nicht wissen: Sie sind nicht die Verfolger, sondern die Beute …		2015-03-06	false	1	http://a1.mzstatic.com/us/r30/Music71/v4/a3/9d/83/a39d836b-7859-bd8e-5169-d22155f856f1/source	http://web.archive.org/web/20220104131535if_/https://s3.eu-central-1.amazonaws.com/kosmos.de/media/image/55/82/07/0888430093225580828a2c6a7d.jpg	https://dreifragezeichen.de/produktwelt/details/und-das-tuch-der-toten	https://music.apple.com/de/album/folge-174-und-das-tuch-der-toten/1149348842	https://open.spotify.com/intl-de/album/5RoL0jdWMoJ8KRFVOeFYtX	https://www.bookbeat.com/de/book/534782
225	Schattenwelt		Die drei Detektive bekommen eine einmalige Chance: Sie dürfen an der Universität Ruxton für ein paar Wochen das Studentenleben testen! Doch schnell wird klar, dass hier nicht nur Vorlesungen, Partys und Wohnheimzoff auf sie warten, sondern ein neuer Fall!		2015-05-15	false	1	http://a1.mzstatic.com/us/r30/Music111/v4/c9/06/4e/c9064ea2-b476-e29b-33dd-182f11650b02/source		https://dreifragezeichen.de/produktwelt/details/schattenwelt	https://music.apple.com/de/album/folge-175-schattenwelt/1149344576	https://open.spotify.com/intl-de/album/4uggmrJ3Xpm1e2tcz6laze	https://www.bookbeat.com/de/book/534922
226	Teuflisches Duell		Kurz nach ihrem Einzug ins Studentenwohnheim werden die drei ??? Zeugen merkwürdiger Ereignisse auf dem Campus. Unmenschliche Schreie hallen über das Gelände, freundliche Studenten werden plötzlich aggressiv – geht hier alles mit rechten Dingen zu? Und wer ist der Teumessische Fuchs, über den man überall Gerüchte hört? Eine Fuchsjagd der besonderen Art beginnt …			false	0						
227	Angriff in der Nacht		Ihre Ermittlungen führen die drei ??? immer weiter in einen Sumpf aus Lügen und dunklen Machenschaften. Doch wer steckt hinter alldem? Justus, Peter und Bob sind dem Teumessischen Fuchs auf der Spur, der überall und nirgends zu sein scheint. Doch haben die drei Detektive den richtigen Riecher? Eines Nachts schlägt ihr unbekannter Gegner plötzlich zu …			false	0						
228	Die dunkle Macht		Die drei Detektive machen ein paar spektakuläre Entdeckungen. Doch der Teumessische Fuchs scheint ihnen stets einen Schritt voraus zu sein. Noch immer wissen sie nicht, wer sich hinter dem rätselhaften Wesen verbirgt. Und je näher die drei ??? ihm kommen, desto gefährlicher wird es für sie. Als Justus, Peter und Bob endlich auf ihren Widersacher treffen, zeigt der Fuchs sein wahres Gesicht …			false	0						
229	und der gestohlene Sieg		Zwei Tore liegen das Frauenteam der LA Strikers zurück – zehn Minuten vor Abpfiff. Nicht nur die drei ??? glauben das Fußballspiel gegen die haushoch überlegenen Rochester Ravens sei schon entschieden. Doch plötzlich wendet sich das Blatt und die Strikers nehmen den Pokal mit nach Hause! Ein zweifelhafter Sieg, finden auch die drei Detektive. War Bestechung im Spiel? Anpfiff für die Ermittlungen! Diese bringen Justus, Peter und Bob auf die Spur eines skrupellosen Erpressers …		2015-07-10	false	1	http://a1.mzstatic.com/us/r30/Music122/v4/3d/a3/6f/3da36fd6-b627-8563-9b74-27376e5994ff/source	http://web.archive.org/web/20220111022948if_/https://s3.eu-central-1.amazonaws.com/kosmos.de/media/image/0c/ec/90/0888430093423.jpg	https://dreifragezeichen.de/produktwelt/details/und-der-gestohlene-sieg	https://music.apple.com/de/album/folge-176-und-der-gestohlene-sieg/1149349243	https://open.spotify.com/intl-de/album/4qbxSVpr3NxRjdIVC411ue	https://www.bookbeat.com/de/book/534884
230	Der Geist des Goldgräbers		Im menschenleeren Dead Man's Canyon begegnet den drei ??? plötzlich ein Goldgräber. Und zwar nicht irgendeiner, sondern John Dewey! Der aber kam vor über 100 Jahren zu Tode und verfluchte jeden, der seinem Gold jemals zu nahe kommen würde. Für Justus steht fest: alles Legende! Doch als in der darauffolgenden Nacht gespenstischer Besuch vor der Tür steht, erwacht die Legende zum Leben …		2015-10-02	false	1	http://a1.mzstatic.com/us/r30/Music122/v4/40/a6/8f/40a68f11-474a-dded-654b-a5d62a9e62d1/source	http://web.archive.org/web/20220106180902if_/https://s3.eu-central-1.amazonaws.com/kosmos.de/media/image/94/26/19/0888430093522.jpg	https://dreifragezeichen.de/produktwelt/details/der-geist-des-goldgrabers	https://music.apple.com/de/album/folge-177-der-geist-des-goldgr%C3%A4bers/1149354207	https://open.spotify.com/intl-de/album/0w6Khy7kpqTXrEDITf0rZ0	https://www.bookbeat.com/de/book/534879
231	Der gefiederte Schrecken		Was hat ein seltsames Vogelwesen mit einem riesigen Aquarium zu tun? Wer hat ein Interesse daran, die gigantische Meereslandschaft des mürrischen Mr. Faring zu zerstören? Und vor allem warum? Schon am Anfang ihres neuesten Falls gibt es eine Menge Fragezeichen für Justus, Peter und Bob. Und am Tatort gilt es, nicht nur erstaunliche Kreaturen in Sicherheit zu bringen, sondern auch ein höchst merkwürdiges Rätsel zu lösen …		2015-12-04	false	1	http://a1.mzstatic.com/us/r30/Music19/v4/6b/f2/73/6bf27389-03bd-4df6-30d8-a3bc066ece4b/source	http://web.archive.org/web/20220115152700if_/https://s3.eu-central-1.amazonaws.com/kosmos.de/media/image/7b/28/f7/0888430093720.jpg	https://dreifragezeichen.de/produktwelt/details/der-gefiederte-schrecken	https://music.apple.com/de/album/folge-178-der-gefiederte-schrecken/1149355884	https://open.spotify.com/intl-de/album/3w5glP0mzKfTanzXpAjN27	https://www.bookbeat.com/de/book/534923
232	Die Rache des Untoten		Bob soll ein Vermögen erben! Nur hat er von seinem Wohltäter noch nie etwas gehört. Schnell stellt sich heraus, dass auch andere Menschen ein ähnliches Schreiben erhalten haben. Die drei ??? brechen gemeinsam mit ihnen zu einer Reise auf. Ihr Ziel: ein einsam gelegenes Blockhaus im "Tal der Klapperschlangen". Plötzlich verschwindet eine junge Frau, und es wird klar: Jemand hat es auf die Gruppe abgesehen …		2016-01-15	false	1	http://a1.mzstatic.com/us/r30/Music69/v4/98/fc/fd/98fcfd62-42ca-9167-6c85-fdc51d4c05a7/source	http://web.archive.org/web/20211227022641if_/https://s3.eu-central-1.amazonaws.com/kosmos.de/media/image/2b/b4/d4/0888430093829.jpg	https://dreifragezeichen.de/produktwelt/details/die-rache-des-untoten	https://music.apple.com/de/album/folge-179-die-rache-des-untoten/1149356212	https://open.spotify.com/intl-de/album/4IZ7Lsm5le7HJPtaGLCrjO	https://www.bookbeat.com/de/book/534870
233	und die flüsternden Puppen		Ein Mädchen wurde entführt! Am helllichten Tag, direkt vor einem Fitnessstudio!\nDer einzige Hinweis, den Bianca in Panik hinterlassen konnte, ist eine Botschaft auf einem alten Walkman. Die drei ??? verfolgen die Spur der Entführer bis zu einer verlassenen Hütte in Mexiko. Dort stoßen sie auf rätselhafte Dinge und bringen sich dabei selbst in Gefahr …		2016-03-04	false	1	http://a1.mzstatic.com/us/r30/Music49/v4/58/d1/08/58d10887-deb4-9900-0d2e-afa745b2fb57/source	http://web.archive.org/web/20211231145703if_/https://s3.eu-central-1.amazonaws.com/kosmos.de/media/image/54/6b/c5/0888430093928.jpg	https://dreifragezeichen.de/produktwelt/details/und-die-flusternden-puppen	https://music.apple.com/de/album/folge-180-und-die-fl%C3%BCsternden-puppen/1149352111	https://open.spotify.com/intl-de/album/6tioH9PNiZbmUT54MsiX5k	https://www.bookbeat.com/de/book/534758
234	und der Zeitgeist		Die drei ??? übernehmen jeden Fall. Da gibt's immer Überraschungen, ungeahnte Wendungen – und manchmal kommt alles wirklich ganz anders als gedacht! So wie in diesen kurzen Fällen, bei denen die Welt von Justus, Peter und Bob manchmal ganz schön auf den Kopf gestellt wird. Da ist vorwärts dann plötzlich doch rückwärts und vorn ist hinten und gleich nochmal von vorn …	Sechs verzwickte, experimentierfreudige, rätselhafte Kurzgeschichten aus Rocky Beach!	2016-03-04	false	1			https://dreifragezeichen.de/produktwelt/details/und-der-zeitgeist-sechs-kurzgeschichten	https://music.apple.com/de/album/und-der-zeitgeist-sechs-kurzgeschichten/1149379770	https://open.spotify.com/intl-de/album/4lLOJQU6QBH5cxmERE77La	https://www.bookbeat.com/de/book/534852
235	Immer und immer wieder		Peter ist ratlos: In wenigen Minuten wird die Zentrale zerstört werden, und er kann nichts dagegen tun! Erst ein Tipp vom Ersten Detektiv bringt ihn auf die richtige Spur – oder doch nicht?			false	0						
236	Der Raub der Zehntausend		Beim Ausliefern einer Standuhr geraten die drei Detektive mitten in einen Kriminalfall, der äußerst explosiv enden könnte …			false	0						
237	Der verschwundene Zeitgeist		Wer hat die fehlenden Manuskriptseiten von Malcolm Fever gestohlen? Als sich die drei Detektive des Falls annehmen, machen sie die Bekanntschaft mit einer höchst sonderbaren Dame …			false	0						
238	Leaving Nineteen Sixty-four		Professor Selby hat die drei ??? auf eine Reise durch die Zeit geschickt – nun müssen sie ein Rätsel lösen, um zurückzukehren.			false	0						
239	Rückwärtsgang		In diesem rätselhaften Fall scheint die Zeit aus den Fugen geraten zu sein – mal geht es vorwärts, dann wieder zurück!			false	0						
240	Zeit der Opfer, Zeit der Wunder		Eigentlich geht es nur um ein Literaturprojekt für die Schule – doch mit den drei ??? wird auch das schnell zu einem Abenteuer …			false	0						
241	Das Kabinett des Zauberers		Wie kann es sein, dass ein Zauberer während einer Vorstellung verschwindet? Ist er Opfer seiner eigenen Magie geworden? Alles andere als Hokuspokus, sind sich die drei ??? einig. Auf ihrer Suche nach dem verschwundenen Zauberer Pablo müssen Justus, Peter und Bob mehr als nur ein Zauberkabinett durchsuchen, und offenbar gefällt das jemandem überhaupt nicht …		2016-05-13	false	1	http://a1.mzstatic.com/us/r30/Music49/v4/5d/5c/3c/5d5c3c06-d62b-cd67-077a-af7479f96522/source	http://web.archive.org/web/20220124230851if_/https://s3.eu-central-1.amazonaws.com/kosmos.de/media/image/72/dc/ab/0888751319622.jpg	https://dreifragezeichen.de/produktwelt/details/das-kabinett-des-zauberers	https://music.apple.com/de/album/folge-181-das-kabinett-des-zauberers/1149351738	https://open.spotify.com/intl-de/album/18xyskqkEGnVfVFhznkFIK	https://www.bookbeat.com/de/book/534881
242	Im Haus des Henkers		Eine Serie von Überfällen beschäftigt die Polizei von Rocky Beach. Als ein harmlos wirkender Mann unerwartet den letzten Raub gesteht und ein alter Bekannter in die Sache hineingezogen wird, ist klar: Hier geht etwas nicht mit rechten Dingen zu! Justus, Peter und Bob ermitteln an düsteren Orten und geraten in die Gesellschaft zwielichtiger Gestalten …		2016-07-22	false	1	http://a1.mzstatic.com/us/r30/Music49/v4/66/11/5f/66115f6e-4d08-c01e-50e8-4bfbe714afbe/source	http://web.archive.org/web/20220115135340if_/https://s3.eu-central-1.amazonaws.com/kosmos.de/media/image/91/f6/c2/0888751319721.jpg	https://dreifragezeichen.de/produktwelt/details/im-haus-des-henkers	https://music.apple.com/de/album/folge-182-im-haus-des-henkers/1149351939	https://open.spotify.com/intl-de/album/4zCPToY7AoTqvOKf4HRqAN	https://www.bookbeat.com/de/book/534909
243	und der letzte Song		Lenny "The Rock", der erfolgreiche Rockstar, veranstaltet auf seinem Anwesen ein aufwendiges Geburtstagskonzert voller Spezialeffekte. Als Höhepunkt der Party hat er eine Überraschung angekündigt. Auch Justus, Peter und Bob sind unter den Gästen. Die drei Detektive rechnen mit Vielem – doch sicher nicht mit dem, was dann passiert! Bei den Ermittlungen gerät einer der drei in große Gefahr …		2016-09-30	false	1	http://a1.mzstatic.com/us/r30/Music30/v4/d5/04/10/d5041038-b061-8c46-2c8b-e17821048e60/source	http://web.archive.org/web/20220124230838if_/https://s3.eu-central-1.amazonaws.com/kosmos.de/media/image/9f/1c/4e/0888751319820.jpg	https://dreifragezeichen.de/produktwelt/details/und-der-letzte-song	https://music.apple.com/de/album/folge-183-und-der-letzte-song/1149355993	https://open.spotify.com/intl-de/album/1qhlRmclvYWkrYkLnFxFZN	https://www.bookbeat.com/de/book/534914
244	Stille Nacht, düstere Nacht		Weihnachten steht vor der Tür. Die drei ??? besuchen die "GameFame", eine landesweit berühmte Spielzeugmesse. Die Actionfiguren der Serie Heroes Of The Universe sind mit einer bisher geheim gehaltenen technischen Neuheit das diesjährige Messe-Highlight. Doch kurz vor der feierlichen Präsentation der Neuheit bricht der Festredner plötzlich zusammen. War das ein Anschlag auf sein Leben? Die Ermittlungen beginnen – und Justus, Peter und Bob haben nur 24 Stunden Zeit …		2016-11-04	false	1	http://a1.mzstatic.com/r40/Music118/v4/05/41/31/05413108-b81c-9d3b-b874-3d9ce5a4f8f7/886446100609.jpg		https://dreifragezeichen.de/produktwelt/details/adventskalender-stille-nacht-dustere-nacht	https://music.apple.com/de/album/adventskalender-stille-nacht-d%C3%BCstere-nacht/1295117431	https://open.spotify.com/intl-de/album/5iobM2gNVymvP8XqnRnHVR	https://www.bookbeat.com/de/book/534790
245	und der Hexengarten		Die drei ??? sollen gegen Geisterpflanzen ermitteln? Zunächst hält Peter den Auftrag seines Schulkameraden Jesse für einen Scherz. Doch der meint es ernst – denn das mysteriöse Leuchten und die körperlosen Stimmen im Gewächshaus eines benachbarten Anwesens scheinen echt zu sein. Als Jesses Schwester behauptet, das Anwesen gehöre einer Hexenfamilie, werden die Detektive hellhörig …		2016-12-02	false	1	http://a1.mzstatic.com/us/r30/Music62/v4/af/66/01/af66014f-2a7e-36c0-3ca9-3fbea1a7e3a6/source	http://web.archive.org/web/20220104131531if_/https://s3.eu-central-1.amazonaws.com/kosmos.de/media/image/13/e9/32/0888751319929.jpg	https://dreifragezeichen.de/produktwelt/details/und-der-hexengarten	https://music.apple.com/de/album/folge-184-und-der-hexengarten/1179325253	https://open.spotify.com/intl-de/album/5B7w9vkfh979tEyzwkLk9k	https://www.bookbeat.com/de/book/534803
246	und der Mann ohne Augen		Es brennt! Dichte Flammen lodern auf der Veranda eines einsamen Hauses am Rand von Rocky Beach. Nachdem die Gefahr gebannt ist, nehmen Justus, Peter und Bob das Haus unter die Lupe. Könnte es Brandstiftung gewesen sein? Als plötzlich ein Einbrecher durch eine ausgebrannte Wohnung schleicht, sind sie sicher:\nDas war kein Unfall …		2017-01-20	false	1	http://a1.mzstatic.com/us/r30/Music71/v4/43/aa/92/43aa9292-a0c7-97ea-f752-78af9e089509/source	http://web.archive.org/web/20220123153348if_/https://s3.eu-central-1.amazonaws.com/kosmos.de/media/image/57/f6/6c/0888751320024.jpg	https://dreifragezeichen.de/produktwelt/details/und-der-mann-ohne-augen	https://music.apple.com/de/album/folge-185-und-der-mann-ohne-augen/1198202669	https://open.spotify.com/intl-de/album/7eHh5PAxQBt5KBWzd3a10G	https://www.bookbeat.com/de/book/534834
247	Insel des Vergessens		Peters Opa ist verschwunden! Angeblich soll Bennington Peck still und heimlich in ein Pflegeheim gezogen sein und wird nun vermisst. Peter ist fassungslos. Das kann doch unmöglich sein! Als der Zweite Detektiv plötzlich in den Lokalnachrichten entdeckt, wie der alte Herr eine Tankstelle überfällt, überstürzen sich die Ereignisse …		2017-03-10	false	1	http://a1.mzstatic.com/us/r30/Music82/v4/c0/5d/a1/c05da1e7-cac3-727b-b817-c6d222be40be/source	http://web.archive.org/web/20220708021919if_/https://s3.eu-central-1.amazonaws.com/kosmos.de/media/image/f4/06/7d/0888751320123593a75c5abfa5.jpg	https://dreifragezeichen.de/produktwelt/details/insel-des-vergessens	https://music.apple.com/de/album/folge-186-insel-des-vergessens/1207830126	https://open.spotify.com/intl-de/album/5kevid18ttcAPK1vk0kLtc	https://www.bookbeat.com/de/book/534820
248	Das Grab der Inka-Mumie		Aus dem unterirdischen Schrein der Familie Paredes wurde eine Mumie gestohlen! Sofort machen sich Justus, Peter und Bob daran, das Rätsel hinter diesem Diebstahl aufzuklären.\nWer steckt dahinter – und vor allem: Was hat der Täter mit seiner Beute vor? Bei ihren Ermittlungen treffen die drei ??? auf geheimnisvolle Gestalten, die anscheinend nichts Gutes im Schilde führen.\nOder will jemand sie nur auf eine falsche Fährte locken?	Ursprünglich als immersives Hörspiel für Vorführungen in Planetarien produziert, wird mit "Das Grab der Inka-Mumie" die erste Produktion der Reihe der Planetariums-Specials als Stereofassung veröffentlicht. Fortgesetzt wird die Reihe mit den beiden weiteren Folgen der ersten Planetariumsstaffel "Der Tornadojäger" und "Das kalte Auge".	2017-03-24	false	1	http://a1.mzstatic.com/r40/Music124/v4/ee/4e/3e/ee4e3e55-9e99-6e6c-b30b-a3c08f0d04e9/886444438483.jpg		https://dreifragezeichen.de/produktwelt/details/das-grab-der-inka-mumie	https://music.apple.com/de/album/das-grab-der-inka-mumie/1219257238	https://open.spotify.com/intl-de/album/7osWCNCcvGfqP31G7281iL	https://www.bookbeat.com/de/book/535114
249	und das silberne Amulett		Eine rätselhafte Botschaft fliegt über den Zaun des Schrottplatzes: eine Dose, darin ein Schlüssel, ein Parkschein und ein silbernes Amulett. Was hat es damit auf sich? Und vor allem: Wer hat den drei ??? die Dose zugespielt? Justus, Peter und Bob müssen Antworten auf viele Fragen finden – und das schnell …		2017-05-19	false	1	http://a1.mzstatic.com/us/r30/Music111/v4/94/13/22/941322bf-360a-734a-06eb-ac5d84cf0928/source		https://dreifragezeichen.de/produktwelt/details/und-das-silberne-amulett	https://music.apple.com/de/album/folge-187-und-das-silberne-amulett/1225246976	https://open.spotify.com/intl-de/album/6uj8JeIgluMibSu8Divkbh	https://www.bookbeat.com/de/book/534873
250	und der Tornadojäger		Der bekannte Tornadojäger Dylan Harvey kommt zu einer Fotoshow nach Rocky Beach. Das lassen sich Justus, Peter und Bob natürlich nicht entgehen. Doch kurz vor dem angekündigten Auftritt werden dem Tornadojäger wichtige Aufnahmen gestohlen. Die drei Detektive ermitteln für Harvey. Sie wollen wissen, wer hinter dem Diebstahl steckt – und warum diese Fotos so wichtig sind. Aber plötzlich wirkt ihr Auftraggeber gar nicht mehr so unschuldig. Ist der Tornadojäger nur ein windiger Betrüger?	Ursprünglich als immersives Hörspiel für Vorführungen in Planetarien produziert, wird mit "Die drei ??? und der Tornadojäger" nun die zweite Produktion der ersten Planetariumsstaffel als Stereofassung veröffentlicht. Fortgesetzt wird die Reihe mit "Die drei ??? und das kalte Auge". Bereits erschienen ist die Produktion "Das Grab der Inka-Mumie".	2017-06-23	false	1	http://a1.mzstatic.com/r40/Music127/v4/5c/bd/e2/5cbde282-7308-b942-a2d6-e7fd717b9f47/886444438681.jpg		https://dreifragezeichen.de/produktwelt/details/und-der-tornadojager	https://music.apple.com/de/album/specialfolge-und-der-tornadoj%C3%A4ger/1235580462	https://open.spotify.com/intl-de/album/7mH8vdj0TkiPO6fMHBCvYj	https://www.bookbeat.com/de/book/534893
251	Signale aus dem Jenseits		Mit den Toten Kontakt aufnehmen: An so etwas glauben die drei ??? nicht. Doch genau das scheint Astrala in "Karma Hour", der neuen Lieblingssendung von Tante Mathilda, tatsächlich zu gelingen. Was steckt hinter den Fähigkeiten der geheimnisvollen Spiritistin? Und weshalb kommt sie Bob so bekannt vor? Die drei Detektive setzen sich auf ihre Spur und geraten dabei in die Schusslinie eines äußerst mysteriösen Verbrechers …		2017-07-28	false	1	http://a1.mzstatic.com/us/r30/Music127/v4/d8/46/82/d8468287-11fd-c8fc-258b-d60ef79cdeec/source		https://dreifragezeichen.de/produktwelt/details/signale-aus-dem-jenseits	https://music.apple.com/de/album/folge-188-signale-aus-dem-jenseits/1257760310	https://open.spotify.com/intl-de/album/22soWryC08ctyMNb6NrMGD	https://www.bookbeat.com/de/book/534850
252	und das kalte Auge		Eine rätselhafte Diebstahlserie erschüttert Rocky Beach! Der Dieb hat offenbar eine Botschaft: CROATOAN schmiert er in blutigen Buchstaben an die Wände der Tatorte. Kennt er die schreckliche, jahrhundertealte Geschichte, die sich hinter diesem Wort verbirgt? Und wer ist der Indianer mit den kalten Augen, der immer wieder auftaucht? Höchste Zeit, dass die drei ??? Licht ins Dunkel bringen …	Ursprünglich als immersives Hörspiel für Vorführungen in Planetarien produziert, wird mit "Die drei ??? und das kalte Auge" nun die letzte Produktion der ersten Planetariumsstaffel als Stereofassung veröffentlicht. Bereits erschienen sind die Produktionen "Das Grab der Inka-Mumie" und "und der Tornadojäger".	2017-08-25	false	1	http://a1.mzstatic.com/r40/Music128/v4/af/f8/9a/aff89a25-8c32-e047-08e0-5b55e66187ae/886444438667.jpg		https://dreifragezeichen.de/produktwelt/details/und-das-kalte-auge	https://music.apple.com/de/album/specialfolge-und-das-kalte-auge/1263882229	https://open.spotify.com/intl-de/album/3egVVb6Zt0LdS6agBMGsiJ	https://www.bookbeat.com/de/book/534823
253	und der unsichtbare Passagier		Justus, Peter und Bob steht ein tolles Abenteuer bevor: eine Reise mit dem Coast Imperial, dem berühmten Luxuszug! Doch kurz nach Fahrtbeginn verschwindet einer der Mitreisenden spurlos. Handelt es sich um eine Entführung?\nDie drei Fragezeichen nehmen die Ermittlungen auf. Es bleibt ihnen nicht viel Zeit. Der nächste Bahnhof wäre die perfekte Fluchtmöglichkeit …		2017-09-29	false	1	http://a1.mzstatic.com/us/r30/Music118/v4/af/7a/61/af7a610b-0f7b-d05c-af75-0919b14845ba/source		https://dreifragezeichen.de/produktwelt/details/und-der-unsichtbare-passagier	https://music.apple.com/de/album/folge-189-und-der-unsichtbare-passagier/1294740417	https://open.spotify.com/intl-de/album/02MXdFaVMz0qQJjmivjI8g	https://www.bookbeat.com/de/book/534894
254	und die Kammer der Rätsel		Ein Auftrag der seltsamen Art: Die drei ??? sollen bei einer Wette behilflich sein. Gesucht ist ein Team aus klugen Köpfen, das sich in weniger als fünf Stunden aus fünf verschiedenen Rätselräumen befreien kann. Wer wäre da geeigneter als Justus, Peter und Bob? Doch was zunächst als Spaß beginnt, entpuppt sich bald als gefährlicher Ernst …		2017-12-01	false	1	http://a1.mzstatic.com/us/r30/Music118/v4/55/98/d5/5598d5f8-6e87-8f4b-af1f-65aea74b5143/source		https://dreifragezeichen.de/produktwelt/details/und-die-kammer-der-ratsel	https://music.apple.com/de/album/folge-190-und-die-kammer-der-r%C3%A4tsel/1318247066	https://open.spotify.com/intl-de/album/100ZHoBX994GlckxjoGpma	https://www.bookbeat.com/de/book/534910
255	Verbrechen im Nichts		Schluss mit der Verbrecherjagd! Justus, Peter und Bob müssen ihre Sommerferien im beschaulichen Dörfchen Nothing verbringen und sind entsetzt. Der Name ist Programm: Hier passiert rein gar nichts. Auf den ersten Blick. Denn auf den zweiten birgt auch Nothing zahlreiche Geheimnisse. Schneller als es den drei ??? lieb ist, werden sie in eine Schatzsuche verstrickt und lenken die Aufmerksamkeit eines mysteriösen Verfolgers auf sich …		2018-01-26	false	1	http://a1.mzstatic.com/us/r30/Music118/v4/23/5c/1b/235c1b67-dd15-9cdf-213c-41ff18a19ea5/source		https://dreifragezeichen.de/produktwelt/details/verbrechen-im-nichts	https://music.apple.com/de/album/folge-191-verbrechen-im-nichts/1333105792	https://open.spotify.com/intl-de/album/2ICtKWqLqMBTzi7UeByhKd	https://www.bookbeat.com/de/book/534775
