[105; 'und der Nebelberg'; 'Eine Wandertour in den Rocky Mountains - Peter und Bob sind begeistert! Doch unterwegs hüllt auf einmal ein undurchdringlicher Nebel den Berggipfel ein und die Wandergruppe wird von einer geisterhaften Erscheinung überrascht. "Das Phantom ist zurückgekehrt"; murmeln die Alten des nahe gelegenen Bergdorfes. Da fängt der Erste Detektiv Feuer; denn neben der körperlichen Anstrengung sind jetzt seine Gehirnzellen gefragt. Was steckt hinter der Spukerscheinung? Die drei ??? müssen diesmal besonders klug vorgehen; um die wortkargen Einsiedler zum Sprechen zu bringen.'; 'Die drei ???; Folge 105\nDer Nebelberg'; 'Veröffentlichungsdatum: 16.09.2002'; 'Erzähler - Thomas Fritsch\nJustus Jonas; Erster Detektiv - Oliver Rohrbeck\nPeter Shaw; Zweiter Detektiv - Jens Wawrczeck\nBob Andrews; Recherchen und Archiv - Andreas Fröhlich\nJoanna Masterson - Barbara Marcks\nJack Masterson - Wolfgang Draeger\nSarah Masterson - Nadja Reichardt\nMr Harry Falkner - Wolfgang Hartmann\nHarvey Ashford - Rolf E. Schenker\nMarc - Hartmut Kollakowski']
[106; 'Der Mann ohne Kopf'; '`DJ-Devil´; von der Presse auch reißerisch `Satans-DJ´ genannt; scheint wahrlich über teuflische Fähigkeiten zu verfügen. Der geheimnisvolle Discjockey ohne Kopf entlockt am Wochenende seinem Mischpult die unheimlichsten Beats; die die tanzenden Besucher in rasende Euphorie versetzen. Doch plötzlich gerät die Szenerie außer Kontrolle. Die drei ??? sind an diesem Abend zufällige Besucher in der Diskothek `Planet-Evil´ und werden Zeugen eines unheimlichen Phänomens; das Justus an die Grenzen seiner Logik katapultiert ...'; 'Die drei ???; Folge 106\nDer Mann ohne Kopf'; 'Veröffentlichungsdatum: 16.09.2002'; 'Erzähler - Thomas Fritsch\nJustus Jonas; Erster Detektiv - Oliver Rohrbeck\nPeter Shaw; Zweiter Detektiv - Jens Wawrczeck\nBob Andrews; Recherchen und Archiv - Andreas Fröhlich\nAmy Scream - Marianne Kehlau\nMonique Carrera - Amanda Lear\nInspektor Cotta - Holger Mahlich\nEllen - Celine Fontanges\nPam - Enie van de Meiklokjes\nJim Cowley - Cäsar\nJeffrey - Kim Alexander Frank\nMandy Robin - Manuela Dahm\n1. Sanitäter - Robert Missler\n2. Sanitäter - Hartmut Kollakowsky\nBardame - Monique Carrera [Amanda Lear]\nTante Mathilda - Karin Lieneweg\nDiskothekenbesucher - Echt']
[107; 'und der Schatz der Mönche'; '"Ich möchte Peter Shaw sprechen. Es ist dringend." - "Worum geht es denn; Mister?"- "Um sein Leben." Eigentlich hatte Peter nur nach einem geeigneten Drehort für ein Filmprojekt an der Schule gesucht. Doch in der verlassenen Fabrikhalle findet er mehr als nur einen stimmungsvollen Schauplatz für den geplanten Kriminalfilm: ein geheimnisvolles Kästchen; einen Zettel mit merkwürdigen Schriftzeichen - und einen messerwerfenden Asiaten; der sich sofort an seine Fersen heftet. Und das ist erst der Auftakt zu einem neuen Fall für die drei ???'; 'Die drei ???; Folge 107\nund der Schatz der Mönche'; 'Veröffentlichungsdatum: 13.01.2003'; 'Erzähler - Thomas Fritsch\nJustus Jonas; Erster Detektiv - Oliver Rohrbeck\nPeter Shaw; Zweiter Detektiv - Jens Wawrczeck\nBob Andrews; Recherchen und Archiv - Andreas Fröhlich\nMorton - Andreas von der Meden\nLama Geshe - Rolf Nagel\nTai Sutsi - Dr. Boo Young-Shin\nChuck - Yan Kimsang\nVinaya - Prof. Dr. Zhu\nMr Zhang - Ingo Feder\nLesley Dimple - Maja Stehli [Ingeborg Kantstein ?]\nMrs. Wilbur - Ingeburg Kanstein']
[108; 'Die sieben Tore'; 'Wer ist der unheimliche Mr Carter; der in einem düsteren Schloss lebt und aussieht wie ein abgemagerter Vogel? Auch sein Auftrag für die drei ??? ist mehr als seltsam: "Findet das Versteck bei den sieben Toren". Was zunächst harmlos klingt; entpuppt sich als äußerst gefährliches Unterfangen. Justus; Peter und Bob müssen Räume betreten; deren Türen sie besser nicht geöffnet hätten; und entdecken dabei Unglaubliches...'; 'Die drei ???; Folge 108\nDie sieben Tore'; 'Veröffentlichungsdatum: 07.04.2003'; 'Erzähler - Thomas Fritsch\nJustus Jonas; Erster Detektiv - Oliver Rohrbeck\nPeter Shaw; Zweiter Detektiv - Jens Wawrczeck\nBob Andrews; Recherchen und Archiv - Andreas Fröhlich\nCaspar Carter - Claus Wilcke\nEnid - Janina Richter\nAlbert - Wolf Rathjen\nMontgomery - Hans Sievers']
[109; 'Gefährliches Quiz'; 'Hochspannung im Studio: Die Kamera läuft; die Scheinwerfer sind auf Justus gerichtet: Wird er alle Fragen in der beliebten Quiz-Show Wer knackt die Nuss? beantworten können? Er muss. Das Leben eines Menschen hängt davon ab. Skrupellose Gangster haben einen raffinierten Plan ausgeheckt. Und wieder einmal müssen Die drei ??? scharf kombinieren; um den Verbrechern auf die Spur zu kommen...'; 'Die drei ???; Folge 109\nGefährliches Quiz'; 'Veröffentlichungsdatum: 07.04.2003'; 'Erzähler - Thomas Fritsch\nJustus Jonas; Erster Detektiv - Oliver Rohrbeck\nPeter Shaw; Zweiter Detektiv - Jens Wawrczeck\nBob Andrews; Recherchen und Archiv - Andreas Fröhlich\nNick Nobel - Ilja Richter\nSandy - Micaela Kreissler\nBill - Achim Schülke\nMike Pherson - Wolf-Dietrich Berg\nAssistent - Martin Meyer\nClarissa - Theresa Underberg\nVeronica - Saskia Weckler\nJoe - Jan-David Rönfeldt\nSekretärin - Traudel Sperber']
[110; 'Panik im Park'; 'Panik in Rocky Beach! Plötzlich werden im Stadtpark harmlose Hunde zu wilden Bestien; die sogar Menschen angreifen. Hat der seltsame schwarze Stein; den die drei ??? im Park entdecken; etwas mit dem gefährlichen Verhalten der Tiere zu tun? Wo kommt er her? Welches Geheimnis birgt er in sich? Justus; Peter und Bob machen sich mit Feuereifer auf die Suche. Unversehens geraten sie in ein neues atemberaubendes und gefährliches Abenteuer. Aber sind sie tatsächlich auf der richtigen Spur?'; 'Die drei ???; Folge 110\nPanik im Park'; 'Veröffentlichungsdatum: 10.06.2003'; 'Erzähler - Thomas Fritsch\nJustus Jonas; Erster Detektiv - Oliver Rohrbeck\nPeter Shaw; Zweiter Detektiv - Jens Wawrczeck\nBob Andrews; Recherchen und Archiv - Andreas Fröhlich\nInspektor Cotta - Holger Mahlich\nPablo - Kai Hendrik Möller\nDr. Brolin - Karl-Friedrich Gerster\nJenkins - Gustav-Adolph Artz\nProfessor Clark - Thor W.Müller\nBürgermeister Hoover - Michael Griem\nMargie - Susanne Leu\nMike - Achim Schülke\nClark - Wolf Rathjen\nWachmann - Kristian Kretschmer']
[111; 'Die Höhle des Grauens'; 'Totenkopfbecher; Übernachten im Sarg; eine geheimnisvolle Höhle: Die drei ??? freuen sich auf eine aufregende Woche in der `Geisterburg´- dem einsam gelegenen Erlebnishotel für wohliges Gruseln. Als sich jedoch seltsame Zwischenfälle häufen; wird schnell klar: Was als spannender; aber harmloser Aufenthalt geplant war; gerät zu einem gefährlichen Abenteuer für Justus; Peter und Bob. Liegt der Schlüssel zu allem in der Höhle des Grauens - und in dem Geheimnis; das dort verborgen ist?'; 'Die drei ???; Folge 111\nDie Höhle des Grauens'; 'Veröffentlichungsdatum: 11.08.2003'; '\x7fErzähler - Thomas Fritsch\nJustus Jonas; Erster Detektiv - Oliver Rohrbeck\nPeter Shaw; Zweiter Detektiv - Jens Wawrczeck\nBob Andrews; Recherchen und Archiv - Andreas Fröhlich\nMaggie Jones - Ulrike Johannson\nLythia Waterstone - Barbara Focke\nElisabeth Waterstone - Linde Fulde\nJohn Stanley - Kai Böger\nJack Donelly - Andreas Mattau\nAlthena - Michaela Boland\nCorona - Stefanie Kirchberger\nFahrer Ken - Wolf Frass\nJohn Fairbanks - Christian Rudolf\nHal Fairbanks - Heidi Schaffrath\nWalt - Wolfgang Kaven\nBlackeye - Georg Marquard']
[112; 'Schlucht der Dämonen'; 'Während einer Pferdeshow verschwindet "Lady"; das 29 Jahre alte Pferd eines Teilnehmers. Wurde es entführt? Aber wer könnte Interesse an dem alten Tier haben; das eigentlich keine 100 Dollar mehr wert ist? Der Spürsinn der drei ??? ist geweckt. Schnell werden die Ermittlungen jedoch zu einem gefährlichen Unterfangen; als die drei Detektive aus Rocky Beach bedroht werden - schwarze Federn sind das Warnsignal; das die unbekannten Täter hinterlassen. Bald führt eine heiße Spur die drei Detektive in die "Schlucht der Dämonen"; einen unheimlichen Ort mitten in der Wüste. Nur zu Pferd kann das unwegsame Gelände erkundet werden und Justus; Peter und Bob müssen fest im Sattel sitzen; um dieses gefährliche Abenteuer bestehen zu können.'; 'Die drei ???; Folge 112\nSchlucht der Dämonen'; 'Veröffentlichungsdatum: 13.10.2003'; 'Erzähler - Thomas Fritsch\nJustus Jonas; Erster Detektiv - Oliver Rohrbeck\nPeter Shaw; Zweiter Detektiv - Jens Wawrczeck\nBob Andrews; Recherchen und Archiv - Andreas Fröhlich\nDonovan - Joachim Richert\nPit - Wolfgang Wagner\nMax - Johannes Rothenstein\nCowboy - Christian Niehues\nCreeklong - Nobi Schatka\nBrad Fleming - Dennis Jensen']
[113; 'Das Auge des Drachen'; 'Ein markerschütternder Hilfeschrei hallt durch den Wald. Als Justus; Peter und Bob sich alarmiert auf die Suche machen; finden sie ein kleines Mädchen; das zitternd in den Himmel zeigt: "Es... es war ein Drache! Ein Drache hat mich angegriffen!" Kurze Zeit später schwebt tatsächlich ein seltsames Tier hoch oben in den Wolken. Eine optische Täuschung? Oder gibt es doch Dinge zwischen Himmel und Erde; die rational nicht erklärbar sind? Die drei Detektive aus Rocky Beach müssen bei ihren Ermittlungen zu diesem Fall sehr genau hinsehen und machen die Erfahrung; dass man selbst den eigenen Augen nicht immer trauen kann...'; 'Die drei ???; Folge 113\nDas Auge des Drachen'; 'Veröffentlichungsdatum: 24.11.2003'; 'Erzähler - Thomas Fritsch\nJustus Jonas; Erster Detektiv - Oliver Rohrbeck\nPeter Shaw; Zweiter Detektiv - Jens Wawrczeck\nBob Andrews; Recherchen und Archiv - Andreas Fröhlich\nEmily - Madeleine Weingart\nMrs Silverstone - Katrin Wasow\nDr.Wakefield - Hans Daniel\nAlruna - Gisela Trowe\nMarcus Lake - Thomas Karallus\nTante Mathilda - Karin Lieneweg']
[114; 'Die Villa der Toten'; 'INHALT: Der Auftrag der Anruferin scheint reichlich merkwürdig; aber leicht zu erfüllen zu sein: Die drei ??? sollen beweisen; dass es in der Villa einer berühmten; verstorbenen Opernsängerin nicht spukt. Doch es kommt; wie es kommen muss. Bei dem halbherzigen Versuch; den nicht vorhandenen Geist während einer Séance zu rufen; antwortet dieser tatsächlich! Und die tote Sängerin erklärt; dass ihr Tod kein Unfall war; sondern dass sie ermordet wurde. Plötzlich ermitteln Justus; Peter und Bob im Auftrag eines spukenden Geistes und werden in ein gefährliches Intrigenspiel verwickelt. Hätten die drei Detektive diesen Fall doch besser an die Polizei abgeben sollen?'; 'Die drei ???; Folge 114\nDie Villa der Toten'; 'Veröffentlichungsdatum: 09.02.2004'; "Erzähler - Thomas Fritsch\nJustus Jonas; Erster Detektiv - Oliver Rohrbeck\nPeter Shaw; Zweiter Detektiv - Jens Wawrczeck\nBob Andrews; Recherchen und Archiv - Andreas Fröhlich\nTante Mathilda - Karin Lieneweg\nMorton - Andreas von der Meden\nBernadette O'Donnell - Eva Maria Bauer\nCecilia Jones - Hanni Vanhaiden\nElouise Adams - Hannelore Wüst\nMrs Willow - Elga Schütz\nMöbelpacker - Christian Niehues"]
[115; 'Auf tödlichem Kurs'; 'Inhalt: Die drei erfolgreichen Detektive aus Rocky Beach stehen vor einem Rätsel: Wer könnte Interesse an dem wertlosen Ölbild haben; das ihrem alten Freund; Kommissar Reynolds; entwendet wurde? Welches Geheimnis verbirgt sich hinter dem Bild; auf dem die Segelyacht "Gwendolyn" Zu sehen ist? Die Ermittlungen führen Justus; Peter und Bob unversehens in ein gefährliches Abenteuer.'; 'Die drei ???; Folge 115\nAuf tödlichem Kurs'; 'Veröffentlichungsdatum: 05.04.2004'; 'Erzähler - Thomas Fritsch\nJustus Jonas; Erster Detektiv - Oliver Rohrbeck\nPeter Shaw; Zweiter Detektiv - Jens Wawrczeck\nBob Andrews; Recherchen und Archiv - Andreas Fröhlich\nOnkel Titus - Hans Meinhardt\nKommissar Reynolds - Wolfgang Draeger\nInspektor Cotta - Holger Mahlich\nEscovedo - Ignacio Descalzo\nAnita Caballero - Isabell Navarro\nLesley Dimple - Rica Blunck\nRegina Pearson - Ingeborg Kallweit\nMr Horowitz - Rolf Jülich\nMr Rothman - Peter Weis\nMrs O´Rien - Victoria von Trautmannsdorff']
[116; 'Codename: Cobra'; 'Kann ein Toter E-Mails versenden? Die 10-jährige Julia hat eine verschlüsselte E-Mail erhalten - von ihrem toten Bruder Ted! Sie bittet die drei ??? um Hilfe. Dann verschwindet das Mädchen plötzlich. Zurück bleibt eine E-Mail auf ihrem PC; die das grässliche Bild einer drohenden Kobra zeigt. Welche Bedeutung hat die Schlange? Wer ist der Absender der Nachricht? Was ist mit dem Mädchen geschehen? Die drei erfolgreichen Detektive aus Rocky Beach müssen haarscharf kombinieren; um den Schlüssel zur Lösung in diesem gefährlichen Fall zu finden.'; 'Die drei ???; Folge 116\nCodename: Cobra'; 'Veröffentlichungsdatum: 14.06.2004'; 'Erzähler - Thomas Fritsch\nJustus Jonas; Erster Detektiv - Oliver Rohrbeck\nPeter Shaw; Zweiter Detektiv - Jens Wawrczeck\nBob Andrews; Recherchen und Archiv - Andreas Fröhlich\nInspektor Cotta - Holger Mahlich\nMr. Applegate - Stephan Benson\nJulia Applegate - Sophie Lechtenbrink\nTeddy Applegate - Jona Mues\nRafter - Volker Bogdan\nArchie - Bertram Hiese\nJenny Collins - Anja Topf']
[117; 'Der finstere Rivale'; 'Mitten in der Nacht wird von einem Unbekannten ein geheimnisvoller Koffer über den Zaun des Schrottplatzes geworfen. Justus; Peter und Bob trauen ihren Augen kaum; als sie feststellen; was das Fundstück enthält. Wer hat den Koffer über den Zaun geworfen? Und warum? Für wen war er eigentlich bestimmt? Die drei ??? stürzen sich in die Ermittlungen. Doch erst als auf dem Schrottplatz ein Feuer ausbricht; realisieren die Detektive; dass sie in großer Gefahr schweben.'; 'Die drei ???; Folge 117\nDer finstere Rivale'; 'Veröffentlichungsdatum: 06.09.2004'; 'Erzähler: Thomas Fritsch\nJustus Jonas; Erster Detektiv: Oliver Rohrbeck\nPeter Shaw; Zweiter Detektiv: Jens Wawrczeck\nBob Andrews; Recherchen und Archiv - Andreas Fröhlich\nSkinny Norris - Andreas von der Meden\nOnkel Titus - Hans Meinhardt\nInspektor Cotta - Holger Mahlich\nGodwin - André Minninger\nWagner - Jürgen Thormann\nBeaumont - Douglas Welbat\nCalhoon - Bernd Stephan\nMike - Arndt Schmöle\nZia - Brigitte Böttrich']
[118; 'Das düstere Vermächtnis'; 'Etwas Schwarzes tauchte auf. Wirre Haare; eine bleiche Stirn; eine Narbe. Hervortretende Knochen. "Ein ... ein Kobold!"; stammelte Peter entsetzt. "Ein Dämon! Einer aus dem Totenreich!" Eigentlich wollten Peter und Bob nur ein bisschen Theaterluft schnuppern und ihr Schulpraktikum bei der bekannten Truppe REALITY 5 machen. Dort geschehen jedoch seltsame und unheimliche Dinge; seitdem sich die Schauspieler auf die Aufführung des Stücks ´"Das düstere Vermächtnis" vorbereiten. Und unversehens beschert der Blick hinter die Kulissen den drei ??? einen neuen gefährlichen Fall ...'; 'Die drei ???; Folge 118\nDas düstere Vermächtnis'; 'Veröffentlichungsdatum: 06.09.2004'; 'Erzähler - Thomas Fritsch\nJustus Jonas; Erster Detektiv - Oliver Rohrbeck\nPeter Shaw; Zweiter Detektiv - Jens Wawrczeck\nBob Andrews; Recherchen und Archiv - Andreas Fröhlich\nKommissar Reynolds - Wolfgang Draeger\nRalph - Jan-David Rönnfeldt\nRobbie - Manfred Reddemann\nJack - Daniel Brühl\nDennis - Stefan Brönneke\nGina - Chiara Ferraú\nCharly - Aaron Lee Ullmer\nSheriff - Harry Rowohlt\nTurnbull - Detlef Bierstedt\nJenny Collins - Anja Topf\nDizzy - Marion Klaus']
[119; 'Der geheime Schlüssel'; 'Justus ist irritiert. Gleich drei Kunden suchen auf dem Schrottplatz von Onkel Titus nach altem Blechspielzeug der Firma Kopperschmidt. Dann fällt dem Ersten Detektiv auch noch eine verschlüsselte Rätselbotschaft in die Hände. Sein Spürsinn ist geweckt! Als jedoch auf Peter ein Attentat verübt wird und der geniale Spielzeugmacher spurlos verschwindet; ist schnell klar: Die drei ??? befinden sich mitten in einem neuen gefährlichen Abenteuer! Und sie müssen all ihre detektivische Kombinationsfähigkeit aufbringen; um die verstreuten Puzzleteile dieses Falls richtig zusammenzusetzen.'; 'Die drei ???; Folge 119\nDer geheime Schlüssel'; 'Veröffentlichungsdatum: 29.11.2004'; 'Erzähler - Thomas Fritsch\nJustus Jonas; Erster Detektiv - Oliver Rohrbeck\nPeter Shaw; Zweiter Detektiv - Jens Wawrczeck\nBob Andrews; Recherchen und Archiv - Andreas Fröhlich\nTitus Jonas - Hans Meinhardt\nCaitlin Kopperschmidt - Marion Martienzen\nJeremy Kopperschmidt - Lutz Herkenrath\nGraig Kopperschmidt - Mario Grete\nGeorge - Hendrik König\nAnthony Quinn - Franz-Joseph Steffens\nMartha - Sabine Falkenberg\nFelix Kopperschmidt - Herrmann Otto\nMann - Frank Felicetti']
[120; 'Der schwarze Skorpion'; 'Laut gellen die Schreie durch das Stadion: "Ein Skorpion... ein riesiger Skorpion!" Unter den Zuschauern der Beachvolleyball-Weltmeisterschaft in Rocky Beach bricht Panik aus. Ken Parker; einer der Spieler; ist zusammengebrochen; weil er von dem giftigen Spinnentier gestochen wurde. Wie ist der schwarze Skorpion in den Sand des Spielfeldes geraten? Wollte jemand mit einem Anschlag den bevorstehenden Sieg der amerikanischen Mannschaft verhindern? Die drei ??? nehmen die Ermittlungen auf und bekommen es in diesem gefährlichen Abenteuer mit einer ganzen Reihe weiterer unheimlicher Tiere zu tun ...'; 'Die drei ???; Folge 120\nDer schwarze Skorpion'; 'Veröffentlichungsdatum: 10.01.2005'; 'Erzähler - Thomas Fritsch\nJustus Jonas; Erster Detektiv - Oliver Rohrbeck\nPeter Shaw; Zweiter Detektiv - Jens Wawrczeck\nBob Andrews; Recherchen und Archiv - Andreas Fröhlich\nKen Parker; Beachball-Spieler - Jürgen Holdorf\nDr. Robinson - Heinz Lieven\nMickey McQuire - Marco Sand\nMrs Bancroft - Ilka Kirsch\nZuschauer - Alexander Mülle']
[121; 'Spur ins Nichts'; 'Justus sitzt in der Falle! Orientierungslos und ohne Erinnerung erwacht er in einer dunklen; kalten; verschlossenen Kammer. Wurde der Erste Detektiv entführt und in ein geheimes Versteck gebracht? Und wer ist der junge Mann; der mit ihm eingeschlossen ist? Kann er sich tatsächlich auch an nichts erinnern? Oder weiß er mehr; als er Justus verraten will? Die Drei ??? werden in einen höchst mysteriösen Fall verwickelt; in dem sie scharf kombinieren müssen; um dem Gegner auf die Spur zu kommen. Und dieser schreckt vor nichts zurück...'; 'Die drei ???; Folge 121\nSpur ins Nichts'; 'Veröffentlichungsdatum: 04.04.2008'; 'Erzähler: Thomas Fritsch\nJustus Jonas; Erster Detektiv: Oliver Rohrbeck\nPeter Shaw; Zweiter Detektiv - Jens Wawrczeck\nBob Andrews; Recherchen und Archiv - Andreas Fröhlich\nShawn - Robin Brosch\nJolene - Marion Elskis\nLeah - Susanne Sternberg\nJelena - Alexandra Doerk\nSue - Kerstin Hilbig\nKimberly Lloyd - Ingeborg Christiansen\nWilliam Boyd - Olaf Kreuzenbeck\nThorndike - Michael Lott']
[122; 'und der Geisterzug'; 'Die Fahrt mit dem Museumszug hatten sich die drei Detektive aus Rocky Beach eigentlich gemütlicher vorgestellt. Doch spätestens im Eisenbahntunnel durch den Black Mountain vergeht den Freunden die Ausflugslaune. Die Durchfahrt wird aufs Gruseligste boykottiert. Natürlich glauben die Drei ??? kein Wort von der Spukgeschichte; nach der verunglückte Arbeiter ihr geisterhaftes Unwesen im Tunnel treiben sollen. Doch um herauszufinden; wer tatsächlich hinter den üblen Machenschaften steckt; bleiben Justus; Peter und Bob nur wenige Stunden...'; 'Die drei ???; Folge 122\nund der Geisterzug'; 'Veröffentlichungsdatum: 04.04.2008'; 'Erzähler - Thomas Fritsch\nJustus Jonas; Erster Detektiv - Oliver Rohrbeck\nPeter Shaw; Zweiter Detektiv - Jens Wawrczeck\nBob Andrews; Recherchen und Archiv - Andreas Fröhlich\nFred Jenkins - Nick Seidensticker\nMr Campbell - Gerhart Hinze\nSam Reilly - Jürgen Strube\nCarl Sheehan - Michael Weckler\nCollins - Thorsten Weber\nMr Kingsley - Herbert Tennigkeit\nMrs Kingsley - Tina Rehfeld-Wildmann\nDevlin Reno - Jörg Pleva\nDr. Long - Lou Wong']
[123; 'Fußballfieber'; 'Peter; der Zweite Detektiv; trainiert begeistert für die kalifornischen Schulfußballmeisterschaften. Zur gleichen Zeit erscheint ein Junge auf dem Schrottplatz und bittet die Drei ??? um Hilfe: Im Haus seiner Großeltern geschehen unheimliche Dinge und die beiden alten Leute sind überzeugt; dass sie es mit den schrecklichen Vorzeichen des Todes zu tun haben. Als Justus; Peter und Bob die Ermittlungen aufnehmen; ahnen sie nicht; welche Gefahren noch auf sie zukommen werden...'; 'Die drei ???; Folge 123\nFußballfieber'; 'Veröffentlichungsdatum: 09.05.2008'; 'Erzähler - Thomas Fritsch\nJustus Jonas; Erster Detektiv - Oliver Rohrbeck\nPeter Shaw; Zweiter Detektiv - Jens Wawrczeck\nBob Andrews; Recherchen und Archiv - Andreas Fröhlich\nEmiliano - Tobias Schmidt\nPancho - Ben Hecker\nEsperanza - Ingeborg Christiansen\nPedro - Anton Sprick\nAbelardo - Peter Brix']
[124; 'Geister-Canyon'; 'Als die Drei ??? versprechen; bei einer Lösegeldübergabe zu helfen; ahnen sie noch nicht; was auf sie zukommt. Unversehens befinden sie sich auf einer nervenaufreibenden Irrfahrt durch den wilden Westen Amerikas. Welchen hinterhältigen Plan verfolgt der Erpresser? Wozu lockt er sie in die tiefsten und gefährlichsten Canyons? Und dann geschieht; was nie hätte geschehen dürfen...'; 'Die drei ???; Folge 124\nGeister-Canyon'; 'Veröffentlichungsdatum: 11.07.2008'; "Erzähler - Thomas Fritsch\nJustus Jonas; Erster Detektiv - Oliver Rohrbeck\nPeter Shaw; Zweiter Detektiv - Jens Wawrczeck\nBob Andrews; Recherchen und Archiv - Andreas Fröhlich\nMr. O'Sullivan - Eckard Dux\nButler Paul - Volker Bogdan\nDick Perry - Ernst Hilbich\nPolizist - Frank Thannhäuser\nAufsicht - Patrick Bach"]
[125; 'Feuermond'; 'Die Jubiläumsfolge - Extra lang!!! Rätselhafte Briefe eines verstorbenen Malers bringen Die drei ??? auf die Spur eines verschollenes Gemäldes... Und der Gegenspieler der Detektive aus Rocky Beach ist kein geringerer als der französische Meisterdieb Victor Hugenay! Wird es den drei ??? gelingen; das Rätsel um Feuermond zu lüften?'; 'Die drei ???; Folge 125\nFeuermond'; 'Veröffentlichungsdatum: 10.10.2008'; 'Erzähler - Thomas Fritsch\nPeter Shaw - Jens Wawrczeck\nBob Andrews - Andreas Fröhlich\nJustus Jonas - Oliver Rohrbeck\nAndy Miller - Jannik Endemann\nOnkel Titus Jonas - Hans Meinhardt\nAnsager - Bertram Hiese\nGraham Reporter - Thomas Bammer\nJulianne Wallace - Marlen Diekhoff\nHugenay - Albert Giro\nModerator - Holger Wemhoff\nCharles Knox - Dirk Bach\nMr. Myers - Eberhard Haar\nNachtschatten - Frank Tannhäuser\nBrittany - Dorette Hugo\nSharon Lockwood - Nova Meierhenrich\nMrs. Albright - Lotti Krekel\nJaccard (Off-Stimme) - Douglas Welbat\nMorton - Andreas von der Meden\nPolizist 2 - Erik Schäffler\nLKW-Fahrer - Nick Heidfeld\nInspektor Cotta - Holger Mahlich']
[126; 'Schrecken aus dem Moor'; 'Glücklicherweise ruht der tote Körper aus der vorgeschichtlichen Eisenzeit als Ausstellungsstück in einem Glaskasten im Steadman Museum. Doch ausgerechnet während Peters Schicht als Nachtwächter scheint die gruselige Moorleiche zu erwachen und ihr Unwesen in den verlassenen Gängen des Museums zu treiben. An die plötzliche Auferstehung einer jahrtausende alten Leiche können Justus; Peter und Bob natürlich nicht glauben - auch wenn alle Indizien genau darauf hinweisen...'; 'Die drei ???; Folge 126\nSchrecken aus dem Moor'; 'Veröffentlichungsdatum: 14.11.2008'; 'Erzähler: Thomas Fritsch\nJustus Jonas; Erster Detektiv - Oliver Rohrbeck\nPeter Shaw; Zweiter Detektiv - Jens Wawrczeck\nBob Andrews; Recherchen und Archiv - Andreas Fröhlich\nDr. Chandler - Wolf Pahlke\nMax - Sven Dahlem\nAustin - Patrick Bach\nDwain - Tim Knauer\nMr. Monroe - Jochen Regelin\nProfessor Rosenberg - Lothar Grützner\nPapagei - Heikedine Körting']
[127; 'Schwarze Madonna'; 'Als Peter einen verletzten jungen Mann aus dem Meer rettet; ahnt er noch nicht; dass er damit auch einen neuen Fall für die drei ??? an Land zieht. Doch schon kurze Zeit später befinden sich die drei Detektive aus Rocky Beach mitten in einem spannenden Abenteuer; in dem eine verschwundene Marienstatue die Hauptrolle spielt. Wie viele Gegner gibt es bei dieser gefährlichen Jagd? Wie weit werden sie gehen; um die begehrte Schwarze Madonna zu bekommen? Justus; Peter und Bob stoßen an ihre Grenzen. Dieser Fall ist gefährlich; sehr gefährlich. Er bedroht sogar die Existenz ihres Detektivunternehmens...'; 'Die drei ???; Folge 127\nSchwarze Madonna'; 'Veröffentlichungsdatum: 05.12.2008'; 'Erzähler - Thomas Fritsch\nJustus Jonas; Erster Detektiv - Oliver Rohrbeck\nPeter Shaw; Zweiter Detektiv - Jens Wawrczeck\nBob Andrews; Recherchen und Archiv - Andreas Fröhlich\nInspektor Cotta - Holger Mahlich\nGoodween - André Minninger\nJosé - Patrick Bach\nSteve Bright - Marek Erhardt\nBrian Smith - Christian Rode\nMartin - Jesse Grimm\nWächter - Sven Dahlem\nMrs. Osborne - Anja Nejarri\nMr. Pentecost - Wolf Frass\nSenora Gonzalez - Susanne von Loessl']
[128; 'Schatten über Hollywood'; 'Geister gibt es nicht - davon sind Justus; Peter und Bob überzeugt. Bis eines Nachts eine unheimliche weiße Gestalt vom berühmten Hollywood-Schriftzug in die Tiefe stürzt und spurlos verschwindet. Haben es die drei ??? mit dem Geist der verstorbenen Schauspielerin Casey Wye zu tun? Fragmente eines seltsamen Briefes weisen darauf hin. Als dann auch noch verschiedene Menschen in hinterhältige Fallen geraten; ist klar: Justus; Peter und Bob müssen schwer auf der Hut sein; wenn sie dieses Geheimnis lüften und dabei mit heiler Haut davonkommen wollen...'; 'Die drei ???; Folge 128\nSchatten über Hollywood'; 'Veröffentlichungsdatum: 06.02.2009'; 'Erzähler - Thomas Fritsch\nJustus Jonas; Erster Detektiv - Oliver Rohrbeck\nPeter Shaw; Zweiter Detektiv - Jens Wawrczeck\nBob Andrews; Recherchen und Archiv - Andreas Fröhlich\nMrs Bennett - Renate Pichler\nWächter - Marek Erhardt\nCrowle - Christian Rudolf\nCasey Wye - Gisela Trowe\nInspektor Cotta - Holger Mahlich\nOliver Taper - Gosta Liptow\nGodween - André Minninger']
