[129; 'SMS aus dem Grab'; 'Als Rubbish-George; der schrullige Stadtstreicher aus Rocky Beach; von einem Tag auf den anderen verschwindet; ahnen Justus; Peter und Bob sofort; dass hier etwas nicht mit rechten Dingen zugeht. Zwischen den wenigen Habseligkeiten des wunderlichen Mannes finden die drei Detektive einen rätselhaften Brief. Die Spur führt zu den Pyramiden in Ägypten! Welches Geheimnis aber will Rubbish George dort lüften? Die drei ??? begeben sich in das dunkle Reich der Sphinx - und geraten dabei in eine Falle!'; 'Die drei ???; Folge 129\nSMS aus dem Grab'; 'Veröffentlichungsdatum: 13.03.2009'; 'Erzähler - Thomas Fritsch\nJustus Jonas; Erster Detektiv - Oliver Rohrbeck\nPeter Shaw; Zweiter Detektiv - Jens Wawrczeck\nBob Andrews; Recherchen und Archiv - Andreas Fröhlich\nLayla - Saskia Weckler\nAlaa Edine - Robert Missler\nAbazza - Abdul Kader-Diab\nKamelhändler - Wolf Frass\nKamelführer - Fathi Farnazmatis\nWärter - Gosta Liptow\nÄgypter - Lothar Grützner\nTante Mathilda - Karin Lieneweg\nRubbish George - Utz Richter\nKommissar - Klaus Dittmann\nAisha - Susanne von Loessl\nVerkäufer - Farhat Al Yhi\nDick Vincent - Holger Löwenberg\nTaxifahrer - Wolf Pahlke']
[130; 'Der Fluch des Drachen'; 'Justus Jonas von den drei Detektiven aus Rocky Beach ist schockiert: durch seine Schuld ist die wertvolle Vase; die ein Kunde auf dem Schrottplatz deponiert hatte; in tausend Scherben zersprungen. Die drei ??? haben 24 Stunden Zeit; um für Ersatz zu sorgen. Schnell zeigt sich; dass nicht nur Justus; Peter und Bob großes Interesse an einer dunkelblauen Vase mit weißem Drachenmotiv haben. Und die Gegner schrecken vor nichts zurück. Ein gefährliches Abenteuer nimmt seinen Lauf...'; 'Die drei ???; Folge 130\nDer Fluch des Drachen'; 'Veröffentlichungsdatum: 15.05.2009'; 'Erzähler: Thomas Fritsch\nJustus Jonas; Erster Detektiv: Oliver Rohrbeck\nPeter Shaw; Zweiter Detektiv: Jens Wawrczeck\nBob Andrews; Recherchen und Archiv: Andreas Fröhlich\nTante Mathilda: Karin Lieneweg\nOnkel Titus: Hans Meinhardt\nSkinny Norris: Andreas von der Meden\nBeverly Leung: Susanne Stangl\nThomas Johnson: Lutz Herkenrath\n1. Polizist: Robert Missler\n2. Polizist: Edgar Hoppe\nJames: Sönke Städtler\nDaniel Baker: Sascha Rotermund\nMr. Grogan: Günter Flesch ']
[131; 'Haus des Schreckens'; 'Was geht im Marriott House; dem gruseligen alten Gebäude draußen auf einer einsamen Insel; vor sich? Spukt es dort tatsächlich? Als eine Person entführt wird und unheimliche Spuren Böses ahnen lassen; ist schnell klar: Dies ist ein Fall für Die drei ???! Wer oder was hat den berühmten Musikproduzenten Lloyd Scavenger in seiner Gewalt? Justus; Peter und Bob; die drei erfolgreichen Detektive aus Rocky Beach; nehmen die Spur auf - und geraten in ein Labyrinth; in dem hinter jeder Ecke ein neues Rätsel wartet...'; 'Die drei ???; Folge 131\nHaus des Schreckens'; 'Veröffentlichungsdatum: 03.07.2009'; 'Erzähler - Thomas Fritsch\nJustus Jonas; Erster Detektiv - Oliver Rohrbeck\nPeter Shaw; Zweiter Detektiv - Jens Wawrczeck\nBob Andrews; Recherchen und Archiv - Andreas Fröhlich\nLloyd Scavenger - Stefan Benson\nJack Lowell - Siegfried Kernen\nAlexander Nolan - Wilfried Hochholdinger\nJaqueline Williams - Henrike Fehrs\nIan Parsley - Jörg Gillner\nMary Parsley - Karin Abicht\nJasper Kittle - Peter Weis\nShawne Davison - Susanne Lothar\nOfficer Wood - Roman Kretschmer']
[132; 'Spuk im Netz'; 'Miss Bennett; die Leiterin der Bücherei in Rocky Beach; ist verschwunden! Eine überstürzt verlassene Wohnung; gelöschte Dateien und ein Zettel mit einer Reihe merkwürdiger Zahlen weisen auf einen äußerst mysteriösen Fall hin. Die drei ??? machen sich auf die Suche. Bald schon wissen sie: die Bibliothekarin ist den geheimnisvollen Zeichen einer geisterhaften Erscheinung im Internet gefolgt. Wohin soll sie gelockt werden? Welche Botschaft hat sie erhalten? (Justus; Peter und Bob müssen scharf kombinieren; um das Rätsel; das hinter Miss Bennetts Verschwinden steckt; zu lösen.) Die Antwort steht in den Sternen! Werden die Drei erfolgreichen Detektive aus Rocky Beach sie lesen können?'; 'Die drei ???; Folge 132\nSpuk im Netz'; 'Veröffentlichungsdatum: 21.08.2009'; 'Erzähler - Thomas Fritsch\nJustus Jonas; Erster Detektiv - Oliver Rohrbeck\nPeter Shaw; Zweiter Detektiv - Jens Wawrczeck\nBob Andrews; Recherchen und Archiv - Andreas Fröhlich\nMiss Bennett - Renate Pichler\nKaren - Celine Fontange\nBecky - Katharina v. Keller\nFelicia Sparing - Rhea Harder\nMrs. Amelia Sparing - Karin Buchholz\nMr. Sparing - Sky du Mont\nMorton - Andreas von der Meden\nInspektor Cotta - Holger Mahlich\nProfessor Alkurah - Ben Hecker\nEroll - Bertram Hiese\nMrs. Featherstone - Sabine Hahn\nWärter - Jürgen Holdorf']
[133; 'Fels der Dämonen'; 'Ein toller Sandstrand in einer einsamen Bucht; perfektes Surf-Wetter; ein schattiges Plätzchen für das Zelt: Die drei ??? freuen sich auf ein paar stressfreie Ferientage am Meer. Doch dann taucht ein völlig verängstigter Junge auf und berichtet von einem gruseligen schwarzen Zwerg; der ihn verfolgt. Als der Zweite Detektiv kurze Zeit darauf beim Wellenreiten eine mehr als unheimliche Begegnung im Wasser hat; ist klar: hier bahnt sich ein neuer Fall für die drei Detektive an! Wer oder was treibt sein Unwesen in der abgelegenen Bucht? Werden Justus; Peter und Bob das Geheimnis um den "Fels der Dämonen" lüften?'; 'Die drei ???; Folge 133\nFels der Dämonen'; 'Veröffentlichungsdatum: 02.10.2009'; 'Erzähler - Thomas Fritsch\nJustus Jonas; Erster Detektiv - Oliver Rohrbeck\nPeter Shaw; Zweiter Detektiv - Jens Wawrczeck\nBob Andrews; Recherchen und Archiv - Andreas Fröhlich\nSergeant Ludlow - Dietmar Mues\nBanden-Chef - Eberhard Haar\nEddy Reardon - Lukas Sperber\nSpanier - Erik Schäffler\nJack - Fabian Harloff\nItaliener - Lutz Harder\nGauner - Sven Dahlem\nGehilfe - Gerhart Hinze\nPolizist - Bertram Hiese']
[134; 'Der tote Mönch'; 'Ein böser Geist will Christine Harkinson von ihrem Anwesen vertreiben! Davon ist zumindest ihr Gärtner überzeugt. Lo Wang bangt um das Leben seiner Arbeitgeberin. Justus; Peter und Bob; die drei erfolgreichen Detektive aus Rocky Beach; machen sich auf die Suche nach dem ominösen Geist. Wer oder was steckt hinter der gruseligen Kapuzengestalt; die nachts ihr Unwesen im Garten treibt? Als die drei ??? ein offenes altes Grab entdecken; ist sich Peter ganz sicher: Ein toter Mönch verfolgt Christine! Doch worauf hat er es abgesehen...?'; 'Die drei ???; Folge 134\nDer tote Mönch'; 'Veröffentlichungsdatum: 02.10.2009'; 'Erzähler - Thomas Fritsch\nJustus Jonas - Oliver Rohrbeck\nPeter Shaw - Jens Wawrczeck\nBob Andrews - Andreas Fröhlich\nChristine - Inken Sommer\nMr. Bambridge - Gustav-Adolph Artz\nLo Wang - Dae Joon Yoo\nInspektor Cotta - Holger Mahlich\nAnthony Hearst - Wolfgang Pampel\nTruck-Fahrer - Konstantin Graudus\nAvercromby - Nicolas König']
[135; 'Fluch des Piraten'; 'Eine Reihe rätselhafter Fotos weckt die Neugier der drei erfolgreichen Detektive aus Rocky Beach. Alles deutet darauf hin; dass ein kostbarer Goldschatz auf einer einsamen Insel verborgen ist. Doch vor Ort wird schnell klar; dass nicht nur Justus; Peter und Bob dem Schatz auf der Spur sind. Es beginnt eine Jagd mit ungewissem Ausgang.'; 'Die drei ???; Folge 135\nFluch des Piraten'; 'Veröffentlichungsdatum: 27.11.2009'; 'Erzähler - Thomas Fritsch\nJustus Jonas; Erster Detektiv - Oliver Rohrbeck\nPeter Shaw; Zweiter Detektiv - Jens Wawrczeck\nBob Andrews; Recherchen und Archiv - Andreas Fröhlich\nPilot - Gerhart Hinze\nMax - Traudel Sperber\nLiolotta - Peter Striebeck\nAlthena - Steffi Kirchberger\nSarah Livingston - Rosemarie Wohlbauer\nElvira Zuckerman - Konstanze Ullmer']
[136; 'und das versunkene Dorf'; 'In einem kleinen Bergdorf scheint ein Geist sein Unwesen am nahe gelegenen See zu treiben! Welches dunkle Geheimnis verbirgt sich in den Tiefen des Gewässers? Wer oder was steckt hinter der gespenstischen Erscheinung am Ufer? Die drei ??? gehen auf Tauchstation; um das Geheimnis zu lüften. Und dann entdecken sie das Unvorstellbare...'; 'Die drei ???; Folge 136\nund das versunkene Dorf'; 'Veröffentlichungsdatum: 05.02.2010'; 'Erzähler - Thomas Fritsch\nJustus Jonas - Oliver Rohrbeck\nPeter Shaw - Jens Wawrczeck\nBob Andrews - Andreas Fröhlich\nDarren Duff - Jesse Grimm\nTaucher Carl - Oliver Böttcher\nTaucherin Joan - Christine Pappert\nPaul Brooks - Heinz Lieven\nJoe Wilcox - Rolf Becker\nCassandra Wilcox - Elke Reissert\nDaniel - Jochen Baumert\nHenry - Frank Felicetti\nDoktor Holloway - Barbara Focke\nCedric Duff - Rolf E. Schenker']
[137; 'Pfad der Angst'; 'Ein neuer Fall bahnt sich an; ganz nach dem Geschmack der drei erfolgreichen Detektive aus Rocky Beach: Ein verschrobener Wissenschaftler bittet die drei ??? um Hilfe bei der Wiederbeschaffung einer Erfindung; die ihm gestohlen wurde. Doch dann häufen sich merkwürdige Geschehnisse und behindern die Recherchen. Natürlich lassen sich Justus; Peter und Bob zunächst nicht beeindrucken - bis sie um ihr Leben bangen müssen...'; 'Die drei ???; Folge 137\nPfad der Angst'; 'Veröffentlichungsdatum: 12.03.2010'; 'Erzähler - Thomas Fritsch\nJustus Jonas - Oliver Rohrbeck\nPeter Shaw - Jens Wawrczeck\nBob Andrews - Andreas Fröhlich\nWinston Granville - Christian Rode\nMatthew Granville - Uwe Friedrichsen\nSmithy - Konstantin Graudus\nMr. Jackmore - Michael Brennicke\nProfessor Frazier - Wilhelm Wieben\nPolizist - Tetje Mierendorf']
[138; 'Die geheime Treppe'; 'Warum wurde der junge Wissenschaftler Davy Swann entführt? Und warum nannten ihn die vermummten Täter immer Philippe? Justus; Peter und Bob nehmen die Spur auf. Diese führt in das labyrinthische Gebäude der Universität mit geheimen Treppen und einer düsteren Bibliothek. Hier stoßen die drei ??? auf ein merkwürdiges Buch und seltsame Verse. Natürlich knacken die drei erfolgreichen Detektive aus Rocky Beach das Rätsel. Doch dann fangen die Schwierigkeiten erst an...'; 'Die drei ???; Folge 138\nDie geheime Treppe'; 'Veröffentlichungsdatum: 21.05.2010'; 'Erzähler - Thomas Fritsch\nJustus Jonas - Oliver Rohrbeck\nPeter Shaw - Jens Wawrczeck\nBob Andrews - Andreas Fröhlich\nDavy Swann - Thorsten Sense\nInspektor Cotta - Holger Mahlich\nCraig Holden - Gerhard Olschewski\nLöwenritter - Burghart Klaußner']
[139; 'Das Geheimnis der Diva'; 'Seltsame Vorkommnisse überschatten die Proben der Laienspielgruppe "Die Masken" im alten Stadttheater von Rocky Beach: Kulissen verschwinden und eine Schauspielerin wird hinter der Bühne von einem grässlichen Phantom angegriffen. Wer oder was treibt sein Unwesen in dem verwinkelten Theatergebäude? Hängen die Ereignisse mit der international bekannten Schauspielerin Helena Darraz zusammen; die in wenigen Tagen nach Rocky Beach kommen will? Sofort nehmen die drei ??? die Ermittlungen auf. Und es wird gefährlich...'; 'Die drei ???; Folge 139\nDas Geheimnis der Diva'; 'Veröffentlichungsdatum: 09.07.2010'; 'Erzähler - Thomas Fritsch\nJustus Jonas - Oliver Rohrbeck\nPeter Shaw - Jens Wawrczeck\nBob Andrews - Andreas Fröhlich\nTitus Jonas - Hans Meinhardt\nInspektor Cotta - Holger Mahlich\nHelena Darraz - Ingrid Andree\nMorton - Andreas von der Meden\nPritchard - Sascha Rotermund\nSid - Tilman Madaus\nCaroline - Celine Fontanges\nSandy - Simona Pahl\nSteven - René Dawn-Claude\nErnest - Tim Kreuer\nRadioansagerin - Susanne Wulkow\nHarvey Griscom - Christian Rudolf\nJohn Dellcourt - Gustav Adolph Artz\nMiss Darraz - Sabine Hahn']
[140; 'Stadt der Vampire'; 'Eine riesige Fledermaus versetzt die Kleinstadt Yonderwood in Angst und Schrecken. Nachdem einige Menschen mit Bissspuren und einer Menge Blut in ihren Betten erwacht sind; hat der Großteil der Einwohner bereits das Weite gesucht. Justus; Peter und Bob haben noch nie an Vampire geglaubt. In diesem neuen Fall jedoch scheint es; als müssten die drei berühmten Detektive aus Rocky Beach ihre Meinung ändern...'; 'Die drei ???; Folge 140\nStadt der Vampire'; 'Veröffentlichungsdatum: 20.08.2010'; 'Erzähler - Thomas Fritsch\nJustus Jonas - Oliver Rohrbeck\nPeter Shaw - Jens Wawrczeck\nBob Andrews - Andreas Fröhlich\nJosy McDonaghough - Lili Draeger\nHomer Diesel - Christian Senger\nMary Stamper - Annabelle Krieg\nOtis Stamper - Klaus Dittman\nJonathan Black - Eckart Dux\nMiles Black - Sascha Rotermund\nKlara Kowalski - Steffi Kirchberger\nSilvester Proud - Gustav A. Artz\nPfarrer Clark - Gerd Baltus']
[141; 'und die Fußball-Falle'; 'Der Fußballstar Jeffrey Seaman und seine Mannschaft bereiten sich in Rocky Beach auf ein Mehrländerturnier vor. Doch merkwürdige Zwischenfälle stören das Training und versetzen die Spieler in Angst und Schrecken. Als auch noch der ägyptische Totengott Anubis in den Katakomben unter dem Fußballstadion auftaucht und sein Unwesen treibt; ist klar: Die drei ??? müssen all ihren detektivischen Spürsinn aufbieten; um diesen Fall zu lösen!'; 'Die drei ???; Folge 141\nund die Fußball-Falle'; 'Veröffentlichungsdatum: 01.10.2010'; "Erzähler - Thomas Fritsch\nJustus Jonas - Oliver Rohrbeck\nPeter Shaw - Jens Wawrczeck\nBob Andrews - Andreas Fröhlich\nOnkel Titus Jonas - Hans Meinhardt\nInspektor Cotta - Holger Mahlich\nJeffrey Seaman - Daniel Welbat\nSteven - Oliver Böttcher\nEric - Patrick Bach\nMr. Settler - Christian Senger\nAuktionator - Achim Schülke\nFrau - Hilla Fitzen\nPatrick O'Brian - Wolfgang Riehm\nWilliam de Haas - Jörg Gillner\nTheodor Brewster - Tobias Meister\nButler - Olaf Kreuzenbeck"]
[142; 'Tödliches Eis'; 'Schnee und Eis; Wölfe und arktische Stürme - das Nordic Wilderness Race ist eines der härtesten Schlittenhunderennen der Welt. Als die drei ??? von der Journalistin Carol Ford gefragt werden; ob sie bei der Reportage über das Rennen helfen wollen; sagen die Jungen begeistert zu. Doch damit lassen sie sich auf ein gefährliches Abenteuer ein. Als es zu einem ernsthaften Zwischenfall mit skrupellosen Verbrechern kommt; ist klar: Die drei Detektive müssen schnell handeln; damit dies nicht ihr letzter Fall wird!'; 'Die drei ???; Folge 142\nTödliches Eis'; 'Veröffentlichungsdatum: 03.12.2010'; 'Erzähler - Thomas Fritsch\nJustus Jonas - Oliver Rohrbeck\nPeter Shaw - Jens Wawrczeck\nBob Andrews - Andreas Fröhlich\nCarol Ford - Claudia Schermutzki\nFrancis Studstill - Elena Wilms\nBaxter Norsworthy - Udo Schenk\nGordon Hoke - Holger Löwenberg\nJared Fox - Meik Spallek\nCandace Duskin - Andrea Linau\nGeorge Bennet - Urs Affolter\nGreg Harper - Robert Missler\nWoodland - Jürgen Thormann\nReporterin - Jamie Leaves\nReporter - Glenn Goltz\nWellford - Oliver Geilhardt\nPilot - Achim Schülke\nLautsprecherstimme - Sascha Draeger']
[143; 'und die Poker-Hölle'; 'Als Justus; Peter und Bob einem jungen Mann helfen wollen; dem in einer Postfiliale Geld gestohlen wurde; geraten sie in die gefährliche Unterwelt von China Town. Zufällig kommen sie einer illegalen Pokerspielhölle auf die Spur. Dabei müssen die drei erfolgreichen Detektive aus Rocky Beach die Erfahrung machen; dass die Beteiligten sehr unangenehm werden; wenn man ihnen in die Karten sieht! Und dann geschieht; was nie hätte geschehen dürfen...'; 'Die drei ???; Folge 143\nund die Poker Hölle'; 'Veröffentlichungsdatum: 03.12.2010'; 'Erzähler - Thomas Fritsch\nJustus Jonas - Oliver Rohrbeck\nPeter Shaw - Jens Wawrczeck\nBob Andrews - Andreas Fröhlich\nRichie Hanson - Dennis Schmidt-Foß\nInspektor Cotta - Holger Mahlich\nGoodween - André Minninger\nBenni - Ivo Möller\nJacki Jin - Robert Missler\nKellnerin - Corinna Wodrich\nCroupier - Dirk Bach\nMann - Arndt Schmöle']
[144; 'Zwillinge der Finsternis'; 'Es schneit bei 20 Grad über Null; ein riesiger Erdspalt tut sich über Nacht auf; seltsame Nebel wabern; und ein Mann lässt Flammen aus seiner Hand wachsen: Rocky Beach hat es mit dem Teufel zu tun! Das jedenfalls nimmt Peter an; als er und seine beiden Detektivkollegen in den Fall "Zwillinge der Finsternis" geraten. Zwei in Leder gebundene Bücher sollen satanische Zauberformeln enthalten. Wer sie besitzt; hat teuflische Macht. Und es gibt einige Menschen; die hinter den beiden Büchern her sind. Ein Exemplar wurde bereits gestohlen! Die drei ??? müssen ihren Widersachern schnellstens zuvorkommen; um das Schlimmste zu verhindern...'; 'Die drei ???; Folge 144\nZwillinge der Finsternis'; 'Veröffentlichungsdatum: 28.01.2011'; 'rzähler - Thomas Fritsch\nJustus Jonas - Oliver Rohrbeck\nPeter Shaw - Jens Wawrczeck\nBob Andrews - Andreas Fröhlich\nOnkel Titus Jonas - Hans Meinhardt\nArthur Sinclair - Joachim Pukaß\nMr. Peastone - Eberhard Haar\nJeremy Witherspoon - Martin Semmelrogge\nBarnaby Witherspoon - Achim Schülke\nInspektor Cotta - Holger Mahlich\nGodwin - André Minninger\nMann - Holger Löwenberg']
[145; 'und die Rache der Samurai'; 'Auf dem Internat "Shadow Stone" geht es nicht mit rechten Dingen zu. Ein Schüler ist spurlos verschwunden; und die Mitglieder der Samurai-AG; die mit alten japanischen Schwertern kämpfen; verhalten sich mehr als merkwürdig. Um den Fall zu klären; schleusen sich die drei ??? in die Schule ein. Doch schnell bekommen sie zu spüren; dass sie hier unerwünscht sind. Besonders Peter muss nun all seinen Mut unter Beweis stellen: Das Schwert. Ein kurzer Schwung; der die Luft durchschnitt. Das Blut gefror in seinen Adern. Es war so weit. Der Tod. Warum bloß hatten sie diesen Auftrag angenommen? Warum bloß?!'; 'Die drei ???; Folge 145\nDie Rache der Samurai'; 'Veröffentlichungsdatum: 04.03.2011'; 'rzähler - Thomas Fritsch\nJustus Jonas - Oliver Rohrbeck\nPeter Shaw - Jens Wawcrzeck\nBob Andrews - Andreas Fröhlich\nTakasi Yukawa - Wilfried Diallaz\nFrank Hektor - Michael Lott\nSean Doherty - Leonhard Mahlich\nMandy - Jasmin Wagner\nZeno Daniels - Philipp Baltus\nPercy - Jesse Grimm\nKeko - Jens Wendland\nAnthony Fender - Peter Buchholz']
[146; 'Der Biss der Bestie'; 'Zugegeben das Säbelzahntigerskelett mit den riesigen Fangzähnen im Naturkundemuseum von Rocky Beach sieht sehr bedrohlich aus. Aber dass es nachts durch die Gegend spukt; kann Justus nun wirklich nicht glauben! Wer oder was treibt dann sein Unwesen im "Geistermuseum"; wie der Ort von den Nachbarn schon genannt wird? Die drei ??? gehen den Spuren nach. Und entdecken das Unfassbare...'; 'Die drei ???; Folge 146\nDer Biss der Bestie'; 'Veröffentlichungsdatum: 06.05.2011'; 'Erzähler - Thomas Fritsch\nJustus Jonas - Oliver Rohrbeck\nPeter Shaw - Jens Wawrczeck\nBob Andrews - Andreas Fröhlich\nOnkel Titus - Hans Meinhardt\nTante Mathilda - Karin Lieneweg\nInspektor Cotta - Holger Mahlich\nQuentin Wadleigh - Christian Rudolf\nDr. Winston Wadleigh - Mathias Münster\nDr. John Frears - Wolfgang Draeger\nJamie - Philipp Draeger\nSammy - Jacob Mayerhoff\nMrs. Pitkätossu - Ingeborg Kallweit\nJackall Madson - Ingo Nommsen\nTiger Madson - Dieter Dücker\nVivian - Saskia Mayerhoff\nFitzwilliam Waterfield - Wolfgang Völz\nSanitäter - Robin Brosch']
[147; 'Grusel auf Campbell Castle'; 'Adam Campbell hat ein schweres Erbe angetreten: er muss das imposante Schloss seines verstorbenen Vaters in Schuss halten. Bei einer spiritistischen Sitzung meldet sich dessen Geist und spricht von einem sonderbaren Vermächtnis. Natürlich nehmen die drei ??? die Ermittlungen auf. Mit einem Gespenst; davon sind sie überzeugt; haben sie es nicht zu tun! Bis Peter von einer gruseligen schwarzen Hand ins Meer gezogen wird. Erst in letzter Sekunde kann er gerettet werden. Der Zweite Detektiv ahnt Unheilvolles: Wurde er von einem Wassergeist attackiert?'; 'Die drei ???; Folge 147\nGrusel auf Campbell Castle'; 'Veröffentlichungsdatum: 24.06.2011'; 'Erzähler - Thomas Fritsch\nJustus Jonas - Oliver Rohrbeck\nPeter Shaw - Jens Wawrczeck\nBob Andrews - Andreas Fröhlich\nAdam Campbell - Santiago Ziesmer\nHenry Campbell - Christian Rudolf\nJohn Taylor - Holger Umbreit\nEdward Crockett - Ben Hecker\nMrs. Harkort - Katja Brügger\nMr. Prescott - Stefan Kaminski\nSkinny Norris - Andreas von der Meden\nJack Leech - Volker Bogdan\nInspektor Cotta - Holger Mahlich\nGodween - André Minninger\nEinbrecher - Patrick Bach\nMax - Tommaso Cacciapuoti']
[148; 'und die feurige Flut'; 'Ein schwerer Fluch lastet auf Allie Jamison; einer alten Bekannten der drei ???. Jedenfalls ist sie davon überzeugt. Schon in der nächsten Vollmondnacht soll etwas Schlimmes geschehen! Es gibt nur einen Ausweg: Justus; Peter und Bob müssen ein alchemistisches Rätsel lösen - in nur 24 Stunden. Ihre fieberhaften Ermittlungen führen die drei Detektive in eine Welt von Zauberern und Wahrsagern. Als Justus jedoch in einen Hinterhalt gelockt wird; ist klar: Dieser Fall ist lebensgefährlich!'; 'Die drei ???; Folge 148\nund die feurige Flut'; 'Veröffentlichungsdatum: 19.08.2011'; 'ERZÄHLER - Thomas Fritsch\nJustus Jonas - Oliver Rohrbeck\nPeter Shaw - Jens Wawrczeck\nBob Andrews - Andreas Fröhlich\nAllie Jamison - Katrin Fröhlich\nInspektor Cotta - Holger Mahlich\nUrsula Burns - Birke Bruck\nEmerald Pendragon - Monty Arnold\nCarl Parsley - Peter Weis\nSunshine - Dagmar Dreke\n1. Mann - Tetje Mierendorf\n2. Mann - Gosta Liptow']
[149; 'Der namenlose Gegner'; 'In dem sonst so idyllischen Vorort Seven Pines droht ein Nachbarschaftskrieg auszuarten. Die aufgebrachten Anwohner bitten die drei ??? um Hilfe. Doch Bob wird bei einer nächtlichen Beschattungsaktion verletzt und verliert das Bewusstsein. Als er wieder zu sich kommt; weiß er nicht mehr; wer er ist! Das nutzt ein alter Feind der drei ??? gnadenlos aus. Während der dritte Detektiv nun auf unerwartete Abwege gerät; bekommen Justus und Peter es mit einem gefährlichen Gegner zu tun. Schnell wird aus einem scheinbar harmlosen Routinefall eine harte Probe für das berühmte Trio aus Rocky Beach - womöglich die härteste; die es für sie gegeben hat...'; 'Die drei ???; Folge 149\nDer namenlose Gegner'; 'Veröffentlichungsdatum: 30.09.2011'; 'Erzähler - Thomas Fritsch\nJustus Jonas - Oliver Rohrbeck\nPeter Shaw - Jens Wawrczeck\nBob Andrews - Andreas Fröhlich\nCynthia McGowan - Luise Lunow\nInspektor Cotta - Holger Mahlich\nMr. Andrews - Henry König\nMrs. Andrews - Konstanze Ullmer\nSkinny Norris - Andreas von der Meden\nMina Parker - Annabelle Krieg\nBrandon Fraser - Tim Grobe\nBeatrix Fraser - Sophie Lechtenbrink\nRoxy - Julia Fölster\nJosh - Volker Hanisch\nPaul - Tim Kreuer\nDavis - Frank Meyer-Brockmann']
[150; 'Geisterbucht'; 'Die drei ??? übernehmen und lösen (hoffentlich!) ihren 150sten Fall! In drei atemberaubenden Folgen sind sie dem Rätsel der Geisterbucht auf der Spur! Welches Geheimnis verbirgt sich hinter dem Testament; dass der exzentrische Harry Shreber kurz vor seinem Tod verfasst hat? Führen die verschlüsselten Verse tatsächlich zu Rashuras Schatz? (Teil A) Den drei Detektiven wird nichts anderes übrig bleiben: Sie müssen in Flammendes Wasser (Teil B) hinab tauchen; denn nur in der Tiefe des Meeres kann geklärt werden; warum Der brennende Kristall (Teil C) so viel Unglück über eine große Anzahl Menschen bringen konnte... Teil A: Rashuras Schatz Die drei berühmten Detektive aus Rocky Beach müssen ein Rätsel lösen; das ihnen der schrullige Harry Shreber in seinem Testament hinterlassen hat. Schnell finden sie heraus; dass der erste Hinweis in einem schrottreifen Flugzeug in Shrebers Garten versteckt sein könnte. Die Suche nach Rashuras Schatz beginnt - aber Justus; Peter und Bob sind bei weitem nicht die Einzigen; die das Rätsel lösen wollen... Teil B: Flammendes Wasser Die Spur zu Rashuras Schatz führt die drei ??? hoch in die Berge; tief unter die Erde und hinaus auf die offene See. Aber mit jedem Hinweis wird alles nur noch geheimnisvoller ? und gefährlicher! Ein Wettlauf mit der Zeit beginnt... Teil C: Der brennende Kristall Noch immer haben Justus; Peter und Bob das Rätsel aus dem Testament nicht lösen können. Welche Rolle spielen Moby Dick und der brennende Kristall? Die drei ??? begeben sich zur Geisterbucht; um das Geheimnis zu lüften. Doch sie sind nicht allein! Jeder pokert hoch in diesem Spiel; das nur einer gewinnen kann...'; 'Die drei ???; Folge 150\nGeisterbucht'; 'Veröffentlichungsdatum: 11.11.2011'; "Teil A\nErzähler - Thomas Fritsch\nJustus Jonas - Oliver Rohrbeck\nPeter Shaw - Jens Wawrczeck\nBob Andrews - Andreas Fröhlich\nFrank Mason - Wolfgang Condrus\nMiles Dempster - Stephan Benson\nMr. Sapchevsky - Andreas Schmidt-Schaller\nGerry - Kostja Ullmann\nIsmael - Stephan Schad\nCarla Fenton - Natalie O'Hara\nMrs. Maruthers - Ulrike Johannson\nInspektor Havilland - Oliver Kalkofe\nTaylor - Bernhard Hoecker\nInspektor Cotta - Holger Mahlich\nAngelica - Anna Thalbach\nSchwester 1 - Manuela Becker\nSchwester 2 - Traudel Sperber\nPfleger - Sven Dahlem\nTeil B\nErzähler - Thomas Fritsch\nJustus Jonas - Oliver Rohrbeck\nPeter Shaw - Jens Wawrczeck\nBob Andrews - Andreas Fröhlich\nMorton - Andreas von der Meden\nTaylor - Bernhard Hoecker\nMr. Smith - Tim Grobe\nCurtis Fisher - Tobias Schmidt\nAmrita Chakyar - Angela Stresemann\nInspektor Havilland - Oliver Kalkofe\nIsmael - Stephan Schad\nAngelica - Anna Thalbach\nSergeant Madhu - Olli Dittrich\nMr. Andrews - Henry König\nMrs. Andrews - Konstanze Ullmer\nFrank Mason - Wolfgang Condrus\nMr. Raffer - Harald Dietl\nFeuerwehrmann - Kai-Hendrik Möller\nKapitän - Sky du Mont\nTeil C\nErzähler - Thomas Fritsch\nJustus Jonas - Oliver Rohrbeck\nPeter Shaw - Jens Wawrczeck\nBob Andrews - Andreas Fröhlich\nMorton - Andreas von der Meden\nFrank Mason - Wolfgang Condrus\nTaylor - Bernhard Hoecker\nCurtis Fisher - Tobias Schmidt\nJohn Fisher - Dirk Bach\nGerry - Kostja Ullmann\nIsmael - Stephan Schad\nMr. Smith - Tim Grobe\nMrs. Maruthers - Ulrike Johannson\nAngelica - Anna Thalbach\nSergeant Madhu - Olli Dittrich\nMr. Castro - Jörg Gillner\nSanitäter - Robert Kottula\nAnudhara - Rosakutty Hemsing\nRuth - Gabriele Libbach"]
