[151; 'Schwarze Sonne'; 'Bei einem Malkurs lernt Bob den sympathischen und begabten Denzel Hopkins kennen. Der Mann wird plötzlich beschuldigt; ein wertvolles Gemälde gestohlen zu haben. Denzel beteuert; das Bild noch nie gesehen zu haben und unschuldig zu sein. Wie konnte er dann bereits in der Vergangenheit immer wieder ein zentrales Motiv aus diesem Bild malen - die schwarze Sonne? Die drei ??? müssen ihren gesamten detektivischen Spürsinn aufbieten; um diesen Fall zu lösen.'; 'Die drei ???; Folge 151\nSchwarze Sonne'; 'Veröffentlichungsdatum: 20.01.2012'; 'Erzähler - Thomas Fritsch\nJustus Jonas - Oliver Rohrbeck\nPeter Shaw - Jens Wawrczeck\nBob Andrews - Andreas Fröhlich\nLaurence Seinfeld - Wolf Frass\nDenzel Hopkins - Tilo Schmitz\nGoldie Hopkins - Madeleine Weingarten\nNeil Rockwell - Wanja Mues\nInspektor Cotta - Holger Mahlich\nMrs. Summer Hopkins - Regina Lemnitz\nBrooks; Galerist - Martin May\nMr. Elroy Follister - Stephan Schwartz\nMartha - Hanna Reisch\nDillon - Gregor Reisch\nWayne - Woody Mues\nGefängniswärter - Gosta Liptow\nWirt - Klaus Dittmann\nGreis - Jürgen Thormann\nBeamter - Monty Arnold\nTaxifahrer - Harald Dietl']
[152; 'Skateboardfieber'; 'Ein riesiges Skatertreffen findet in Rocky Beach statt. In der Stadt ist die Hölle los; und das nicht nur wegen des Skating-Events: Eine Reihe zwielichtiger Gestalten treibt sich in der Gegend herum; es fallen Schüsse; und niemand weiß genau; wer auf welcher Seite steht. Ein alter Fall der drei ??? spielt auf einmal wieder eine wichtige Rolle. Und ohne die Hilfe ihrer alten und neuen Freunde könnte dies der letzte Fall für einen der drei Detektive werden...'; 'Die drei ???; Folge 152\nSkateboardfieber'; 'Veröffentlichungsdatum: 02.03.2012'; 'Erzähler - Thomas Fritsch\nJustus Jonas - Oliver Rohrbeck\nPeter Shaw - Jens Wawrczeck\nBob Andrews - Andreas Fröhlich\nInspektor Cotta - Holger Mahlich\nBert Young - Horst Stark\nMrs. Johnson - Gabriele Libbach\nChapman - Sascha Rotermund\nTony - Reent Reins\nBlake - Wolfgang Rositzka\nMr. Andrews - Henry König\nRubbish George - Utz Richter\n1.Mann - Rasmus Borowski\n2.Mann - Jo Kappl\nVerkäufer - Marcus Schönhoff\nSunny - Rainer Schmitt\nFernsehr-Sprecher - Jannik Schümann\nBlacky - Heikedine Körting\nFrancesco - Anton Sprick']
[153; 'und das Fußballphantom'; 'Das Fußballstadion brodelt. Die Los Angeles Hawks spielen gegen die Philadelphia Tornados um den amerikanischen Highschool-Meisterschaftstitel. Peter gerät durch eine Fehlvermittlung zufällig in ein fremdes Handygespräch. Was er mithört; lässt ihm das Blut in den Adern gefrieren. Unversehens müssen die drei ??? einem gefährlichen Erpresser das Handwerk legen. Werden sie die seltsamen Rätsel des Fußballphantoms lösen können? Sie müssen. Das Leben eines Menschen draußen auf dem Spielfeld hängt davon ab.'; 'Die drei ???; Folge 153\nund das Fußballphantom'; 'Veröffentlichungsdatum: 13.04.2012'; "Erzähler - Thomas Fritsch\nJustus Jonas - Oliver Rohrbeck\nPeter Shaw - Jens Wawrczeck\nBob Andrews - Andreas Fröhlich\nSean O'Donnell - Till Demtröder\nAlexander Chilton - Rüdiger Schulzki\nMann im Stadion - Eric Förster\nOrdner - Matthias Treder\nFrau im Police Department - Corinna Wodrich\nMrs. Gardiner - Elisa Linnemann\nSekretärin - Susan Jarling\nInspektor Craig - Gustav-Adolph Artz\nTom Chilton - Christopher Arndt\nJunger Mann auf der Pier - Christian Senger\nJunge im Stadion - Johann Gutjahr\nLive-Kommentator - Ulli Potofski\nAnsager - Frank Wintjen\nFrau auf dem Pier - Katinka Körting"]
[154; 'Botschaft aus der Unterwelt'; 'Dank seiner unfehlbaren Kombinationsgabe hat Justus Jonas wieder einmal einen Fall der drei ??? im Handumdrehen gelöst. Doch kaum ist die Akte geschlossen; bekommen die drei Detektive Post von einem mysteriösen Klienten. Er benennt sich selbst nach Sherlock Holmes großem Erzfeind "Professor Moriarty" und beauftragt Justus; Peter und Bob; für ihn eine geheimnisvolle Botschaft zu entschlüsseln. Schon bald müssen die drei ??? erfahren; dass sie Figuren in einem gefährlichen Spiel sind: Onkel Titus wird verhaftet; Inspektor Cotta ist unerreichbar - und Moriarty scheint stets einen Schritt voraus zu sein. Aber Justus wäre nicht Justus; wenn er die Herausforderung nicht annehmen würde!'; 'Die drei ???; Folge 154\nBotschaft aus der Unterwelt'; 'Veröffentlichungsdatum: 18.05.2012'; 'Erzähler - Thomas Fritsch\nJustus Jonas - Oliver Rohrbeck\nPeter Shaw - Jens Wawrczeck\nBob Andrews - Andreas Fröhlich\nInspektor Cotta - Holger Mahlich\nTitus Jonas - Hans Meinhard\nTante Mathilda - Karin Lieneweg\nProf. Jane Heathcliff - Victoria von Trauttmansdorff\nKommissar Reynolds - Wolfgang Draeger\nMr. Grey - Urs Affolter\nLester Price - Fabian Harloff\nCinelly - Bernd Stephan\nMr. Monroe - Achim Schülke\nMiss Deborah Cassidy - Barbara Focke\nMr. Burke - Kai-Hendrik Möller\nMiss Trimble - Christine Pappert\nMr. Weston - Joachim Lautenbach\nNachbarin - Doris Maria Kaiser\nButler - Erik Schäffler\nGoodween - André Minninger\nMichael Kowalski - Tobias Schmidt\nJack - Leonhard Mahlich']
[155; 'und der Meister des Todes'; 'Das alte Haus an der Küste hat einst einem Marionettenspieler gehört. Der perfekte Drehort für ihren Horrorfilm; finden die drei ??? und ihre Schulkollegen aus dem Filmkurs. Schließlich hängen die unheimlichen Puppen immer noch an den Wänden. Als es in ihrer Nähe zu mysteriösen Ereignissen kommt; glauben Justus; Peter und Bob zunächst nicht an Magie. Doch dann gerät ausgerechnet einer der Detektive in den Bann einer düsteren Macht. Haben die Marionetten ihre Finger im Spiel? Oder zieht jemand anderes im Hintergrund die Fäden?'; 'Die drei ???; Folge 155\nund der Meister des Todes'; 'Veröffentlichungsdatum: 13.07.2012'; 'Erzähler - Thomas Fritsch\nJustus Jonas - Oliver Rohrbeck\nPeter Shaw - Jens Wawrczeck\nBob Andrews - Andreas Fröhlich\nZack Martin - Christian Stark\nMary-Ann Leigh - Manuela Bäcker\nLatona Johnson - Julia Hummer\nFrank Norman - Till Huster\nMrs. Robinson - Heidi Berndt\nAngela Sciutto - Gisela Fritsch\nFederico Sciutto - Rainer Fritzsche\nMr. Torrance - Ingo Feder\nFrau - Konstanze Ullmer\nKind - Undine Ullmer']
[156; 'Im Netz des Drachen'; 'Dragoncourt; das Anwesen des exzentrischen Spiele-Programmierers Stephen Baron; steht zum Verkauf. Der Mann ist schwer erkrankt und hat sich nach Europa zurückgezogen. Doch der mit dem Verkauf der Immobilie beauftragte Makler ist verzweifelt; denn seltsame Dinge geschehen auf Dragoncourt. Ganz klar: hier müssen die drei erfolgreichen Detektive aus Rocky Beach ermitteln! Die Recherchen führen Justus; Bob und Peter in die fantastische Welt des Online-Games "Im Land der Drachen". Und schnell wird aus einem scheinbar harmlosen Spiel eine tödliche Gefahr: Alles deutet darauf hin; dass die virtuellen Figuren den Weg in die Wirklichkeit gefunden haben und hier ihr Unwesen treiben...'; 'Die drei ???; Folge 156\nIm Netz des Drachen'; 'Veröffentlichungsdatum: 24.08.2012'; 'Erzähler - Thomas Fritsch\nJustus Jonas - Oliver Rohrbeck\nPeter Shaw - Jens Wawrczeck\nBob Andrews - Andreas Fröhlich\nRyan Holbrooke - Manfred Reddemann\nSheriff Pickett - Gerhart Hinze\nStephen Baron - Patrick Elias\nZyklon - Wolfgang Berger\nAl Dahab - Neil Malik\nFrau - Regine Lamster\nMatthew - Mike Olsowski\nInspektor Cotta - Holger Mahlich\nZabriski - Volker Bogdan\nFred - Oliver Mink']
[157; 'Im Zeichen der Schlangen'; 'Auf dem Schrottplatz laufen die Vorbereitungen für eine große Auktion auf Hochtouren. Plötzlich erscheint ein bedrohlicher Riese und beauftragt die drei Detektive mit einem geheimnisvollen Fall. Die Spur führt immer tiefer in längst vergangene Zeiten. Noch ahnen Justus; Peter und Bob nicht; dass sie schon bald in einen Strudel gefährlicher Ereignisse geraten werden. Doch mysteriöse Rätsel; nächtliche Beschatter; geisterhafter Rauch und ein bewaffnetes Phantom machen den drei ??? schnell klar; dass ihr ganzes Können gefordert ist; um nicht auf der Strecke zu bleiben. Nichts ist so; wie es auf den ersten Blick scheint...'; 'Die drei ???; Folge 157\nIm Zeichen der Schlangen'; 'Veröffentlichungsdatum: 28.09.2012'; 'Erzähler - Thomas Fritsch\nJustus Jonas - Oliver Rohrbeck\nPeter Shaw - Jens Wawrczeck\nBob Andrews - Andreas Fröhlich\nOnkel Titus - Hans Meinhardt\nRiese - Tilo Schmitz\nHunnicutt - Heinz Lieven\nSheila - Melanie Pukaß\nSkinny Norris - Andreas von der Meden\nInspektor Cotta - Holger Mahlich\nFelicity - Kari Erlhoff\nChester - Mike Olsowski\nGodween - André Minninger\nGizmo - Michael von Rospatt']
[158; 'und der Feuergeist'; 'Die privat geführte Oper Califia in Rocky Beach steht vor dem finanziellen Aus. So ist es nicht verwunderlich; dass die drei ??? zunächst an eine werbewirksame Veranstaltung glauben; als sich eine Mitarbeiterin der Oper Hilfe suchend an sie wendet: Im Gewölbekeller des Gebäudes gehen mysteriöse Dinge vor sich - und ein seltsames Wesen wurde gesichtet! Justus; Peter und Bob übernehmen den Fall und ahnen nicht; auf was sie sich da einlassen. Plötzlich bricht während einer Aufführung ein Großfeuer aus! War es Brandstiftung? Welche Rolle spielen dabei der undurchsichtige Moody Firthway und sein rotes Notizbuch? Nur Justus erkennt als Einziger; was sich tatsächlich hinter den Kulissen abspielt.'; 'Die drei ???; Folge 158\nund der Feuergeist'; 'Veröffentlichungsdatum: 30.11.2012'; 'Erzähler - Thomas Fritsch\nJustus Jonas - Oliver Rohrbeck\nPeter Shaw - Jens Wawrczeck\nBob Andrews - Andreas Fröhlich\nMichelle - Ulrike Stürzbecher\nRonald Pounder - Jürgen Kluckert\nMaurice Blight - Oliver Böttcher\nBetsy - Heidi Schaffrath\nIsabella - Isabel Navarro\nVladas Abakulow - Eric Schäffler\nMoody Firthway - Peter Striebeck\nPolizist - Mike Olsowski\nJenna - Konstanze Ullmer\n1. Mann - Olaf Kreutzenbeck\n2. Mann - Rainer Fritzsche\n3. Mann - Claus Fuchs\n4. Mann - Jannik Endemann']
[159; 'Nacht der Tiger'; "Wer ist der unbekannte Auftraggeber im neuen Fall der drei erfolgreichen Detektive aus Rocky Beach? Wie von Geisterhand erscheinen verschlüsselte Botschaften auf dem Computerbildschirm in der Zentrale. Justus' Ehrgeiz ist geweckt und die drei ??? beginnen zu ermitteln. Sie lösen die komplizierten Rätsel des Unbekannten und folgen seiner Spur. Dabei werden die drei Jungen immer tiefer in dubiose Machenschaften verstrickt. Als sich herausstellt; dass ein guter Freund von ihnen als Täter infrage kommt; stehen Justus; Peter und Bob vor einer schwierigen Entscheidung: Sollen sie ihren Freund ausliefern oder der Polizei die Wahrheit verschweigen? Justus fasst einen Plan - und die drei ??? entdecken das Unvorstellbare in der 'Nacht der Tiger'..."; 'Die drei ???; Folge 159\nNacht der Tiger'; 'Veröffentlichungsdatum: 11.01.2013'; 'Erzähler - Thomas Fritsch\nJustus Jonas - Oliver Rohrbeck\nPeter Shaw - Jens Wawrczeck\nBob Andrews - Andreas Fröhlich\nTante Mathilda - Karin Lieneweg\nOnkel Titus - Hans Meinhardt\nInspektor Cotta - Holger Mahlich\nCaroline Cotta - Michaela Mahlich\nMorton - Andreas von der Meden\nSergeant Donatelli - Peter Weis\n1. Mann - Robin Brosch\n2. Mann - Gerhart Hinze']
[160; 'Geheimnisvolle Botschaften'; 'Der Raub eines alten handgefertigten Buchs stellt die drei ??? vor ein Rätsel. Denn im Haus von Professor Mathewson hätte es weitaus wertvollere Beute gegeben. Kaum beginnen Justus; Peter und Bob zu ermitteln; stecken sie schon bis zum Hals in Schwierigkeiten: Ein geheimnisvoller Gegner ist ihnen stets einen Schritt voraus und schreckt vor nichts zurück...'; 'Die drei ???; Folge 160\nGeheimnisvolle Botschaften'; 'Veröffentlichungsdatum: 01.03.2013'; 'Erzähler - Thomas Fritsch\nJustus Jonas - Oliver Rohrbeck\nPeter Shaw - Jens Wawrczeck\nBob Andrews - Andreas Fröhlich\nBarbara - Tanja Geke\nProfessor Mathewson - Stephan Schwartz\nArthur - Stephan Benson\nAlan Jones - Wolfgang Pampel\nShu Liin - Monika Freisfeld-Pampel\nKellner - Sven Dahlem\nFrank - Simon Jäger\nStadtverwalter - Achim Schülke\nInspektor Cotta - Holger Mahlich\nGodween - André Minninger\nFeuerschlucker - Bertram Hiese']
[161; 'Die blutenden Bilder'; "Dreizehn geheimnisvolle Bilder sorgen auf dem Schrottplatz von Justus' Onkel Titus für allerhand Aufregung. Als sich eine ganze Reihe von zwielichtigen Gestalten für die Gemälde interessiert wittern die drei ??? einen Fall. Zu dumm; dass einige der Bilder bereits spurlos verschwunden sind. Justus; Peter und Bob müssen sich bei ihrer Suche beeilen; denn Rocky Beach wird von einem hinterhältigen Erpresser heimgesucht; der es ausgerechnet auf Kunstwerke abgesehen hat und eine mysteriöse Spur hinterlässt."; 'Die drei ???; Folge 161\nDie blutenden Bilder'; 'Veröffentlichungsdatum: 10.05.2013'; 'Erzähler - Thomas Fritsch\nJustus Jonas - Oliver Rohrbeck\nPeter Shaw - Jens Wawrczeck\nBob Andrews - Andreas Fröhlich\nTante Mathilda - Karin Lieneweg\nGreenwalt - Harald Dietl\nBrock - Guido A. Schick\nDeforge - Bruno F. Apitz\nMrs. Kretchmer - Monika Werner\nMrs. Espenson - Karin Eckhold\nMrs. Wondratschek - Ela Nitzsche\nMrs. Field - Celine Fontanges\nInspektor Cotta - Holger Mahlich\nMr. Harris - Lutz Harder']
[162; 'und der schreiende Nebel'; 'Als die drei ??? Post von einem alten Bekannten erhalten; ahnen sie noch nicht; was für ein gefährliches Abenteuer sie erwartet. Der rätselhafte Hilferuf führt sie mitten in die Einöde von South Dakota. Dort werden sie Zeugen unfassbarer Ereignisse; die eine abgelegene Prärie-Ortschaft heimsuchen. Welches dunkle Geheimnis steckt hinter dem unheimlichen Nebel; der die Einwohner in Angst und Schrecken versetzt? Und was hat es mit den grässlichen Schreien auf sich; die immer wieder aus den weißen Schwaden dringen? Die drei Detektive nehmen die Ermittlungen auf - und geraten selbst in die Fänge des Nebels.'; 'Die drei ???; Folge 162\nund der schreiende Nebel'; 'Veröffentlichungsdatum: 12.07.2013'; 'Erzähler - Thomas Fritsch\nJustus Jonas - Oliver Rohrbeck\nPeter Shaw - Jens Wawrczeck\nBob Andrews - Andreas Fröhlich\nProf. Arnold Brewster - Horst Naumann\nMiss Daggett - Ingeborg Christiansen\nHold - Christian Rode\nHank Tornby - Edgar Hoppe\nMike Cobble - Gordon Piedesack\nMartin Ishniak - Erkki Hopf\nSamuel Cobble - Eckart Dux\nWilliam Prescott - Eberhard Haar\nJim Sesto - Gustav-Adolph Artz']
[163; 'und der verschollene Pilot'; "Eigentlich sollen die drei ??? für Onkel Titus nur ein Auto überführen. Doch der dichte Nebel in den Bergen zwingt sie; sich dort eine Unterkunft zu suchen. Ein seltsamer Pick-up-Fahrer führt sie zum 'King of the Mountain'; einem heruntergekommenen Hotel ohne einen einzigen Gast. Bald geschehen seltsame Dinge; die nur eins bedeuten können: Das Hotel birgt ein Geheimnis. Hat das Wrack eines vor Jahren in den Bergen abgestürzten Flugzeugs etwas damit zu tun?"; 'Die drei ???; Folge 163\nund der verschollene Pilot'; 'Veröffentlichungsdatum: 30.08.2013'; 'Erzähler - Thomas Fritsch\nJustus Jonas - Oliver Rohrbeck\nPeter Shaw - Jens Wawrczeck\nBob Andrews - Andreas Fröhlich\nFynch - Stefan Benson\nInspektor Cotta - Holger Mahlich']
[164; 'Fußball-Teufel'; 'Eigentlich wollen Die drei ??? am Felsen Hookes Nose nur nach einem verschwundenen Hund suchen; doch schon bald taucht ein düsterer Mann mit Pferdefuß auf. Ist der Hooked Nose wirklich ein verfluchter Ort; an dem der Teufel umgeht? Und was hat der junge Fußballer Lenni Carson mit dem Geheimnis des Felsens zu tun? Müssen es Justus; Peter und Bob bei ihren Ermittlungen diesmal wirklich mit dem Teufel persönlich aufnehmen?'; 'Die drei ???; Folge 164\nFußball-Teufel'; 'Veröffentlichungsdatum: 04.10.2013'; 'Erzähler - Thomas Fritsch\nJustus Jonas - Oliver Rohrbeck\nPeter Shaw - Jens Wawrczeck\nBob Andrews - Andreas Fröhlich\nInspektor Cotta - Holger Mahlich\nLenni - Tim Kreuer\nJohn Greyfox - Douglas Welbat\nClay Carson - Krystian Martinek\nWalter - Achim Schülke\nFreddy Hays - Woody Mues\nTrainer - Bruno F. Apitz\nMann - Wolfram Winfried\nJunge - Francesco Nieheim\nSpieler - Carsten Kausse']
[165; 'Im Schatten des Giganten'; 'Die drei ??? begleiten Mr. Andrews auf eine Recherche-Reise in den Yosemite National Park. Doch anstatt sich zu erholen; finden sich Justus; Bob und Peter plötzlich mitten in einem hochgefährlichen Fall wieder: Einer von ihnen wird angeschossen; im Wald geben mysteriöse Blutspuren Rätsel auf und die drei Detektive machen einen schrecklichen Fund. Schließlich kommt es am Half Dome; dem großen Granitfelsen im Park; zu einer Kletterpartie auf Leben und Tod...'; 'Die drei ???; Folge 165\nIm Schatten des Giganten'; 'Veröffentlichungsdatum: 29.11.2013'; 'Erzähler - Thomas Fritsch\nJustus Jonas - Oliver Rohrbeck\nPeter Shaw - Jens Wawrczeck\nBob Andrews - Andreas Fröhlich\nMr. Andrews - Henry König\nRandy - Marek Harloff\nJeanne - Katja Brügger\nGinette - Birte Kretschmer\nTara - Angela Roy\nSteven - Robert Steudtner\nRanger Thornton - Detlef Bierstedt\nMr. Louis - Rüdiger Schulzki\nBusfahrer - Volker Bogdan\nLindsey - Susan Jarling\nReporter - Daniel Welbat']
[166; 'und die brennende Stadt'; 'Ex-Kommissar Reynolds stattet den drei Detektiven einen Besuch ab. Es geht um das rätselhafte Testament seines Bruders; das Justus; Peter und Bob für ihren alten Freund entschlüsseln sollen. Ehe sie sich`s versehen; stecken die drei ??? mitten in einem brandheißen Fall; der ihren vollen Einsatz verlangt. Denn das Erbe ruft düstere Gestalten auf den Plan - und die schrecken vor nichts zurück...'; 'Die drei ???; Folge 166\nund die brennende Stadt'; 'Veröffentlichungsdatum: 17.01.2014'; 'Erzähler - Thomas Fritsch\nJustus Jonas - Oliver Rohrbeck\nPeter Shaw - Jens Wawrczeck\nBob Andrews - Andreas Fröhlich\nKommissar Reynolds - Wolfgang Draeger\nMr. Bennet - Sven Dahlem\nMrs. Dearing - Saskia Weckler\nConrad Nash - Rüdiger Schulzki\nFrau - Elga Schütz']
[167; 'und das blaue Biest'; 'Im Film-Erlebnispark Movie Empire gehen seltsame Dinge vor sich. Ein Unbekannter verübt hinterhältige Sabotage-Akte und bringt damit die Shows und Besucher in Gefahr. Aber wem könnte daran gelegen sein; den Park zu ruinieren? Als wäre das nicht genug; taucht immer wieder ein blau schimmerndes Monstrum auf; das einem mythischen Mantikor ähnelt. Furchtlos nehmen die drei ??? die Ermittlungen auf. Bis sie eines Nachts plötzlich dem Biest gegenüberstehen!'; 'Die drei ???; Folge 167\nund das blaue Biest'; 'Veröffentlichungsdatum: 21.02.2014'; 'Erzähler - Thomas Fritsch\nJustus Jonas - Oliver Rohrbeck\nPeter Shaw - Jens Wawrczeck\nBob Andrews - Andreas Fröhlich\nAndy Carson - Stefan Schwade\nMrs. Hampton - Celine Fontanges\nNicky DeLores - Morgens von Gadow\nMiss Woodrow - Karin Abicht\nJudy Nigel - Angela Stresemann\nDirektor Grayston - Jörg Gillner\nGregory Katic - Oliver Böttcher\nMr. Clark - Stefan Brentle\nTarzan - Sascha Draeger\nMädchen - Nicola Melissian\nInspektor Cotta - Holger Mahlich\nMr. Callister - Ingo Feder\nLionel Pengrim - Robert Missler\nNed - Bruno Ploeger']
[168; 'GPS-Gangster'; 'Die drei ??? kommen zu spät: Sie können die Prinzessin nicht vor der Katastrophe retten! Zum Glück ist es nur ein Geocaching-Wettbewerb; bei dem Justus; Peter und Bob ihr Ziel um Haaresbreite verfehlen. Doch aus dem Spiel wird gefährlicher Ernst; als der geheimnisvolle Captain Skull auf der Bildfläche erscheint. Auf seinem Raubzug durch Rocky Beach spielt er ein rätselhaftes Katz- und- Maus-Spiel mit der Polizei. Wird er über Leichen gehen? Können die Detektive den Wettlauf mit der Zeit gewinnen?'; 'Die drei ???; Folge 168\nGPS-Gangster'; 'Veröffentlichungsdatum: 02.05.2014'; 'Erzähler - Thomas Fritsch\nJustus Jonas - Oliver Rohrbeck\nPeter Shaw - Jens Wawrczeck\nBob Andrews - Andreas Fröhlich\nDeborah - Gabi Libbach\nCotta - Holger Mahlich\nSamuel Rodman - Christian Concillio\nBenjamin Rodman - Henning Karge\nVallery Flockheart - Caroline Kiesewetter\nNigel Tillerman - Lutz Mackensy\nJosh Reilly - Nicholas Müller\nLexington - Sascha Eigner\nReporter - Rasmus Borowski\nJournalistin - Nicola Melissian\nPrescott - Rolf Becker\nSergeant Morales - Peter Weis\nMr. Arvidson - Gosta Liptow\nMrs. Arvidson - Hedy Haase\nMann - Andreas Becker']
[169; 'Die Spur des Spielers'; 'Bei einer Versteigerung auf dem Schrottplatz von Onkel Titus kommt ein scheinbar wertloses Schachspiel für eine ungeheure Summe unter den Hammer. Kurze Zeit später wird das Spiel gestohlen – ein neuer Fall für die drei ???! Welches Geheimnis birgt das Spiel? Wem hat es gehört? Die Zeit drängt; denn Justus; Peter und Bob sind nicht die Einzigen; die das Rätsel lösen wollen. Und nicht jede Figur in diesem Spiel ist das; was sie zu sein scheint...'; 'Die drei ???; Folge 169\nDie Spur des Spielers'; 'Veröffentlichungsdatum: 04.07.2014'; 'Erzähler - Thomas Fritsch\nJustus Jonas - Oliver Rohrbeck\nPeter Shaw - Jens Wawrczeck\nBob Andrews - Andreas Fröhlich\nOnkel Titus - Hans Meinhardt\nTante Mathilda - Karin Lieneweg\nBradley - Nico König\nBishop Blake - Wolf Frass\nJunge Frau - Heikedine Körting\nDerek - Tim Helssen\nMrs. Kretschmer - Monika Werner\nChastity - Undine Ullmer\nCharity - Kassandra Ullmer\nSam Chiccarelli - Astrid Kollex\nGriffin Silverman - Stephan Schad\nInspektor Cotta - Holger Mahlich']
[170; 'Straße des Grauens'; 'Ex-Kommissar Reynolds wurde entführt! Justus; Peter und Bob machen sich sofort auf die Spur des Täters. Der der verbietet ihnen jeglichen Kontakt zur Polizei; schickt ihnen ein Paket mit fragwürdigem Inhalt und lässt ihnen seltsame Hinweise zukommen. Durch die glühende Hitze der Wüste jagen die drei ??? ihren ruchlosen Gegner. Und dann verschwindet auch noch Bob! Wie weit werden die Detektive gehen; um ihre Freunde zu retten?'; 'Die drei ???; Folge 170\nStraße des Grauens'; 'Veröffentlichungsdatum: 29.08.2014'; 'Erzähler - Thomas Fritsch\nJustus Jonas - Oliver Rohrbeck\nPeter Shaw - Jens Wawrczeck\nBob Andrews - Andreas Fröhlich\nTante Mathilda - Karin Lieneweg\nKommissar Reynolds - Wolfgang Draeger\nMitch Palmer - Michael Lott\nDimitri - Manou Lubowski\nRoy - Gosta Liptow\nBoss - Henry König\nCindy - Konstanze Ullmer\nMike - Oliver Böttcher\nWirt - Peter Lakenmacher\nRockford - Christian Senger\nCasino-Besucher - Robin Bosch\nCasino-Besucherin - Brigitte Böttrich\nRezeption 1 - Dorothea Lott\nRezeption 2 - Marco Spina\nFernfahrer - Tilman Madaus\nPutzfrau - Maria Baptista']
[171; 'und das Phantom aus dem Meer'; 'In einem beschaulichen Küstenort unweit von Rocky Beach passieren seltsame Dinge: Eine Gestalt erhebt sich aus dem Meer und versetzt die Strandbesucher in Angst und Schrecken. Ein ruheloser Geist; der auf Rache sinnt? Die drei ??? fangen an zu ermitteln. Ob der neue Bewohner des alten Leuchtturms etwas damit zu tun hat? Oder der kauzige Seebär am Hafen? Justus; Peter und Bob gehen keiner Gefahr aus dem Weg; um das Netz aus Lügen zu entwirren.'; 'Die drei ???; Folge 171\nund das Phantom aus dem Meer'; 'Veröffentlichungsdatum: 03.10.2014'; 'Erzähler - Thomas Fritsch\nJustus Jonas - Oliver Rohrbeck\nPeter Shaw - Jens Wawrczeck\nBob Andrews - Andreas Fröhlich\nHarry Salas - Pat Murphy\nVanessa Goodstein - Simone Ritscher\nEliah Cristobal - Stephan Schwartz\nAlbert Goodstein - Manfred Reddemann\nBen Kramer - Jan-Christof Kick\nFiona Kramer - Lilian Körting\nWirt - Harald Halgardt\nJimmy Blue Eye - Ulli Potofski\n1. Mann - Achim Schülke\n2. Mann - Fabian Harloff\nFrau - Saskia Weckler\nRosaria - Gela del Este\nSilvie - Katharina von Keller\nJessy - Manuela Bäcker\nSergeant - Alexander Stamm\nPolizist - Gordon Piedesack\nRikuo Yamamoto - Toru Takahashi']
[172; 'und der Eisenmann'; 'Auf einer einsamen Insel stoßen die drei ??? auf den Künstler Drago Martinez. Der hat großen Erfolg mit seinem einzigartigen Werk Eisenmann. Doch die Freude darüber ist kurz: Drago wird verfolgt und fürchtet um sein Leben! Steckt ein verrückter Kunstliebhaber dahinter? Offenbar sind die drei Freunde der Lösung zu nahe; denn jemand lockt sie in einen Hinterhalt...'; 'Die drei ???; Folge 172\nund der Eisenmann'; 'Veröffentlichungsdatum: 28.11.2014'; 'Erzähler - Thomas Fritsch\nJustus Jonas - Oliver Rohrbeck\nPeter Shaw - Jens Wawrczeck\nBob Andrews - Andreas Fröhlich\nInspektor Cotta - Holger Mahlich\nDrago Martinez - Konstantin Graudus\nFred Osborne - Erik Schäffler\nCecile Jezero - Sandra Quadflieg\nDeborah - Kornelia Lüdorff\nShort - Manfred Liptow\nAnthony - Lutz Harder\nGodween - André Minninger\nHeavy Metal - Iris Rufner\nArthur Pepper - Frank Thannhäuser']
[173; 'Dämon der Rache'; 'Bei einer Ballonfahrt entdeckt Peter in der Nähe einer abgelegenen Villa ein Monster – eindeutig ein neuer Fall für die drei ???! Ihre Ermittlungen führen die Detektive zur seltsamen Mrs Pembroke und ihrem Neffen Luke. Die beiden werden von der grässlichen Gestalt bedroht. Luke bittet Justus; Peter und Bob um Hilfe. Doch schnell wird klar: Der Dämon der Rache ist nicht aufzuhalten...'; 'Die drei ???; Folge 173\nDämon der Rache'; 'Veröffentlichungsdatum: 16.01.2015'; "Erzähler - Thomas Fritsch\nJustus Jonas - Oliver Rohrbeck\nPeter Shaw - Jens Wawrczeck\nBob Andrews - Andreas Fröhlich\nRupert - Udo Schenk\nLuke - Daniel Kirchberger\nGwendolyn Pembroke - Aranka Mamero\nLance Vaughn - Rainer Schmitt\n'The Destroyer' - Stephan Schad\nDarby Farnham - Christine Jensen\nEarl Forrester - Tobias Schmidt\nAlvin Cray - Michael Bideller\nMr. Lloyd - Lutz Mackensy"]
